item_id,title,category_id,category_path,aspect_count,status
256508244407,"Gold Rush Sifting Classifier Screen Sieve Mini 6 Inch Prospect Pan",15913,"Collectibles|Science & Medicine (1930-Now)|Mining|Equipment",3,OK
256508244410,"Jumbo 6.5"" XL Carabiner Key Chain  - Purple",52373,"Clothing, Shoes & Accessories|Men|Men's Accessories|Key Chains, Rings & Cases",12,OK
256508244417,"Beille Black BBQ Grill Accessories Reusable Non Stick Grilling Mats 13x15"" 2pk",20725,"Home & Garden|Yard, Garden & Outdoor Living|Outdoor Heating, Cooking & Eating|Barbecue Tools",14,OK
256508244422,"Gear Aid Wash-In Odor Eliminator - 1 Gallon",27363,"Sporting Goods|Camping & Hiking|Hiking Gear|Other Hiking Gear",7,OK
256508244425,"Universal Tool Texturising Hammer Dual Face Square Stripe Patterns Wooden Handle",262020,"Jewelry & Watches|Jewelry Care, Design & Repair|Jewelry Tools & Workbenches",10,OK
256508244429,"Basic Pottery Kit Clay Molding Hobby Arts and Craft Tool Set for Beginners 8pc",116496,"Crafts|Sculpting, Molding & Ceramics|Ceramics & Pottery|Pottery Tools & Sets",6,OK
256508244430,"Large Translucent Waterproof Camping Storage Container -  5.5 Inch",181415,"Sporting Goods|Camping & Hiking|Outdoor Survival Gear|Other Outdoor Survival Gear",13,OK
256508244435,"(2 Piece) ASR Outdoor Plastic Funnel Set with Key Chains for Camping Hiking",178055,"Home & Garden|Kitchen, Dining & Bar|Kitchen Tools & Gadgets|Funnels",14,OK
256508244448,"Magnifying Tweezer 4X Magnification for Gold Prospecting Mining",15913,"Collectibles|Science & Medicine (1930-Now)|Mining|Equipment",2,OK
256508244454,"ASR Outdoor Emergency Poncho Green Polyethylene Rain Gear Camping One Size",181415,"Sporting Goods|Camping & Hiking|Outdoor Survival Gear|Other Outdoor Survival Gear",14,OK
256508244456,"Shear Scissors Blades Sharp Heat Treated Thread Nipper 4.25 inches",28171,"Crafts|Sewing|Cutting Tools|Dressmaker's Scissors & Shears",9,OK
256508244457,"ASR Outdoor Extendable Marshmallow Toaster Telescoping BBQ Fork Camping Utensil",20725,"Home & Garden|Yard, Garden & Outdoor Living|Outdoor Heating, Cooking & Eating|Barbecue Tools",13,OK
256508244458,"Survival Multi-Purpose Paracord Rope Black - 100 ft",177902,"Sporting Goods|Tactical & Duty Gear|Other Tactical & Duty Gear",8,OK
256508244466,"Outdoor Thermal Mat Heat Reflective Sleeping Pad Insulated Winter Chill",36114,"Sporting Goods|Camping & Hiking|Outdoor Sleeping Gear|Air Mattresses & Sleeping Pads",11,OK
256508244468,"10pc Sterile Surgical Grade Replacement Scalpel Blades Universal Fit - Size 11",104229,"Business & Industrial|Healthcare, Lab & Dental|Handpieces & Instruments|Scalpels, Surgical Blades & Handles",8,OK
256508244478,"Universal Tool Damaged Screw Extractor Set - 4 Pieces Assorted Sizes",50382,"Home & Garden|Tools & Workshop Equipment|Power Tool & Air Tool Accessories|Drill Bits",12,OK
256508244481,"Survival Multi-Purpose Paracord Rope Reflective Tracer Orange - 100ft",177902,"Sporting Goods|Tactical & Duty Gear|Other Tactical & Duty Gear",7,OK
256508244500,"Universal Water Bottle Holder With Blue Aluminum Carabiner Clip Attachment",50814,"Sporting Goods|Outdoor Sports|Climbing & Caving|Carabiners & Hardware",8,OK
256508244506,"Precision Jeweler Eye Glasses Flat Tip Screw Driver - 7pc",262020,"Jewelry & Watches|Jewelry Care, Design & Repair|Jewelry Tools & Workbenches",6,OK
256508244508,"Tri Fold Steel Shovel Multi Functional Outdoor Use 23 Inch",178983,"Home & Garden|Yard, Garden & Outdoor Living|Garden Hand Tools & Equipment|Shovels",13,OK
256508244509,"ToolTreaux Diamond Coated Cutting Burrs Set Assorted Rotary Tools 12pc 150 Grit",260207,"Home & Garden|Tools & Workshop Equipment|Power Tool & Air Tool Accessories|Rotary Tool Accessories",13,OK
256508244543,"Safety Disposable Vest High Visibility One Size Fits Most Lime Green",88433,"Everything Else|Every Other Thing",4,OK
256476123885,"GEAR AID Revivex Down Cleaner and Wash for Jackets and Sleeping Bags, 10 fl oz",259621,"Home & Garden|Household Supplies & Cleaning|Cleaning Products",11,OK
256476123930,"Universal Tool Professional Power Extension Socket Bits for Drills 3pc Set",50382,"Home & Garden|Tools & Workshop Equipment|Power Tool & Air Tool Accessories|Drill Bits",13,OK
256508250506,"Survival Multi-Purpose Paracord Rope OD Green- 100 ft",177902,"Sporting Goods|Tactical & Duty Gear|Other Tactical & Duty Gear",8,OK
256508701414,"SE GP-MT415-1GR 12” x 36” Grey Miner’s Moss (Sluice Box Matting)",15913,"Collectibles|Science & Medicine (1930-Now)|Mining|Equipment",4,OK
256508701447,"ASR Outdoor Telescopic BBQ Fork 2 Prong Outdoor Cooking Utensil - 3 Pack",20725,"Home & Garden|Yard, Garden & Outdoor Living|Outdoor Heating, Cooking & Eating|Barbecue Tools",13,OK
256508701474,"Set of 4 Non-Stick BBQ Grill Mats Reusable Easy to Clean",20725,"Home & Garden|Yard, Garden & Outdoor Living|Outdoor Heating, Cooking & Eating|Barbecue Tools",12,OK
256508701517,"3/16"" File Chain Saw Blade Diamond Sharpening Burr Shank 120 Grit",85915,"Home & Garden|Yard, Garden & Outdoor Living|Outdoor Power Equipment|Chainsaw Parts",14,OK
256509144716,"Universal Handy Helpers Fruit and Vegetable Peeler Dishwasher Safe (2 Colors)",20641,"Home & Garden|Kitchen, Dining & Bar|Kitchen Tools & Gadgets|Peelers & Slicers",10,OK
256509144739,"Sapphire Nail File Manicure Pedicure Tool Beauty and Personal Care",178960,"Health & Beauty|Nail Care, Manicure & Pedicure|Nail Care Tools|Electric Files & Tools",10,OK
256509144757,"GEAR AID Tenacious Tape Patches Vinyl, Fabric Repair, Clear, 3"" x 5"" Patches",177895,"Sporting Goods|Tactical & Duty Gear|Tactical Patches",10,OK
256509144778,"GEAR AID 1 Gallon Revivex Odor Eliminator for Tents, Footwear and Sports Gear",27363,"Sporting Goods|Camping & Hiking|Hiking Gear|Other Hiking Gear",8,OK
256443890038,"Black 14 Inch Gold Mining Pan for Gold Prospecting 2 Riffle Types",15913,"Collectibles|Science & Medicine (1930-Now)|Mining|Equipment",3,OK
256510041675,"7 in 1 Survival Whistle Multi-Case with LED Flashlight Compass Mirror - Green",181415,"Sporting Goods|Camping & Hiking|Outdoor Survival Gear|Other Outdoor Survival Gear",11,OK
256510041680,"GEAR AID Revivex Suede, Nubuck and Fabric Boot Care Kit with Protector Spray",27362,"Sporting Goods|Camping & Hiking|Clothing|Other Camping, Hiking Clothing",5,OK
256510041695,"SE AB12 Acid Brush Set, 1/2""",183161,"Crafts|Home Arts & Crafts|Woodworking|Other Woodworking Supplies",7,OK
256510041696,"ASR Outdoor 9 in 1 Multitool Folding Pocket Knife with G10 Handle, Black",75236,"Sporting Goods|Camping & Hiking|Camping Knives & Tools|Multi-Tools",12,OK
256510041697,"GEAR AID Seam Grip FC Fast Cure Sealant for Tents, Clear, 2 fl oz",183125,"Crafts|Multi-Purpose Craft Supplies|Adhesives & Tape|Other Adhesives & Tape",9,OK
256510041710,"32 Sheet Disappearing Notebook Dissolving Message Note Pad - Reflection Paper",20164,"Business & Industrial|Office|Office Supplies|Paper Products|Note Pads",9,OK
256510041712,"GEAR AID Revivex Suede Protector, Water Repellent for Shoe, Boots, 4 fl oz, 2pk",8504,"Sporting Goods|Camping & Hiking|Other Camping & Hiking",7,OK
256510041714,"Embroidery Shears Sewing Tailors Sharp Scissors Craft and Hobby Kelly Angular",101915,"Health & Beauty|Salon & Spa Equipment|Scissors & Shears",8,OK
256510041719,"16ft High Visibility Marking Ribbon PVC Material Outdoor Layout - Neon Green",8504,"Sporting Goods|Camping & Hiking|Other Camping & Hiking",8,OK
256510041721,"Sports Belt 8 Inch Expanding Pocket Black Reflective Strips Running Hiking",158951,"Sporting Goods|Fitness, Running & Yoga|Clothing & Accessories|Safety & Reflective Gear",13,OK
256510041723,"ASR Outdoor ASRO85GSS-359 Sand Scoop for Metal Detecting",163824,"Business & Industrial|Test, Measurement & Inspection|Test Meters & Detectors|Metal Detector Accessories",8,OK
256510041735,"KidPlay Karaoke Keyboard - Blue",64602,"Musical Instruments & Gear|Karaoke Entertainment|Karaoke Systems",8,OK
256510041750,"SE GP3-RG60 Prospector's Choice Gold Panning Rubber Gloves",15913,"Collectibles|Science & Medicine (1930-Now)|Mining|Equipment",4,OK
256510041753,"GEAR AID Anti-Fog Spray for All Goggles, Masks and Eyewear, 0.5 fl oz",27362,"Sporting Goods|Camping & Hiking|Clothing|Other Camping, Hiking Clothing",6,OK
256510041759,"SE Prospector’s Choice Pocket Sized Sluice Box - GP-SB36PT",15913,"Collectibles|Science & Medicine (1930-Now)|Mining|Equipment",4,OK
256510041765,"GEAR AID Revivex Boot, Shoe Cleaner, Leather Suede Fabric, Concentrated, 4 fl oz",28133,"Crafts|Leathercrafts|Leathercraft Tools|Other Leather Tools",7,OK
256510041773,"Metal Detector 12"" Serrated Edge Digger, Garden Weed Lawn Mower Tool",118867,"Home & Garden|Yard, Garden & Outdoor Living|Garden Hand Tools & Equipment|Garden Tool Sets",16,OK
256510041789,"GEAR AID Hip Adjust Buckle, 1"", 1.5"", Black",181379,"Sporting Goods|Camping & Hiking|Hiking Backpacks|Backpacks",13,OK
256510041808,"Home Essentials Nail Files Buffers Emery Boards Beauty Tools Set Mani Pedi 18pc",11872,"Health & Beauty|Nail Care, Manicure & Pedicure|Nail Care Tools|Manicure & Pedicure Tools & Kits",11,OK
256510047585,"Universal Rechargeable Phone Stand Table Lamp Touch Switch 120 Lumen",112581,"Home & Garden|Lamps, Lighting & Ceiling Fans|Lamps",15,OK
256510047588,"Water Resistant Storage Belt Waist Travel Pouch Adjustable Buckle",98968,"Travel|Travel Accessories|Money Belts & Wallets",6,OK
256510047589,"Exfoliating Bath Mitt Shower Loofah Accessory - White",45452,"Baby|Bathing & Grooming|Health & Grooming",8,OK
256510047590,"24 Piece set ASR Outdoor Gun Cleaning Kit Brass Punches Brushes and Patches",22700,"Sporting Goods|Hunting|Gun Smithing & Maintenance|Cleaning Supplies",13,OK
256510047592,"GEAR AID Revivex Rubber Boot Treatment and Neoprene Protector, 4 fl oz",8504,"Sporting Goods|Camping & Hiking|Other Camping & Hiking",8,OK
256510047593,"Gray Duct Tape 2 Inch Wide High Quality Adhesive Gear - 30ft Roll",183125,"Crafts|Multi-Purpose Craft Supplies|Adhesives & Tape|Other Adhesives & Tape",7,OK
256510047596,"GEAR AID Care Kit with Revivex Pro Cleaner and Durable Water Repellent Spray",8504,"Sporting Goods|Camping & Hiking|Other Camping & Hiking",6,OK
256510047597,"Seam Grip SIL Silicone Sealant and Silnylon Patches for Silnylon Tents and Tarps",36120,"Sporting Goods|Camping & Hiking|Tents & Canopies|Tent & Canopy Accessories",11,OK
256510047607,"ASR Outdoor 66pc Pistol Cleaning Kit In Zippered Shell Case",22700,"Sporting Goods|Hunting|Gun Smithing & Maintenance|Cleaning Supplies",13,OK
256510047608,"GEAR AID 1 Gallon Revivex Down Cleaner Deep Wash for Jackets and Sleeping Bags",27363,"Sporting Goods|Camping & Hiking|Hiking Gear|Other Hiking Gear",7,OK
256510047609,"Universal Hobby Cutting Mat 5""x9"" Self-Repairing - Green",16507,"Crafts|Stamping & Embossing|Tools & Equipment",6,OK
256510047611,"100 PC Emergency Waterproof First Aid Dry Sack Kit Camping Outdoors",75035,"Health & Beauty|Health Care|First Aid|Kits & Bags",13,OK
256510047616,"GEAR AID Care Kit with Pro Cleaner,Water Repellent Spray and Mini Patches",8504,"Sporting Goods|Camping & Hiking|Other Camping & Hiking",7,OK
256510047618,"Universal 5pc Hobby Tweezer Set Stainless Steel",122718,"Crafts|Multi-Purpose Craft Supplies|Crafting Tools|Craft Tweezers",7,OK
256510047619,"GEAR AID Zipper Pulls, Backpack Bag Repair, Set of 2",8504,"Sporting Goods|Camping & Hiking|Other Camping & Hiking",7,OK
256510047623,"American Flag Non-Slip Gun and Electronics Cleaning Mat Washable 18 Inch",177907,"Sporting Goods|Hunting|Range & Shooting Equipment|Other Range & Shooting Equipment",8,OK
256510047624,"Universal Tool Cloth Polishing Buff Wheel 2 Inch Diameter Soft Muslin",42266,"Home & Garden|Tools & Workshop Equipment|Power Tools|Buffers & Polishers",12,OK
256510047628,"GEAR AID Strap Tender for 1"" Webbing",36109,"Sporting Goods|Camping & Hiking|Hiking Backpacks|Other Camping & Hiking Backpacks",14,OK
256510047646,"GEAR AID Sea Drops Anti-fog and Cleaner for Dive and Snorkel Masks, 1.25 fl oz",71161,"Sporting Goods|Water Sports|Scuba & Snorkeling|Masks",7,OK
256510047648,"GEAR AID Revivex Pro Cleaner Wash for GORE-TEX Jackets Tents Outdoor Gear, 1 Gal",27363,"Sporting Goods|Camping & Hiking|Hiking Gear|Other Hiking Gear",7,OK
256510047655,"Key Chain ID Pill Holder Plastic Coated Interior O Ring Cap (Assorted Colors)",75041,"Health & Beauty|Health Care|Pill Boxes, Pill Cases",10,OK
256510047656,"ToolTreaux Hook and Pick Precision Automotive Tool Set Puller Removers 6 Pieces",303,"Home & Garden|Tools & Workshop Equipment|Hand Tools|Other Hand Tools",13,OK
256510047660,"GEAR AID Silicone Grease, Rubber Conditioner and Lubricant for Dive Gear 0.25 oz",29574,"Sporting Goods|Water Sports|Wetsuits & Drysuits|Other Wetsuits & Drysuits",7,OK
256510047661,"GEAR AID Care Kit with Pro Cleaner, Wash-In Water Repellent and Mini Patches",8504,"Sporting Goods|Camping & Hiking|Other Camping & Hiking",6,OK
256510047684,"Universal Fit Unisex Lab Safety Goggles Eye Protection, Adult Size",67019,"Business & Industrial|Facility Maintenance & Safety|Personal Protective Equipment (PPE)|Safety Glasses & Goggles",7,OK
256510047690,"Fingerlings Secret Diary Girls Journal Set",45112,"Business & Industrial|Office|Office Supplies|Calendars & Planners|Blank Diaries & Journals",6,OK
256510047693,"Durable Portable Work Light Indoor Outdoor Multi Use Black 750 Lumen",183393,"Home & Garden|Yard, Garden & Outdoor Living|Outdoor Lighting|Security & Floodlights",14,OK
256510047695,"5pc Universal Tweezer Set Stainless Steel, 5""",122718,"Crafts|Multi-Purpose Craft Supplies|Crafting Tools|Craft Tweezers",7,OK
256510047696,"Ceramic Non-Metal Micro Striker Create Sparks Emergency Fire Starter",166126,"Sporting Goods|Camping & Hiking|Outdoor Survival Gear|Fire Starters",13,OK
256510047702,"GEAR AID 550 Paracord and Carabiner 7 Strand Utility Camping, Reflective, 100 ft",50816,"Sporting Goods|Outdoor Sports|Climbing & Caving|Ropes, Cords & Slings",6,OK
256510047704,"GEAR AID Wash-in Water Repellent, Concentrated Formula for Outerwear, 10 fl oz",27362,"Sporting Goods|Camping & Hiking|Clothing|Other Camping, Hiking Clothing",6,OK
256510047719,"ASR Outdoor Elastic Shock Cord Natural Rubber 30 Feet 3mm Diameter - Black",109492,"Business & Industrial|Fasteners & Hardware|Clamps, Ties & Cords|Shock Cords & Bungees",11,OK
256510047916,"GEAR AID 550 Paracord and Carabiner 7 Strand Utility, Camping, Reflective, 30 ft",50816,"Sporting Goods|Outdoor Sports|Climbing & Caving|Ropes, Cords & Slings",6,OK
256510047921,"Universal Tool Ice Tempered S Steel Salon Hairdressing Barber Scissor 5.5 inch",101915,"Health & Beauty|Salon & Spa Equipment|Scissors & Shears",12,OK
256510047923,"SE JT114RS 10"" Aluminum Ring Stick",262020,"Jewelry & Watches|Jewelry Care, Design & Repair|Jewelry Tools & Workbenches",6,OK
256510047925,"Recurved Blade Machete with Zigzag Serrated Spine and Paracord Handle 15""",73522,"Collectibles|Knives, Swords & Blades|Collectible Fixed Blade Knives|Modern Fixed Blade|Factory Manufactured",6,OK
256510047926,"ToolTreaux Beauty Tool Kit Nail Clipper Brush Eyelash Curler Pore Cleaner - 9pc",11872,"Health & Beauty|Nail Care, Manicure & Pedicure|Nail Care Tools|Manicure & Pedicure Tools & Kits",12,OK
256510047928,"GEAR AID Tenacious Tape Mesh Patches for Tent and Bug Screen Repair, 3"" Rounds",36120,"Sporting Goods|Camping & Hiking|Tents & Canopies|Tent & Canopy Accessories",10,OK
256510047937,"GEAR AID Wetsuit Cleaner and Conditioner for Neoprene, Concentrated, 10 fl oz",1300,"Sporting Goods|Water Sports|Scuba & Snorkeling|Other Scuba & Snorkeling",7,OK
256510047945,"Spatula Wax Carver Ceramic Pottery Double Ended Tool Set",183319,"Crafts|Sculpting, Molding & Ceramics|Other Sculpting Supplies",7,OK
256510047946,"Universal Tool Ice Tempered S Steel Salon Hairdressing Barber Scissor 7.5 inch",101915,"Health & Beauty|Salon & Spa Equipment|Scissors & Shears",12,OK
256510047954,"Hanging Cinema String Light Boxes - 90 Characters, 20 Boxes",183394,"Home & Garden|Yard, Garden & Outdoor Living|Outdoor Lighting|String Lights",12,OK
256510047955,"Home Essentials Manicure Pedicure Foot Scrubber Foot File Callus Remover - Blue",11872,"Health & Beauty|Nail Care, Manicure & Pedicure|Nail Care Tools|Manicure & Pedicure Tools & Kits",11,OK
256510047956,"GEAR AID 325 Paracord and Carabiner, 3mm Utility Cord for Camping & Hiking, 50ft",50816,"Sporting Goods|Outdoor Sports|Climbing & Caving|Ropes, Cords & Slings",7,OK
256510047965,"GEAR AID Revivex Odor Eliminator for Tents, Footwear and Sports Gear, 2 fl oz",260134,"Home & Garden|Household Supplies & Cleaning|Laundry Supplies|Detergents, Softeners & Stain Removers",8,OK
256510047966,"100 Pieces Self Locking Plastic Bags 2mm Thick All Purpose Storage Various Sizes",43504,"Home & Garden|Household Supplies & Cleaning|Home Organization|Storage Bags",11,OK
256510047969,"High Speed Steel Step Drill Bits Locking Hex Shank Assorted - 3pc",50382,"Home & Garden|Tools & Workshop Equipment|Power Tool & Air Tool Accessories|Drill Bits",12,OK
256510047977,"Mini Stackable Classifier Screen Sifting Pan, 40 Holes/Square Inch",15913,"Collectibles|Science & Medicine (1930-Now)|Mining|Equipment",3,OK
256510047983,"Instant Fire Starter Outdoor Survival Magnesium Compact Striking Stick",100237,"Sporting Goods|Camping & Hiking|Camping Knives & Tools|Other Camping Knives & Tools",8,OK
256510047987,"JoJo Siwa Brush Buddies Kids Toothbrush Ultra Soft Bristles with Plastic Cap",67421,"Health & Beauty|Oral Care|Standard Toothbrushes",11,OK
256510047992,"GEAR AID Quick Dry Microfiber Towel for Travel, Camping and Sports, L, 30"" x 50""",181398,"Sporting Goods|Camping & Hiking|Camping Hygiene & Sanitation|Camping Towels",8,OK
256510047994,"GEAR AID Akua Blunt Tip Paddle Knife with 3"" Serrated Blade and Sheath, Black",29577,"Sporting Goods|Water Sports|Scuba & Snorkeling|Knives",6,OK
256510047998,"ToolTreaux 10 Watt Mini Glue Gun and Hot Glue Sticks Crafting Supplies Kit, 15pc",183124,"Crafts|Multi-Purpose Craft Supplies|Adhesives & Tape|Glue Guns & Sticks",8,OK
256510048002,"Flexible Plastic Kitchen Cutting Board 12 Inch x 15 Inch - 4pk",46282,"Home & Garden|Kitchen, Dining & Bar|Kitchen Tools & Gadgets|Cutting Boards",12,OK
256510048004,"GEAR AID Sea Buff Dive Mask and Slate Cleaner, 1.25 fl oz",29574,"Sporting Goods|Water Sports|Wetsuits & Drysuits|Other Wetsuits & Drysuits",5,OK
256510048006,"SE GP-MT415-2GG 12” x 36” Green Miner’s Moss (Sluice Box Matting)",15913,"Collectibles|Science & Medicine (1930-Now)|Mining|Equipment",3,OK
256510048011,"GEAR AID Ellipse Cord Locks, Black, Orange",181379,"Sporting Goods|Camping & Hiking|Hiking Backpacks|Backpacks",13,OK
256510048012,"ASR Outdoor First Aid Bug Out Emergency Light Mylar Foil Space Blanket",181412,"Sporting Goods|Camping & Hiking|Outdoor Survival Gear|Emergency Blankets",15,OK
256510048021,"Beille Rubber 4 in 1 Non Slip Multipurpose Adjustable Easy Grip Jar Opener Tool",20688,"Home & Garden|Kitchen, Dining & Bar|Bar Tools & Accessories|Corkscrews & Openers",12,OK
256510048023,"GEAR AID Dual Adjust Replacement Buckle Kit, Various Sizes, Multi-pack",181379,"Sporting Goods|Camping & Hiking|Hiking Backpacks|Backpacks",11,OK
256510048028,"12PC Universal Tool Acid Brush Set 6 Inch Metal Handle for Acid Glue Paste",183161,"Crafts|Home Arts & Crafts|Woodworking|Other Woodworking Supplies",8,OK
256510048035,"Tooltreaux High Speed Stainless Steel Drill Bits Set 1.05 to 2mm 15 Pieces",50382,"Home & Garden|Tools & Workshop Equipment|Power Tool & Air Tool Accessories|Drill Bits",13,OK
256510048036,"GEAR AID UV Protectant and Conditioner for Plastic, Vinyl, Rubber, Nylon 4 fl oz",159151,"Sporting Goods|Water Sports|Other Water Sports",7,OK
256510048037,"Universal Rubber Head Clamps 3 Inch Secure Lever Lock Metal Body Outdoor 1pk",88433,"Everything Else|Every Other Thing",3,OK
256510048039,"ToolTreaux 10X Jewelers Loupe 25mm Diameter Glass Lens Magnifier Plastic",262020,"Jewelry & Watches|Jewelry Care, Design & Repair|Jewelry Tools & Workbenches",10,OK
256510048040,"GEAR AID Aquaseal FD and Tenacious Tape Kit for Wader and Vinyl Repair, 0.25 oz",177876,"Sporting Goods|Hunting|Clothing, Shoes & Accessories|Waders",8,OK
256510048041,"SE GP3-PD55 Prospector's Choice Plastic Disposable Droppers (50 PC.)",15913,"Collectibles|Science & Medicine (1930-Now)|Mining|Equipment",4,OK
256510048042,"Hiking Companion Whistles Emergency Survival Tools 105 dB Rating",181414,"Sporting Goods|Camping & Hiking|Outdoor Survival Gear|Safety Whistles",12,OK
256510048045,"GEAR AID Revivex Down Care Kit w/ Down Cleaner, Water Repellent, Repair Patches",8504,"Sporting Goods|Camping & Hiking|Other Camping & Hiking",9,OK
256510048046,"16ft High Visibility Marking Ribbon - Red",8504,"Sporting Goods|Camping & Hiking|Other Camping & Hiking",8,OK
256510048047,"Disney Pixar Incredibles 2 Personalized Pencils Hero Super Star Awesome 6 Pack",102953,"Home & Garden|School Supplies|Pens & Pencils",9,OK
256510048055,"Universal Home 100 Count 4"" Cable Wire Hose Zip Ties",57007,"Business & Industrial|Fasteners & Hardware|Clamps, Ties & Cords|Cable Ties",13,OK
256510048061,"GEAR AID Revivex Odor Eliminator for Tents, Footwear and Sports Gear, 10 fl oz",29574,"Sporting Goods|Water Sports|Wetsuits & Drysuits|Other Wetsuits & Drysuits",7,OK
256510048062,"Portable UV Black Light with LED Flashlight Verify IDS Passports Cards",16037,"Sporting Goods|Camping & Hiking|Flashlights, Lanterns & Lights|Flashlights",26,OK
256510048063,"SE GP-MT415-3BL 12” x 36” Blue Miner’s Moss (Sluice Box Matting)",15913,"Collectibles|Science & Medicine (1930-Now)|Mining|Equipment",3,OK
256510048067,"GEAR AID Revivex Down Care Kit for Outdoors, Down Cleaner and Repair Patches",8504,"Sporting Goods|Camping & Hiking|Other Camping & Hiking",7,OK
256510048070,"GEAR AID Dual Snap Bar Buckle, 1"", Black",36109,"Sporting Goods|Camping & Hiking|Hiking Backpacks|Other Camping & Hiking Backpacks",14,OK
256510048082,"Universal Hobby Automatic Spring Loaded Center Punch Brass Body Hole Marker",50380,"Home & Garden|Tools & Workshop Equipment|Hand Tools|Punches",13,OK
256510048092,"GEAR AID Snap Hooks, Set of 2, Black",8504,"Sporting Goods|Camping & Hiking|Other Camping & Hiking",7,OK
256510048094,"SE JT-GT26 Small Precious Metal Testing Stone",262020,"Jewelry & Watches|Jewelry Care, Design & Repair|Jewelry Tools & Workbenches",7,OK
256510048102,"ASR Outdoor Slim 3-Stage Headlamp Ultrabright 150 Lumen COB Flood Light",106984,"Sporting Goods|Camping & Hiking|Flashlights, Lanterns & Lights|Headlamps",14,OK
256444840061,"Aluminum Colored Carabiner Key Chain Spring Clip Medium Size Assorted Colors 6pk",50814,"Sporting Goods|Outdoor Sports|Climbing & Caving|Carabiners & Hardware",8,OK
256510608071,"GEAR AID Aquaseal UV Adhesive for Instant Wader and Drysuit Repair, 0.25 oz",27362,"Sporting Goods|Camping & Hiking|Clothing|Other Camping, Hiking Clothing",7,OK
256376275265,"GEAR AID Seam Grip WP Field Repair Kit for Tents and Outdoor Gear, Clear 0.25 oz",36120,"Sporting Goods|Camping & Hiking|Tents & Canopies|Tent & Canopy Accessories",10,OK
256511081582,"GEAR AID Tent Waterproofing Spray and Sealer for Nylon Tents, Fast Cure Kit",36120,"Sporting Goods|Camping & Hiking|Tents & Canopies|Tent & Canopy Accessories",9,OK
257016930958,"GEAR AID Sea Gold Anti-Fog Gel Coating for SCUBA Dive Masks, 1.25 fl oz",71161,"Sporting Goods|Water Sports|Scuba & Snorkeling|Masks",7,OK
256446183294,"Gear Aid Revivex Durable Water Proofing Pro Cleaner Combo Kit 10oz",310,"Sporting Goods|Other Sporting Goods",8,OK
256446183296,"Mini Classifier Screen Sifting Pan, 20 Holes/Square Inch",15913,"Collectibles|Science & Medicine (1930-Now)|Mining|Equipment",4,OK
256446183297,"GEAR AID Tenacious Tape Reflective, Jackets, Outdoor Gear, 3"" x 20"", Silver",36120,"Sporting Goods|Camping & Hiking|Tents & Canopies|Tent & Canopy Accessories",10,OK
256446183331,"GEAR AID Care Kit with Revivex Pro Cleaner & 16oz Durable Water Repellent Spray",8504,"Sporting Goods|Camping & Hiking|Other Camping & Hiking",7,OK
256446183341,"GEAR AID Revivex Pro Cleaner for GORE-TEX Jackets, Tents, Outdoor Gear, 10 fl oz",27362,"Sporting Goods|Camping & Hiking|Clothing|Other Camping, Hiking Clothing",6,OK
256446183347,"GEAR AID Revivex Cleaner & Conditioner for BCD SCUBA and Dive Equipment 10 fl oz",29574,"Sporting Goods|Water Sports|Wetsuits & Drysuits|Other Wetsuits & Drysuits",6,OK
256446183378,"Aluminum Folding Sluice Box for Gold Prospecting Carpet Miners Moss",15913,"Collectibles|Science & Medicine (1930-Now)|Mining|Equipment",3,OK
256446183403,"4 Pack Universal Tool Tempered Steel Salon Hairdressing Barber Scissor 5.5 inch",101915,"Health & Beauty|Salon & Spa Equipment|Scissors & Shears",12,OK
256446183412,"GEAR AID Revivex Leather Water Repellent for Shoes and Boots, 4 fl oz",259189,"Home & Garden|Home Improvement|Building & Hardware|Paint, Stain & Varnish|Sealants & Waterproofers",8,OK
256446183413,"GEAR AID Seam Grip Silicone Sealant for Silnylon Tents and Tarps, Clear 1.5 oz",8504,"Sporting Goods|Camping & Hiking|Other Camping & Hiking",7,OK
256446183433,"Gold Prospecting Fixed ABS 3 Riffle 30-inch Gold Sluice Box for Gold Panning",163824,"Business & Industrial|Test, Measurement & Inspection|Test Meters & Detectors|Metal Detector Accessories",8,OK
256446183453,"GEAR AID Tenacious Tape Silnylon Patches for Silicone Tent, Tarp Repair, 3""x5""",36120,"Sporting Goods|Camping & Hiking|Tents & Canopies|Tent & Canopy Accessories",10,OK
256446183460,"Deluxe 9 Piece Wood Burning Pen Tool Hobby & Craft Kit",183150,"Crafts|Home Arts & Crafts|Woodworking|Wood Burning Pens",6,OK
256446183485,"GEAR AID Quick Dry Microfiber Towel for Travel, Camping, Sports, XL, 35” x 62”",181398,"Sporting Goods|Camping & Hiking|Camping Hygiene & Sanitation|Camping Towels",8,OK
256446183505,"GEAR AID Tenacious Tape Wildlife Patches for Jackets, Tent, Gear Repair 3"" x 20""",36120,"Sporting Goods|Camping & Hiking|Tents & Canopies|Tent & Canopy Accessories",10,OK
