fillability,category_id,aspect,mode,item_id,sku,name,approved_value,reviewer_notes,allowed_values,title
easy,3628,"Character Family",FREE_TEXT,256525915807,SON-J65XCKCWHGB-XL-BL-2,"Jumbo 6.5"" XL Carabiner Key Chain With Hand Grip - Blue",,,"Dragon Ball Z | Gundam | Lost in Space | Minions | Pokémon","ASR Outdoor Jumbo Carabiner - 6.5"" Dark Blue"
easy,3628,Theme,FREE_TEXT,256525915807,SON-J65XCKCWHGB-XL-BL-2,"Jumbo 6.5"" XL Carabiner Key Chain With Hand Grip - Blue",,,"Advertising | Animal | Awareness | Brewery | Buildings & Monuments | Cartoons & Characters | Celebrity | Celestial & Horoscope | Cowboys & Western | Famous Place | Flags & Political | Floral | Food & Wine | Gambling/Casino | Hobbies & Crafts | Holiday | Letters, Numbers & Symbols | Love & Hearts ...","ASR Outdoor Jumbo Carabiner - 6.5"" Dark Blue"
easy,7306,"Handle Material",FREE_TEXT,256525915800,NPT-8INPOCKETKNIFE-EAG,"ASR Outdoor Back Lock Folding American Eagle Pocket Knife Collectible Gift, 8 inch",,,"Carbon Steel | Ceramic | Kydex | Leather | Metal | Nylon | Plastic | Rubber | Stainless Steel | Steel | Titanium | Wood","ASR Outdoor 8"" Eagle Head Pocket Knife"
easy,20661,Character,FREE_TEXT,256525915872,SON-15CPHTFMM-MED-BRWN,"Hardwood Handled 15"" Goldsmith Crucible Pot Holder With Adjustable Steel Tongs",,,"Batman | Elmo | Freddy Krueger | Jack Skellington | Maleficent | Mickey Mouse | Minnie Mouse | Spider-Man | Stitch | Thanos","Hardwood Handled 15"" Goldsmith Crucible Pot Holder With Adjustable Steel Tongs"
easy,20661,"Character Family",FREE_TEXT,256525915872,SON-15CPHTFMM-MED-BRWN,"Hardwood Handled 15"" Goldsmith Crucible Pot Holder With Adjustable Steel Tongs",,,"Batman | Ben 10 | Benjamin Blümchen | Beyblade | Bibi & Tina | Bibi Blocksberg | Bob the Builder | Care Bears | Cars | Chuggington | Die Sendung mit der Maus | Disney | Doctor Who | Dora the Explorer | Fireman Sam | Gummi Bears | Hannah Montana | Harry Potter | Heidi | High School Musical | Maya ...","Hardwood Handled 15"" Goldsmith Crucible Pot Holder With Adjustable Steel Tongs"
easy,20661,Occasion,FREE_TEXT,256525915872,SON-15CPHTFMM-MED-BRWN,"Hardwood Handled 15"" Goldsmith Crucible Pot Holder With Adjustable Steel Tongs",,,"Anniversary | Apology | Baby Shower | Bar Mitzvah | Birthday | Christmas | Congratulations | Easter | Engagement | Funeral | Get Well | Good Luck | Halloween | International Women's Day | Labor Day | Mother's Day | Multipurpose | New Home | Party | Retirement | Romance | Surprise | Sympathy | Tha...","Hardwood Handled 15"" Goldsmith Crucible Pot Holder With Adjustable Steel Tongs"
easy,20661,Pattern,FREE_TEXT,256525915872,SON-15CPHTFMM-MED-BRWN,"Hardwood Handled 15"" Goldsmith Crucible Pot Holder With Adjustable Steel Tongs",,,"Abstract | Animal Print | Birds | British Flag | Buffalo Check | Checked | Chevron | Chicken | Circles | Crocheted | Dotted | Fish | Flag Print | Flamingo | Floral | Fruit | Geometric | Gingham | Glitter | Hearts | Hemstitch | Jacquard | Mandala | Nature Print | Paisley | Patchwork | Pictorial | ...","Hardwood Handled 15"" Goldsmith Crucible Pot Holder With Adjustable Steel Tongs"
easy,20661,Style,FREE_TEXT,256525915872,SON-15CPHTFMM-MED-BRWN,"Hardwood Handled 15"" Goldsmith Crucible Pot Holder With Adjustable Steel Tongs",,,"African | Antique | Art Deco | Art Nouveau | Arts & Crafts/Mission | Baroque/Rococo | Bauhaus | British Colonial | Celtic | Chippendale | Classic | Colonial | Contemporary | Country | Ethnic | Farmhouse | French Country | Gothic | Hollywood Regency | Indian | Kazak | Kilim | Kurdish | Lodge | Med...","Hardwood Handled 15"" Goldsmith Crucible Pot Holder With Adjustable Steel Tongs"
easy,20661,Theme,FREE_TEXT,256525915872,SON-15CPHTFMM-MED-BRWN,"Hardwood Handled 15"" Goldsmith Crucible Pot Holder With Adjustable Steel Tongs",,,"Angels | Animals | Animals & Bugs | Ballerinas | Baseball | Basketball | Beach | Bee | Beetlejuice | Belle | Bird | Birthday & Occasions | Bohemian Fashion | Boxing | Butterflies | Cactus | Cars | Cartoons | Cats & Kittens | Chinese Fashion | Christmas | Christmas Train | Christmas Tree | Circus ...","Hardwood Handled 15"" Goldsmith Crucible Pot Holder With Adjustable Steel Tongs"
easy,20688,Character,FREE_TEXT,256510048021,SON-JAROPENER-BJ094,"Beille Rubber 4 in 1 Non Slip Multipurpose Adjustable Easy Grip Jar Opener Tool",,,"Abbey Bominable | Clawful","Beille Rubber 4 in 1 Non Slip Multipurpose Adjustable Easy Grip Jar Opener Tool"
easy,20688,"Character Family",FREE_TEXT,256510048021,SON-JAROPENER-BJ094,"Beille Rubber 4 in 1 Non Slip Multipurpose Adjustable Easy Grip Jar Opener Tool",,,"101 Dalmatians | Spider-Man | Sports | Star Wars","Beille Rubber 4 in 1 Non Slip Multipurpose Adjustable Easy Grip Jar Opener Tool"
easy,20688,Occasion,FREE_TEXT,256510048021,SON-JAROPENER-BJ094,"Beille Rubber 4 in 1 Non Slip Multipurpose Adjustable Easy Grip Jar Opener Tool",,,"All Occasions | Birthday | Christmas | Halloween | Wedding","Beille Rubber 4 in 1 Non Slip Multipurpose Adjustable Easy Grip Jar Opener Tool"
easy,20688,Theme,FREE_TEXT,256510048021,SON-JAROPENER-BJ094,"Beille Rubber 4 in 1 Non Slip Multipurpose Adjustable Easy Grip Jar Opener Tool",,,"Wild Animals","Beille Rubber 4 in 1 Non Slip Multipurpose Adjustable Easy Grip Jar Opener Tool"
easy,20725,"Handle Material",FREE_TEXT,256508244379,SON-BGMN-LG-BLCK,"BBQ Grill Mat Non-Stick Heavy Duty Outdoor Patio Eating and Cooking Tools - 2Pk",,,"Aluminum | Cast Iron | Ceramic | Plastic | Stainless Steel | Steel | Wood","BBQ Grill Mat Non-Stick Heavy Duty Outdoor Patio Eating and Cooking Tools - 2Pk"
easy,20725,"Handle Material",FREE_TEXT,256508244417,SON-BLE-BBQMATS-BLK-2PC,"Beille Black BBQ Grill Accessories Reusable Non Stick Grilling Mats 13 x 15 Inch, 2pk",,,"Aluminum | Cast Iron | Ceramic | Plastic | Stainless Steel | Steel | Wood","Beille Black BBQ Grill Accessories Reusable Non Stick Grilling Mats 13x15"" 2pk"
easy,20725,"Handle Material",FREE_TEXT,256508701474,ASR-SO4BGMN-BUN-2PC-2PK-LG-BLCK,"Set of 4 Non-Stick BBQ Grill Mats Reusable Easy to Clean",,,"Aluminum | Cast Iron | Ceramic | Plastic | Stainless Steel | Steel | Wood","Set of 4 Non-Stick BBQ Grill Mats Reusable Easy to Clean"
easy,20725,"Number in Pack",FREE_TEXT,256508244457,SON-BFTOUMT-MED-BLCK,"ASR Outdoor Barbecue Fork Extendable Metal Dual Prong Fire Cooking Utensil",,,"2 | 3 | 4 | 5 | 6 | 7 | 8 | 9 | 10 | 11 | 12 | 13 | 14 | 15 | 16 | 17 | 18 | 19 | 20","ASR Outdoor Extendable Marshmallow Toaster Telescoping BBQ Fork Camping Utensil"
easy,20763,"Handle Material",FREE_TEXT,256525915782,SON-OEHWPASBC-2,"Orange Emergency Hammer Window Punch and Seat Belt Cutter",,,"ABS | ABS Plastic | Aluminum | Carbon Steel | Cast Iron | CFRP | Concrete | Epoxy Resin | Fiberglass | Forged Steel | Galvanized Steel | GRP | Hardwood | Iron | Latex | Metal | Neodymium | Nylon | Plastic | Polypropylene | Polystyrene | PVC | Rubber | Stainless Steel | Steel | Titanium | Wood","Orange Emergency Hammer Window Punch and Seat Belt Cutter"
easy,20763,"Handle Material",FREE_TEXT,256525915928,SON-STONEHAMMER-10IN-HPNR,"SE 8372SH Stone Hammer, 10""",,,"ABS | ABS Plastic | Aluminum | Carbon Steel | Cast Iron | CFRP | Concrete | Epoxy Resin | Fiberglass | Forged Steel | Galvanized Steel | GRP | Hardwood | Iron | Latex | Metal | Neodymium | Nylon | Plastic | Polypropylene | Polystyrene | PVC | Rubber | Stainless Steel | Steel | Titanium | Wood","SE 8372SH Stone Hammer, 10"""
easy,20763,"Number of Pieces",FREE_TEXT,256525915928,SON-STONEHAMMER-10IN-HPNR,"SE 8372SH Stone Hammer, 10""",,,"1 | 2 | 3 | 4 | 5 | 6 | 16 | 22","SE 8372SH Stone Hammer, 10"""
easy,28171,"Blade Material",FREE_TEXT,256525915885,SON-5FT60IRTSMT,"Retractable Sewing Tape Measure 60 inch Tailor Seamstress for Arts and Crafts",,,"Aluminum | Metal Alloy | Plastic | Stainless Steel | Steel | Titanium","Retractable Sewing Tape Measure 60 inch Tailor Seamstress Accessory"
easy,29509,"Number in Pack",FREE_TEXT,256525915904,SON-FLEXIDUSTER-GRN,"Extendable Flexible Feather Duster For Home And Office Cleaning - Green",,,"1 | 2 | 3 | 4 | 5 | 6 | 7 | 8 | 9 | 10 | 15 | 20 | 25 | 30 | 35 | 40","Extendable Flexible Feather Duster For Home And Office Cleaning - Green"
easy,29509,Theme,FREE_TEXT,256508244348,SON-DTCBAU-12PC-SML-WHT-2,"(12 Pack) Disposable Towels Compact Compressed Biodegradable and Unscented",,,,"Disposable Towels Compact Compressed Biodegradable and Unscented - 12 Pack"
easy,29509,Theme,FREE_TEXT,256525915904,SON-FLEXIDUSTER-GRN,"Extendable Flexible Feather Duster For Home And Office Cleaning - Green",,,,"Extendable Flexible Feather Duster For Home And Office Cleaning - Green"
easy,36109,Closure,FREE_TEXT,256510047628,MCN-STRAP-TENDER-AMZN,"GEAR AID Strap Tender for 1"" Webbing",,,"Buckle | Button | Hook & Loop | Magnetic | Snap | Toggle | Zip","GEAR AID Strap Tender for 1"" Webbing"
easy,36109,Season,SELECTION_ONLY,256510047628,MCN-STRAP-TENDER-AMZN,"GEAR AID Strap Tender for 1"" Webbing",,,"Fall | Spring | Summer | Winter","GEAR AID Strap Tender for 1"" Webbing"
easy,36109,Season,SELECTION_ONLY,256510048070,MCN-MGARBDSB-1-BLCK,"GEAR AID Dual Snap Bar Buckle, 1""",,,"Fall | Spring | Summer | Winter","GEAR AID Dual Snap Bar Buckle, 1"", Black"
easy,36120,"Number in Pack",FREE_TEXT,256446183297,MCN-MTRFT-3X20E-PARENT,"GEAR AID Tenacious Tape Reflective, Jackets, Outdoor Gear, 3"" x 20"", Silver",,,"1 | 2 | 3 | 4 | More Than 4","GEAR AID Tenacious Tape Reflective, Jackets, Outdoor Gear, 3"" x 20"", Silver"
easy,36120,"Number in Pack",FREE_TEXT,256446183453,MCN-TTAPE-SILNYLON-3X5-PARENT,"GEAR AID Tenacious Tape Silnylon Patches for Silicone Tent and Tarp Repair, 3""x5""",,,"1 | 2 | 3 | 4 | More Than 4","GEAR AID Tenacious Tape Silnylon Patches for Silicone Tent, Tarp Repair, 3""x5"""
easy,36120,"Number in Pack",FREE_TEXT,256446183505,MCN-TENTAPE-GEARPATCHES-PARENT,"Gear Aid Tenacious Tape Gear Patches for Jacket, Tent and Outerwear Repair, 3"" x 20""",,,"1 | 2 | 3 | 4 | More Than 4","GEAR AID Tenacious Tape Wildlife Patches for Jackets, Tent, Gear Repair 3"" x 20"""
easy,36120,"Number in Pack",FREE_TEXT,256470618745,MCN-REFLTTAPEPATCH-PARENT,"GEAR AID Tenacious Tape Reflective Patches for Jackets, Outdoor Gear, Silver",,,"1 | 2 | 3 | 4 | More Than 4","GEAR AID Tenacious Tape Reflective Patches for Jackets, Outdoor Gear, Silver"
easy,36120,"Number in Pack",FREE_TEXT,256495157311,MCN-MTCARTRC-5FT-CLR-PARENT,"GEAR AID Tenacious Tape Repair and Seam Tape for Tents and Vinyl",,,"1 | 2 | 3 | 4 | More Than 4","GEAR AID Tenacious Tape Repair for Tents and Vinyl, Clear Roll, 1.5""x 60"""
easy,36120,"Number in Pack",FREE_TEXT,256510047928,MCN-MBMPRK-STD-PARENT,"GEAR AID Tenacious Tape Mesh Patches for Tent and Bug Screen Repair, 3"" Rounds",,,"1 | 2 | 3 | 4 | More Than 4","GEAR AID Tenacious Tape Mesh Patches for Tent and Bug Screen Repair, 3"" Rounds"
easy,36120,"Number in Pack",FREE_TEXT,256514435510,MCN-TTAPEREPAIRPATCHES-AMZ-PARENT,"GEAR AID Tenacious Tape Mini Patches to Repair Jackets, Tents and Rain Gear, 1.5""x2.5""",,,"1 | 2 | 3 | 4 | More Than 4","GEAR AID Tenacious Tape No-Sew Mini Repair Patches for Jackets, Tents 1.5""x2.5"""
easy,36120,"Number in Pack",FREE_TEXT,256515004658,MCN-SEAMGRIP-TF-PARENT,"Gear Aid Seam Grip TF Tent Fabric Sealer for Waterproofing",,,"1 | 2 | 3 | 4 | More Than 4","GEAR AID Seam Grip TF Tent Fabric Sealer for Waterproofing, Clear, 4 fl oz"
easy,39057,"Blade Material",FREE_TEXT,256508244300,SON-RKBRPRBF8828HK-12PC-SML-SLVR,"10pc Razor Knife Blade Refill Pack Replacement Blades for 8828 Hobby Knife",,,"Aluminum | Bi-Metal | Carbon Steel | Ceramic | High Carbon Steel | Metal | Plastic | Stainless Steel | Steel","Razor Knife Blade Refill Pack Replacement Blades for 8828 Hobby Knife 10pc"
easy,39057,"Handle Material",FREE_TEXT,256508244300,SON-RKBRPRBF8828HK-12PC-SML-SLVR,"10pc Razor Knife Blade Refill Pack Replacement Blades for 8828 Hobby Knife",,,"ABS | ABS Plastic | Alloy Steel | Aluminum | CFRP | Concrete | Epoxy Resin | Galvanized Steel | GRP | Hardwood | Iron | Latex | Metal | Neodymium | Nylon | Plastic | Polypropylene | Polystyrene | PVC | Rubber | Stainless Steel | Steel | Titanium | Wood","Razor Knife Blade Refill Pack Replacement Blades for 8828 Hobby Knife 10pc"
easy,39057,"Handle Material",FREE_TEXT,256525915724,UNV-UHAOUKK-BUN-6PK-S-ASSRTD,"6 Pack Utility Knives Home and Office Razor Blades",,,"ABS | ABS Plastic | Alloy Steel | Aluminum | CFRP | Concrete | Epoxy Resin | Galvanized Steel | GRP | Hardwood | Iron | Latex | Metal | Neodymium | Nylon | Plastic | Polypropylene | Polystyrene | PVC | Rubber | Stainless Steel | Steel | Titanium | Wood","6 Pack Utility Knives Home and Office Razor Blades"
easy,40587,Character,FREE_TEXT,256508244309,MCN-MOMUAQDGTNBX-2PC-35X62-NVYBL,"Microfiber Ultra Absorbent Quick Dry Gym Towel Outdoor - Navy Blue XL",,,,"Microfiber Ultra Absorbent Quick Dry Gym Towel Outdoor - Navy Blue XL"
easy,40587,"Character Family",FREE_TEXT,256508244309,MCN-MOMUAQDGTNBX-2PC-35X62-NVYBL,"Microfiber Ultra Absorbent Quick Dry Gym Towel Outdoor - Navy Blue XL",,,"Batman | Ben 10 | Benjamin Blümchen | Beyblade | Bibi & Tina | Bibi Blocksberg | Bob the Builder | Care Bears | Chuggington | Die Sendung mit der Maus | Disney | Doctor Who | Dora the Explorer | Evil Dead | Fireman Sam | Gummi Bears | Hannah Montana | Harry Potter | Heidi | Hello Kitty | High Sch...","Microfiber Ultra Absorbent Quick Dry Gym Towel Outdoor - Navy Blue XL"
easy,40587,"Number of Items in Set",FREE_TEXT,256508244309,MCN-MOMUAQDGTNBX-2PC-35X62-NVYBL,"Microfiber Ultra Absorbent Quick Dry Gym Towel Outdoor - Navy Blue XL",,,"Two-Piece | Three-Piece | Four-Piece","Microfiber Ultra Absorbent Quick Dry Gym Towel Outdoor - Navy Blue XL"
easy,40587,Pattern,FREE_TEXT,256508244309,MCN-MOMUAQDGTNBX-2PC-35X62-NVYBL,"Microfiber Ultra Absorbent Quick Dry Gym Towel Outdoor - Navy Blue XL",,,"Abstract | Airbrush | All-Over | Animal Print | Argyle | Bordered | Brush | Bull's Eye | Camouflage | Candy Stripe | Celtic Knot | Checked | Cheetah Print | Chevron | Circles | Coin Dot | Cow Print | Crocodile Print | Dalmatian Print | Diagonal | Dotted | Fair Isle | Flag Print | Fleur de Lis | F...","Microfiber Ultra Absorbent Quick Dry Gym Towel Outdoor - Navy Blue XL"
easy,40587,Room,FREE_TEXT,256508244309,MCN-MOMUAQDGTNBX-2PC-35X62-NVYBL,"Microfiber Ultra Absorbent Quick Dry Gym Towel Outdoor - Navy Blue XL",,,"Any Room | Basement | Bathroom | Bedroom | Conservatory | Dining Room | Foyer | Garage | Guestroom | Hallway | Home Office/Study | Indoor/Outdoor | Kitchen | Living Room | Lounge | Patio | Porch | Trailer | Utility/Laundry Room","Microfiber Ultra Absorbent Quick Dry Gym Towel Outdoor - Navy Blue XL"
easy,40587,Shape,FREE_TEXT,256508244309,MCN-MOMUAQDGTNBX-2PC-35X62-NVYBL,"Microfiber Ultra Absorbent Quick Dry Gym Towel Outdoor - Navy Blue XL",,,"Irregular | Oval | Rectangle | Round | Square | Triangle","Microfiber Ultra Absorbent Quick Dry Gym Towel Outdoor - Navy Blue XL"
easy,42255,Color,FREE_TEXT,256525915897,SON-RSSWMB-16PC-65X5X5E-2,"16pc Ratchet Screwdriver Grip Handle Set with Magnetized Bits Power Hand Tools",,,"Beige | Black | Blue | Brown | Clear | Gold | Gray | Green | Multicolor | Orange | Pink | Purple | Red | Silver | White | Yellow","16pc Ratchet Screwdriver Grip Handle Set with Magnetized Bits"
easy,43220,"Blade Material",FREE_TEXT,256508244336,SON-82SSSS-BUN-HPN,"8"" 2 Sided Knife Blade Sharpener Sharpening Stone",,,"Aluminum | Carbon Steel | Ceramic | Damascus Steel | Rubber | Stainless Steel","Two Sided Knife Sharpener Sharpening Stone 8"""
easy,43220,Color,FREE_TEXT,256508244336,SON-82SSSS-BUN-HPN,"8"" 2 Sided Knife Blade Sharpener Sharpening Stone",,,"Beige | Black | Blue | Brown | Clear | Gold | Gray | Green | Ivory | Multi | Orange | Pink | Purple | Red | Silver | White | Yellow","Two Sided Knife Sharpener Sharpening Stone 8"""
easy,43220,"Handle Material",FREE_TEXT,256508244336,SON-82SSSS-BUN-HPN,"8"" 2 Sided Knife Blade Sharpener Sharpening Stone",,,"Aluminum | Bone | Brass | Carbon Fiber | Cord Wrapped | Horn | Leather | Plastic | Rubber | Shell | Stag/Antler | Stainless Steel | Titanium | Wood","Two Sided Knife Sharpener Sharpening Stone 8"""
easy,43504,Pattern,FREE_TEXT,256510047966,SON-100PKZIPLOCKBAG-PARENT,"100pc Self Locking Plastic Bags 2mm Thick All Purpose Storage Baggies",,,"Argyle | Camouflage | Candy Stripe | Checked | Cheetah Print | Chevron | Cow Print | Crocodile Print | Dalmatian Print | Damask | Ethnic | Floral | Geometric | Giraffe Print | Glitter | Herringbone | Houndstooth | Ikat | Leaves | Leopard Print | Neon/Fluorescent | Paisley | Pin Dot | Pinstriped |...","100 Pieces Self Locking Plastic Bags 2mm Thick All Purpose Storage Various Sizes"
easy,43504,Theme,FREE_TEXT,256510047966,SON-100PKZIPLOCKBAG-PARENT,"100pc Self Locking Plastic Bags 2mm Thick All Purpose Storage Baggies",,,"Cartoon | Cats | Celebrities & Musicians | Fashion & Costumes | Flowers | Food & Drink | Football | Holiday | Hollywood | Music | Numbers & Letters | Sports | Vehicles | WWE","100 Pieces Self Locking Plastic Bags 2mm Thick All Purpose Storage Various Sizes"
easy,45237,Character,FREE_TEXT,256526374819,ASR-GRIPREDKEEPSPORTING,"(2 Pack) ASR Outdoor Jumbo 6.5 Inch XL Key Chain Hand Grip Black and Silver",,,"Aladdin | Alice in Wonderland | Andrea | Angel | Aquaman | Arthur | Articuno | Astro Boy | Atom | Bambi | Barbie | Barney | Bart Simpson | Batman | Belle | Betty Boop | Bill | Black Canary | Black Cat | Black Panther | Black Widow | Blaze | Blue | Boba Fett | Bob the Builder | Boo | Boost | Boots...","Jumbo 6.5 Inch Carabiner Key Chain with Grip - 2 Pack Black and Silver"
easy,45237,"Character Family",FREE_TEXT,256526374819,ASR-GRIPREDKEEPSPORTING,"(2 Pack) ASR Outdoor Jumbo 6.5 Inch XL Key Chain Hand Grip Black and Silver",,,"101 Dalmatians | 5 Seconds of Summer | A Bug's Life | Adventure Time | Aerosmith | Aladdin | Alice in Wonderland | Angry Birds | Astro Boy | Attack on Titan | Avatar: The Last Airbender | Backyardigans | Barbie Friends & Family | Barney & Friends | Batman | Battlestar Galactica | Beauty and the B...","Jumbo 6.5 Inch Carabiner Key Chain with Grip - 2 Pack Black and Silver"
easy,45237,Pattern,FREE_TEXT,256526374819,ASR-GRIPREDKEEPSPORTING,"(2 Pack) ASR Outdoor Jumbo 6.5 Inch XL Key Chain Hand Grip Black and Silver",,,"Animal Print | Argyle/Diamond | Batik | Camouflage | Check | Chevron | Colorblock | Fair Isle | Fair Isle/Nordic | Floral | Geometric | Gingham | Herringbone | Houndstooth | Paisley | Patchwork | Pinstripe | Plaid | Polka Dot | Solid | Spotted | Striped","Jumbo 6.5 Inch Carabiner Key Chain with Grip - 2 Pack Black and Silver"
easy,45237,Style,FREE_TEXT,256526374819,ASR-GRIPREDKEEPSPORTING,"(2 Pack) ASR Outdoor Jumbo 6.5 Inch XL Key Chain Hand Grip Black and Silver",,,,"Jumbo 6.5 Inch Carabiner Key Chain with Grip - 2 Pack Black and Silver"
easy,45237,Theme,FREE_TEXT,256526374819,ASR-GRIPREDKEEPSPORTING,"(2 Pack) ASR Outdoor Jumbo 6.5 Inch XL Key Chain Hand Grip Black and Silver",,,"Angel | Animal | Astro | Awareness | Baby | Backpack | Ballet | Bear | Bee | Bird | Bling | Buildings & Monuments | Butterfly | Cars | Cartoon | Cartoons & Characters | Cat | Celebrity | Celestial & Horoscope | Cherry | Coins | College | Cow | Cowboy | Cowboys & Western | Crown | Designer | Doll ...","Jumbo 6.5 Inch Carabiner Key Chain with Grip - 2 Pack Black and Silver"
easy,46282,Pattern,FREE_TEXT,256462817275,SON-TCFPKCB12IX15I-BUN-2PC-2PK-CLR-4PACK,"(4 Pack) Thin Clear Flexible Plastic Kitchen Cutting Board 12 Inch x 15 Inch",,,"All-Over | Animal Print | Animal Theme | Argyle | Brush | Camouflage | Checked | Chevron | Colorblock | Cow Print | Crocodile Print | Dalmatian Print | Damask | Desert | Dotted | Fair Isle | Floral | Geometric | Gingham | Giraffe Print | Herringbone | Houndstooth | Ikat | Leaf Green | Leopard Pri...","Thin Clear Flexible Plastic Kitchen Cutting Board 12 Inch x 15 Inch (4 Pack)"
easy,46282,Pattern,FREE_TEXT,256470598874,SON-CUTBRD12X15-VARZ-4PK,"(4 Pack) Thin Clear Flexible Cutting Board Mat 12 x 15 inch",,,"All-Over | Animal Print | Animal Theme | Argyle | Brush | Camouflage | Checked | Chevron | Colorblock | Cow Print | Crocodile Print | Dalmatian Print | Damask | Desert | Dotted | Fair Isle | Floral | Geometric | Gingham | Giraffe Print | Herringbone | Houndstooth | Ikat | Leaf Green | Leopard Pri...","Thin Clear Flexible Cutting Board Chopping Mat - 12"" x 15"" (4 Pack)"
easy,46282,Pattern,FREE_TEXT,256508244360,UNV-TCFPKCB-BUN-2PC-3PK-12B15-CLR-6PACK,"(6 Pack) Thin Clear Flexible Plastic Kitchen Cutting Board 12 Inch x 15 Inch",,,"All-Over | Animal Print | Animal Theme | Argyle | Brush | Camouflage | Checked | Chevron | Colorblock | Cow Print | Crocodile Print | Dalmatian Print | Damask | Desert | Dotted | Fair Isle | Floral | Geometric | Gingham | Giraffe Print | Herringbone | Houndstooth | Ikat | Leaf Green | Leopard Pri...","Thin Clear Flexible Plastic Kitchen Cutting Board 12 Inch x 15 Inch (6 Pack)"
easy,46282,Pattern,FREE_TEXT,256510048002,SON-TCFPKCB12IX15I-BUN-4PC-4PK-CLR,"4pk - Flexible Plastic Kitchen Cutting Board 12 Inch x 15 Inch",,,"All-Over | Animal Print | Animal Theme | Argyle | Brush | Camouflage | Checked | Chevron | Colorblock | Cow Print | Crocodile Print | Dalmatian Print | Damask | Desert | Dotted | Fair Isle | Floral | Geometric | Gingham | Giraffe Print | Herringbone | Houndstooth | Ikat | Leaf Green | Leopard Pri...","Flexible Plastic Kitchen Cutting Board 12 Inch x 15 Inch - 4pk"
easy,46282,Style,FREE_TEXT,256470598874,SON-CUTBRD12X15-VARZ-4PK,"(4 Pack) Thin Clear Flexible Cutting Board Mat 12 x 15 inch",,,"Modern | Regence | Traditional | Vintage/Retro","Thin Clear Flexible Cutting Board Chopping Mat - 12"" x 15"" (4 Pack)"
easy,46282,Style,FREE_TEXT,256510048002,SON-TCFPKCB12IX15I-BUN-4PC-4PK-CLR,"4pk - Flexible Plastic Kitchen Cutting Board 12 Inch x 15 Inch",,,"Modern | Regence | Traditional | Vintage/Retro","Flexible Plastic Kitchen Cutting Board 12 Inch x 15 Inch - 4pk"
easy,46282,Theme,FREE_TEXT,256462817275,SON-TCFPKCB12IX15I-BUN-2PC-2PK-CLR-4PACK,"(4 Pack) Thin Clear Flexible Plastic Kitchen Cutting Board 12 Inch x 15 Inch",,,"Abstract | Africa | Angel | Animals | Animation | Architecture & Cityscape | Arctic & Antarctic | Art | Australia | Baltic Sea | Bar & Club | Baseball | Basketball | Beach & Tropical | Beatles | Berlin | Bicycling | Billiards | Birds | Blueprints | Bodybuilding | Botanical | Bowling | Boxing | Br...","Thin Clear Flexible Plastic Kitchen Cutting Board 12 Inch x 15 Inch (4 Pack)"
easy,46282,Theme,FREE_TEXT,256470598874,SON-CUTBRD12X15-VARZ-4PK,"(4 Pack) Thin Clear Flexible Cutting Board Mat 12 x 15 inch",,,"Abstract | Africa | Angel | Animals | Animation | Architecture & Cityscape | Arctic & Antarctic | Art | Australia | Baltic Sea | Bar & Club | Baseball | Basketball | Beach & Tropical | Beatles | Berlin | Bicycling | Billiards | Birds | Blueprints | Bodybuilding | Botanical | Bowling | Boxing | Br...","Thin Clear Flexible Cutting Board Chopping Mat - 12"" x 15"" (4 Pack)"
easy,46282,Theme,FREE_TEXT,256508244360,UNV-TCFPKCB-BUN-2PC-3PK-12B15-CLR-6PACK,"(6 Pack) Thin Clear Flexible Plastic Kitchen Cutting Board 12 Inch x 15 Inch",,,"Abstract | Africa | Angel | Animals | Animation | Architecture & Cityscape | Arctic & Antarctic | Art | Australia | Baltic Sea | Bar & Club | Baseball | Basketball | Beach & Tropical | Beatles | Berlin | Bicycling | Billiards | Birds | Blueprints | Bodybuilding | Botanical | Bowling | Boxing | Br...","Thin Clear Flexible Plastic Kitchen Cutting Board 12 Inch x 15 Inch (6 Pack)"
easy,46282,Theme,FREE_TEXT,256510048002,SON-TCFPKCB12IX15I-BUN-4PC-4PK-CLR,"4pk - Flexible Plastic Kitchen Cutting Board 12 Inch x 15 Inch",,,"Abstract | Africa | Angel | Animals | Animation | Architecture & Cityscape | Arctic & Antarctic | Art | Australia | Baltic Sea | Bar & Club | Baseball | Basketball | Beach & Tropical | Beatles | Berlin | Bicycling | Billiards | Birds | Blueprints | Bodybuilding | Botanical | Bowling | Boxing | Br...","Flexible Plastic Kitchen Cutting Board 12 Inch x 15 Inch - 4pk"
easy,48818,"Blade Material",FREE_TEXT,256525915604,SON-5INFOLDINGKNIFE-BLK,"ASR Outdoor Thumb Assisted Folding Knife Belt Clip Seat Belt Cutter Window Punch",,,"Aluminum | Carbon Steel | Ceramic | Damascus Steel | Rubber | Stainless Steel","Thumb Assisted Folding Knife Belt Clip Seat Belt Cutter Window Punch"
easy,48818,"Blade Material",FREE_TEXT,256525915640,SON-5INFOLDINGKNIFE-SLV,"ASR Outdoor Thumb Assisted Folding Knife Belt Clip Seat Belt Cutter Punch Silver",,,"Aluminum | Carbon Steel | Ceramic | Damascus Steel | Rubber | Stainless Steel","Thumb Assisted Folding Knife Belt Clip Seat Belt Cutter Punch Silver"
easy,52373,Character,FREE_TEXT,256380454290,MCN-NIGLO-PARENT,"GEAR AID Ni Glo 2"" Glowing Keychain for Camping, SCUBA, Fishing, Multi Colors",,,"Aladdin | Alice in Wonderland | Andrea | Angel | Aquaman | Arthur | Articuno | Astro Boy | Atom | Bambi | Barbie | Barney | Bart Simpson | Batman | Belle | Betty Boop | Bill | Black Canary | Black Cat | Black Panther | Black Widow | Blaze | Blue | Boba Fett | Bob the Builder | Boo | Boost | Boots...","GEAR AID Ni Glo 2"" Glowing Keychain for Camping, SCUBA, Fishing, Multi Colors"
easy,52373,Character,FREE_TEXT,256470618737,ZKT-TKRHBCCFZ-SML-BLCK,"Tactical Keyring Holder Belt Connector Clip ZT55",,,"Aladdin | Alice in Wonderland | Andrea | Angel | Aquaman | Arthur | Articuno | Astro Boy | Atom | Bambi | Barbie | Barney | Bart Simpson | Batman | Belle | Betty Boop | Bill | Black Canary | Black Cat | Black Panther | Black Widow | Blaze | Blue | Boba Fett | Bob the Builder | Boo | Boost | Boots...","Zak Tool ZT55-C Tactical Key Ring Holder Connector Clip for Law Enforcement"
