priority,item_id,title,category_id,category_path,schema_aspects,present,missing_required,missing_recommended,missing_required_names,missing_recommended_names
3,236345031456,"Disney Princess 6pc Girls BFF Fashion Jewelry Hair Accessories Set with",19172,"Toys & Hobbies|Preschool Toys & Pretend Play|Dress-Up, Costumes",9,6,0,3,,"Age Level; Recommended Age Range; Vintage"
3,236345031466,"ToolTreaux Stainless Steel Double Ended Knurled Picks Hobby Craft Tools - 4pc",160677,"Crafts|Home Arts & Crafts|Woodworking|Wood Carving Hand Tools",8,5,0,3,,"Type; Unit Quantity; Unit Type"
3,236345056379,"ASR Outdoor Collectible Dagger Bowie Knife Etched Deer Sheath Ergonomic Handle",73522,"Collectibles|Knives, Swords & Blades|Collectible Fixed Blade Knives|Modern Fixed Blade|Factory Manufactured",15,12,0,3,,"Blade Edge; Original/Reproduction; Dexterity"
3,236345056392,"Gear Aid ReviveX Pro Cleaner 4x Concentrate Outdoor Equipment Clothing - 12 oz",27362,"Sporting Goods|Camping & Hiking|Clothing|Other Camping, Hiking Clothing",8,5,0,3,,"California Prop 65 Warning; Unit Quantity; Unit Type"
3,236345056430,"Kidplokio Kids Pretend Play Food Set Fun Picnic Plastic Food Utensils Assorted,",158746,"Toys & Hobbies|Preschool Toys & Pretend Play|Kitchens",12,9,0,3,,"Type; Age Level; Vintage"
3,236345056439,"GEAR AID Suede Nubuck Fabric Shoe Care Kit Waterproof breathable Footwear 2-Pack",141475,"Clothing, Shoes & Accessories|Specialty|Clothing & Shoe Care|Shoe Care & Repair|Shoe Care Sets",6,3,0,3,,"California Prop 65 Warning; Unit Quantity; Unit Type"
3,236345069135,"Disney Minnie Mouse Girls Beaded Ring Bracelet Glitter Charm Jewelry Gift",19172,"Toys & Hobbies|Preschool Toys & Pretend Play|Dress-Up, Costumes",9,6,0,3,,"Age Level; Recommended Age Range; Vintage"
3,236345069141,"ToolTreaux Steel and Polished Wood Assorted Soft Medium Sculpting Spatulas, 5pc",11785,"Crafts|Art Supplies|Painting Supplies|Other Painting Supplies",9,6,0,3,,"Type; Model; Handmade"
3,236345069151,"Universal Tool 958 Silver Marking Jewelry Stamp for  Precious Metal Working",31726,"Crafts|Beads & Jewelry Making|Other Beads & Jewelry Making",8,5,0,3,,"Handmade; Unit Quantity; Unit Type"
3,236345069155,"20oz Geology Rock Pick Hammer Ergonomic Handle Mining Tool",20763,"Home & Garden|Tools & Workshop Equipment|Hand Tools|Hammers & Mallets",21,18,0,3,,"Manufacturer Warranty; Personalize; Personalization Instructions"
3,236345069171,"Marvel Avengers Super Hero Suction Dart Blaster with Targets",158749,"Toys & Hobbies|Outdoor Toys & Structures|Dart Guns & Soft Darts",9,6,0,3,,"Product Line; Age Level; Recommended Age Range"
3,236345069189,"3 Pack Double Sided 60 inch Tailors Tape Measure Seamstress Alteration Sewing",183295,"Crafts|Sewing|Measuring Tools|Measuring Tapes",10,7,0,3,,"Unit of Measurement; Unit Quantity; Unit Type"
3,236345137178,"ASR Outdoor Full Tang Hunting Knife ABS Handle Fixed Blade Matte Black Design",73522,"Collectibles|Knives, Swords & Blades|Collectible Fixed Blade Knives|Modern Fixed Blade|Factory Manufactured",15,12,0,3,,"Blade Edge; Original/Reproduction; Dexterity"
3,236345137186,"ASR Outdoor Collectible Dagger Bowie Knife Etched Eagle Sheath Ergonomic Handle",73522,"Collectibles|Knives, Swords & Blades|Collectible Fixed Blade Knives|Modern Fixed Blade|Factory Manufactured",15,12,0,3,,"Blade Edge; Original/Reproduction; Dexterity"
3,236345137187,"ASR Outdoor 6mm Sling Shot Ball Bearings Steel 50 Piece Set",117141,"Sporting Goods|Outdoor Sports|Air Guns & Slingshots|Slingshots",10,7,0,3,,"Suitable For; Unit Quantity; Unit Type"
3,236345137198,"Minnie Mouse BFF Complete Manicure Pediure Girls Fashion Nail Kit - 4pc",19172,"Toys & Hobbies|Preschool Toys & Pretend Play|Dress-Up, Costumes",9,6,0,3,,"Age Level; Recommended Age Range; Vintage"
3,236345137205,"ToolTreaux Stainless Steel Precision Tweezer Set Serrated Tips Secure Grip - 4pc",122718,"Crafts|Multi-Purpose Craft Supplies|Crafting Tools|Craft Tweezers",7,4,0,3,,"Handmade; Unit Quantity; Unit Type"
3,236345137218,"10pc Sterile Surgical Grade Replacement Scalpel Blades Universal Fit - Size 10",104229,"Business & Industrial|Healthcare, Lab & Dental|Handpieces & Instruments|Scalpels, Surgical Blades & Handles",12,9,0,3,,"Handle Number; Intended Use/Discipline; Expiration Date"
3,236345137219,"Kidplokio 8pc Urban City Fire Truck Friction Powered Toy Cars with Play Mat,",2646,"Toys & Hobbies|Preschool Toys & Pretend Play|Brio",9,6,0,3,,"Age Level; Recommended Age Range; Vintage"
3,236345137223,"Toy Story 3 Kids School Supplies Study Set Notebook Pencil Sharpener Eraser 4pc",13844,"Collectibles|Disneyana|Contemporary (1968-Now)|Paper, Notepads",7,4,0,3,,"Character/Story/Theme; Convention/Event; Franchise"
3,236345137226,"32 Sheet Disappearing Note Pad Dissolving Message Notebook Paper - Spy Journal",20164,"Business & Industrial|Office|Office Supplies|Paper Products|Note Pads",8,5,0,3,,"Sheet Size; Personalize; Personalization Instructions"
3,236345137237,"(3 Pack) ASR Outdoor Emergency Glow Stick BOB High Visibility Safety Light",159091,"Sporting Goods|Camping & Hiking|Flashlights, Lanterns & Lights|Glow Sticks",16,13,0,3,,"Operating Time; Unit Quantity; Unit Type"
3,236345160657,"10 Pack Universal Fit Standard Issue Law Enforcement Standard Handcuff Key",39665,"Collectibles|Historical Memorabilia|Police|Handcuffs & Keys",6,3,0,3,,"Type; Signed; Organization"
3,236475895875,"Hello Kitty & Friends 4pc Nail Polish Glitter Set Girls with Travel Tin Ages 3+",11873,"Health & Beauty|Nail Care, Manicure & Pedicure|Nail Polish & Powders|Nail Polish",13,10,0,3,,"Volume; Period After Opening (PAO); Expiration Date"
3,236818591093,"Beille 5 Inch Jumbo Heavy Duty Stainless Steel Alligator Clips for Kitchen, 2pk",20651,"Home & Garden|Kitchen, Dining & Bar|Kitchen Tools & Gadgets|Other Kitchen Tools & Gadgets",17,14,0,3,,"Making Method; Personalize; Personalization Instructions"
3,364532229830,"ASR Outdoor 5pc Metal Detecting Tools Kit Drawstring Bag Coin Probe (3 Styles)",163824,"Business & Industrial|Test, Measurement & Inspection|Test Meters & Detectors|Metal Detector Accessories",8,5,0,3,,"Type; Unit Quantity; Unit Type"
3,364539226155,"6"" 2 Sided Knife Blade Sharpener Sharpening Stone (Grit: 120 / 240)",43220,"Collectibles|Knives, Swords & Blades|Blade Parts, Supplies & Accs|Blade Sharpeners & Stones",10,7,0,3,,"Blade Material; Handle Material; Tang"
3,364737328423,"ASR Outdoor DIY 500 Gram Cast Iron Gold Ingot Mold to Make Your Own Gold Bars",163824,"Business & Industrial|Test, Measurement & Inspection|Test Meters & Detectors|Metal Detector Accessories",8,5,0,3,,"Type; Unit Quantity; Unit Type"
3,364855706606,"ASR Outdoor 22pc Backpack Kit, Beach Combing Metal Detector Accessories Set",163824,"Business & Industrial|Test, Measurement & Inspection|Test Meters & Detectors|Metal Detector Accessories",8,5,0,3,,"Type; Unit Quantity; Unit Type"
3,364888228206,"Jumbo 6.5"" XL Carabiner Key Chain With Hand Grip - Blue",3628,"Collectibles|Pez, Keychains, Promo Glasses|Keychains|Modern (1970-Now)",8,5,0,3,,"Character Family; Era; Theme"
3,364893803618,"ASR Outdoor 20pc Complete Gold Panning Kit 50 Inch Folding Sluice Box and Bucket",163824,"Business & Industrial|Test, Measurement & Inspection|Test Meters & Detectors|Metal Detector Accessories",8,5,0,3,,"Type; Unit Quantity; Unit Type"
3,364911624436,"ASR Outdoor Paracord Necklace Fire Starter Striker Tool Blade (Many Styles)",166126,"Sporting Goods|Camping & Hiking|Outdoor Survival Gear|Fire Starters",17,14,0,3,,"Number in Pack; MPN; Model"
3,364922917776,"ASR Outdoor Classic Field Gold Panning Kit with Dual Riffle Pans 7pc (2 Colors)",163824,"Business & Industrial|Test, Measurement & Inspection|Test Meters & Detectors|Metal Detector Accessories",8,5,0,3,,"Type; Unit Quantity; Unit Type"
3,365242110528,"ASR Outdoor Fixed Blade Utility Fishing Fillet Knife, 6 Inch",73522,"Collectibles|Knives, Swords & Blades|Collectible Fixed Blade Knives|Modern Fixed Blade|Factory Manufactured",15,12,0,3,,"Blade Edge; Original/Reproduction; Dexterity"
3,365456861194,"ASR Outdoor 1lb Rough Genuine Gemstone Gold Panning Kit, 5pc (Many Styles)",14955,"Business & Industrial|Test, Measurement & Inspection|Test Meters & Detectors|Metal Detectors",10,7,0,3,,"Type; Features; Country of Origin"
3,365816245798,"ASR Outdoor 3 Inch Locking Aluminum Carabiner Clip EDC Camping Gear (3 Colors)",50814,"Sporting Goods|Outdoor Sports|Climbing & Caving|Carabiners & Hardware",9,6,0,3,,"Size; Model; MPN"
3,365879832355,"Sea Drops Anti-Fog Lens Cleaner for Diving Masks - 1.25 oz White",29574,"Sporting Goods|Water Sports|Wetsuits & Drysuits|Other Wetsuits & Drysuits",8,5,0,3,,"California Prop 65 Warning; Unit Quantity; Unit Type"
3,365879832360,"Universal Water Bottle Holder With Blue Aluminum Carabiner Clip Attachment",50814,"Sporting Goods|Outdoor Sports|Climbing & Caving|Carabiners & Hardware",9,6,0,3,,"Product Type; Size; Shape"
3,365879832362,"ASR Outdoor Full Tang Hunting Knife ABS Handle Fixed Blade Space Galaxy Design",73522,"Collectibles|Knives, Swords & Blades|Collectible Fixed Blade Knives|Modern Fixed Blade|Factory Manufactured",15,12,0,3,,"Blade Edge; Original/Reproduction; Dexterity"
3,365879832385,"GEAR AID 325 Paracord and Carabiner Utility Cord Camping Hiking (2 Pack Sizes)",50816,"Sporting Goods|Outdoor Sports|Climbing & Caving|Ropes, Cords & Slings",7,4,0,3,,"Model; MPN; California Prop 65 Warning"
3,365879832389,"Aluminum Colored Carabiner Key Chain Spring Clip Medium Size Assorted Colors 6pk",50814,"Sporting Goods|Outdoor Sports|Climbing & Caving|Carabiners & Hardware",9,6,0,3,,"Product Type; Size; Shape"
3,365879832392,"5pc Universal Tweezer Set Stainless Steel, 5""",122718,"Crafts|Multi-Purpose Craft Supplies|Crafting Tools|Craft Tweezers",7,4,0,3,,"Handmade; Unit Quantity; Unit Type"
3,365879832395,"Network Cable Tester and Modular Crimping Tool for Electronics Repair",51169,"Computers/Tablets & Networking|Computer Cables & Connectors|Cabling Tools",8,5,0,3,,"Cable Length; Unit Quantity; Unit Type"
3,365879832400,"ToolTreaux Eyelash Curler and Tweezer Set Eye Makeup Eyebrow Tool Set - 2pc",82599,"Health & Beauty|Makeup|Makeup Tools & Accessories|Eyelash Tools",13,10,0,3,,"Product Line; Unit Quantity; Unit Type"
3,365879907937,"ASR Outdoor Gold Panning 500g Portable Electronic Pocket Scale",72667,"Sporting Goods|Fishing|Fishing Equipment|Scales",12,9,0,3,,"Type; Unit Quantity; Unit Type"
3,365879907955,"ASR Federal 4pc Warm and White Light EMT Diagnostic Pen Light with Pupil Gauge",257817,"Business & Industrial|Healthcare, Lab & Dental|Medical, Lab & Dental Supplies|Diagnostic Penlights",9,6,0,3,,"Intended Use/Discipline; Unit Quantity; Unit Type"
3,365879907965,"8 Pc Template Stencil Set Drawing Arts and Crafts Ovals Circles Squares Hexagons",183100,"Crafts|Art Supplies|Painting Supplies|Painting Tools & Accessories|Painting Stencils",8,5,0,3,,"Handmade; Unit Quantity; Unit Type"
3,365879907974,"Shimmer and Shine Girls Fashion Accessory Hair Bow Barrette Sparkle Clip",19172,"Toys & Hobbies|Preschool Toys & Pretend Play|Dress-Up, Costumes",9,6,0,3,,"Age Level; Recommended Age Range; Vintage"
3,365879907976,"ToolTreaux Safety 18k Gold Testing Kit, 7pc",258289,"Business & Industrial|CNC, Metalworking & Manufacturing|Semiconductor & PCB Manufacturing Equipment|Semiconductor Test & Assembly Equipment|Testing Equipment",7,4,0,3,,"Equipment Type; Unit Quantity; Unit Type"
3,365879907990,"ASR Outdoor Gemstone Paydirt Bag Gold Panning Kit (Many Styles and Sizes)",14955,"Business & Industrial|Test, Measurement & Inspection|Test Meters & Detectors|Metal Detectors",10,7,0,3,,"Type; Features; Model"
3,365879935271,"Universal Fit Standard Issue Law Enforcement Standard Handcuff Key",39665,"Collectibles|Historical Memorabilia|Police|Handcuffs & Keys",6,3,0,3,,"Type; Signed; Organization"
3,365879935274,"Universal Tool Stainless Steel Double Ended Carving Spatula Hobby Pottery Tools",183319,"Crafts|Sculpting, Molding & Ceramics|Other Sculpting Supplies",7,4,0,3,,"Handmade; Unit Quantity; Unit Type"
3,365879935287,"ASR Outdoor Folding Collapsible Waterproof Pet Travel Food Water Bowl with Clip",178062,"Pet Supplies|Dog Supplies|Transport & Travel|Other Transport & Travel",8,5,0,3,,"Dog Breed; Unit Quantity; Unit Type"
3,365879935296,"ASR Federal Disposable Latex Glove Holder Duty Belt Hook Loop Closure EMT",53294,"Business & Industrial|Facility Maintenance & Safety|Public Safety Staff Equipment|Police & Turnout Gear|Other Police & Turnout Gear",8,5,0,3,,"Type; Unit Quantity; Unit Type"
3,365879935312,"Kidplokio Green Walking Robot Dinosaur Dragon Space Toys Lights Sounds, Boys",19170,"Toys & Hobbies|Preschool Toys & Pretend Play|Dinosaurs",9,6,0,3,,"Recommended Age Range; Age Level; Vintage"
3,365879935321,"ASR Outdoor Full Tang Hunting Knife ABS Handle Fixed Blade Rainbow Design",73522,"Collectibles|Knives, Swords & Blades|Collectible Fixed Blade Knives|Modern Fixed Blade|Factory Manufactured",15,12,0,3,,"Blade Edge; Original/Reproduction; Dexterity"
3,365879950527,"Silicone O Ring Valve Protection Grease for Diving Gear - 1/4 oz",29574,"Sporting Goods|Water Sports|Wetsuits & Drysuits|Other Wetsuits & Drysuits",8,5,0,3,,"California Prop 65 Warning; Unit Quantity; Unit Type"
3,365879950531,"Universal Tool Chasing Hammer Dual Face Smooth Flat Side Rounded Side 10 Inch",262020,"Jewelry & Watches|Jewelry Care, Design & Repair|Jewelry Tools & Workbenches",12,9,0,3,,"Seller Warranty; Unit Quantity; Unit Type"
3,365879950547,"Disney Pixar Toy Story 4 Days of the Week Stick On Earrings and Rings Set",19172,"Toys & Hobbies|Preschool Toys & Pretend Play|Dress-Up, Costumes",9,6,0,3,,"Age Level; Recommended Age Range; Vintage"
3,365879950552,"Kidplokio Sonic Space Blaster Toy Gun with Flashing Lights and Sounds, Green,",158749,"Toys & Hobbies|Outdoor Toys & Structures|Dart Guns & Soft Darts",9,6,0,3,,"Product Line; Age Level; Recommended Age Range"
3,365879950557,"ASR Outdoor HMPE 260LB Utility Cord, Black Multipurpose Braided Line Many Length",50816,"Sporting Goods|Outdoor Sports|Climbing & Caving|Ropes, Cords & Slings",7,4,0,3,,"Suitable For; Model; MPN"
3,365879950583,"ToolTreaux Graphite Crucible for Melting Gold and Silver (Many Sizes)",31726,"Crafts|Beads & Jewelry Making|Other Beads & Jewelry Making",8,5,0,3,,"Handmade; Model; MPN"
3,365879996350,"Universal 5pc Hobby Tweezer Set Stainless Steel",122718,"Crafts|Multi-Purpose Craft Supplies|Crafting Tools|Craft Tweezers",7,4,0,3,,"Handmade; Unit Quantity; Unit Type"
3,365879996357,"ASR Outdoor - 11 inch Heavy Duty Hand Trowel - Orange",163824,"Business & Industrial|Test, Measurement & Inspection|Test Meters & Detectors|Metal Detector Accessories",8,5,0,3,,"Type; Unit Quantity; Unit Type"
3,365879996376,"Tactical Op Drops Anti-Fog and Lens Cleaning Kit Emergency Survival - .25 oz",27362,"Sporting Goods|Camping & Hiking|Clothing|Other Camping, Hiking Clothing",8,5,0,3,,"California Prop 65 Warning; Unit Quantity; Unit Type"
3,365879996378,"25 Pack Universal Fit Standard Issue Law Enforcement Standard Handcuff Key",39665,"Collectibles|Historical Memorabilia|Police|Handcuffs & Keys",6,3,0,3,,"Type; Signed; Organization"
3,365879996381,"(2 Pack) Kids Indoor Golf Club Toddler Activity Pretend Play Set, Ages 3-8",19181,"Toys & Hobbies|Preschool Toys & Pretend Play|Other Preschool & Pretend Play",10,7,0,3,,"Age Level; Type; Vintage"
3,365879996383,"Universal Tool 6 in 1 Multi-head Nylon Hammer",75564,"Crafts|Multi-Purpose Craft Supplies|Other Multi-Purpose Crafting",8,5,0,3,,"Handmade; Unit Quantity; Unit Type"
3,365880019095,"Kidplokio Camo Rescue Mission Toy Blaster with Lights Sounds Boys Ages 3 and Up",158749,"Toys & Hobbies|Outdoor Toys & Structures|Dart Guns & Soft Darts",9,6,0,3,,"Product Line; Age Level; Recommended Age Range"
3,365880042750,"ToolTreaux Deluxe Hobby Craft DIY Vinyl Cutting Kit with Self Healing Mat Clamps",183175,"Crafts|Multi-Purpose Craft Supplies|Crafting Tools|Cutting Tools|Cutting Mats",9,6,0,3,,"Size; Unit Quantity; Unit Type"
3,365880042764,"Marvel Spiderman 3 Inch Wibbly Squish Bead Buddies Ball Fidget Toy",234,"Toys & Hobbies|Games|Other Games",10,7,0,3,,"Character Family; Material; Year"
3,365880042767,"Universal Tool Chasing and Goldsmith Hammer 1 and 5/8 inch Diameter DIY Crafting",183133,"Crafts|Leathercrafts|Leathercraft Tools|Hammer & Mallets",8,5,0,3,,"Handmade; Unit Quantity; Unit Type"
3,366331246534,"Beille 6pc Bamboo Wooden Cooking Utensil Set with Holder, Nonstick Safe Kitchen",20649,"Home & Garden|Kitchen, Dining & Bar|Kitchen Tools & Gadgets|Cooking Utensils",19,16,0,3,,"Making Method; Model; Personalization Instructions"
3,366424712404,"Beille 100% Cotton Kitchen Dish Cloth and Tea Towels Set, Machine Washable, 5pk",20664,"Home & Garden|Kitchen, Dining & Bar|Linens & Textiles|Towels & Dishcloths",24,21,0,3,,"Character Family; Character; Personalization Instructions"
2,126115129678,"60ft Rapid Deployment Portable Survival Cord Made with Kevlar 200lb Breaking",50816,"Sporting Goods|Outdoor Sports|Climbing & Caving|Ropes, Cords & Slings",7,5,0,2,,"Rope Type; Suitable For"
2,126386406454,"ASR Outdoor Technora Survival Cord Rope 400lb Break Strength",50816,"Sporting Goods|Outdoor Sports|Climbing & Caving|Ropes, Cords & Slings",7,5,0,2,,"Suitable For; MPN"
2,126443316370,"ASR Outdoor 3 Stage Super Bright Hanging Puck Light,  240 Lumen COB LED",159092,"Sporting Goods|Camping & Hiking|Flashlights, Lanterns & Lights|Other Camping Lights",7,5,0,2,,"Unit Quantity; Unit Type"
2,126454417969,"ASR Outdoor (2-Pack) Camping Utensil Set Army Military MRE Chow Set",87133,"Sporting Goods|Camping & Hiking|Camping Cooking Supplies|Camping Cooking Utensils",24,22,0,2,,"Number of Items in Set; Heat Resistance"
2,126495661368,"ToolTreaux 9mm 18mm Ceramic Hobby Knife Box Cutter Replacement Blades 10pk",83982,"Crafts|Multi-Purpose Craft Supplies|Crafting Tools|Cutting Tools|Craft Knives & Blades",6,4,0,2,,"Handmade; Type"
2,126672923175,"TychoTyke Kids Tennis Racket Play Set Rackets Balls Outdoor Exercise (2 Colors)",20871,"Sporting Goods|Tennis & Racquet Sports|Tennis|Racquets",7,5,0,2,,"Grip Size; Head Size"
2,127389768403,"ASR Outdoor Hiking Companion Whistles Emergency Survival Tools 105 dB Rating",181414,"Sporting Goods|Camping & Hiking|Outdoor Survival Gear|Safety Whistles",17,15,0,2,,"Unit Quantity; Unit Type"
2,127389768410,"Aluminum Dog Tag Military GI Blank Key Chain 1 Piece Set",156462,"Collectibles|Militaria|Current Militaria (2001-Now)|Original Items|Personal, Field Gear|Dog Tags",4,2,0,2,,"Original/Reproduction; Theme"
2,127389768412,"Aluminum Dog Tags Engraveable Blank Key Chains Military Identification 12 Pack",156462,"Collectibles|Militaria|Current Militaria (2001-Now)|Original Items|Personal, Field Gear|Dog Tags",4,2,0,2,,"Original/Reproduction; Theme"
2,127389768419,"Gear Aid Plastic Snap Hook for Camping Hiking Webbing Strap Customization Black",27362,"Sporting Goods|Camping & Hiking|Clothing|Other Camping, Hiking Clothing",8,6,0,2,,"Unit Quantity; Unit Type"
2,127389768421,"UV Tech Protectant and Rejuvenator Marine Gear 4oz",27363,"Sporting Goods|Camping & Hiking|Hiking Gear|Other Hiking Gear",6,4,0,2,,"Unit Quantity; Unit Type"
2,127389838864,"DIY Craft Self Healing Cutting Mat Double Sided Hobby Tool (2 Sizes and Colors)",16507,"Crafts|Stamping & Embossing|Tools & Equipment",6,4,0,2,,"Handmade; California Prop 65 Warning"
2,127389838898,"ToolTreaux Metal Number and Letter Stamping Set Auto Punch Storage Case - 38pc",41369,"Crafts|Home Arts & Crafts|Metalworking",7,5,0,2,,"Unit Quantity; Unit Type"
2,127389838946,"ASR Outdoor 15 Inch Metalworking Ceramic Crucible Tongs Melt Precious Metals",8504,"Sporting Goods|Camping & Hiking|Other Camping & Hiking",7,5,0,2,,"Unit Quantity; Unit Type"
2,127389838955,"ASR Outdoor 14 Inch Metal Detecting Tool Sand Scoop with Coin Probe (3 Colors)",3186,"Home & Garden|Yard, Garden & Outdoor Living|Garden Hand Tools & Equipment|Other Garden Hand Tools & Equipment",8,6,0,2,,"MPN; Style"
2,127389838960,"Semi Truck Transporter Trailer Race Car Auto Hauler Carrier Play Set - Blue",51023,"Toys & Hobbies|Wholesale Lots|Diecast Toy Vehicles",7,5,0,2,,"Age Level; Vintage"
2,127389857812,"ASR Outdoor Adjustable Ear Protection Ear Muffs for Gun Shooting Firing Range",53152,"Business & Industrial|Facility Maintenance & Safety|Personal Protective Equipment (PPE)|Ear Plugs & Ear Muffs|Ear Plugs",7,5,0,2,,"Unit Quantity; Unit Type"
2,127389857817,"ASR Outdoor 5-in-1 Mini EDC Small Pocket Knife Multi Tool - LOGO Red",75235,"Sporting Goods|Camping & Hiking|Camping Knives & Tools|Camping Knives",20,18,0,2,,"Manufacturer Warranty; Personalization Instructions"
2,127389857825,"6"" Outdoor Tactical Neck Chain Knife Survival Paracord Wrapped Handle",310,"Sporting Goods|Other Sporting Goods",7,5,0,2,,"Unit Quantity; Unit Type"
2,127389857834,"ASR Outdoor Stainless Steel Multi-tool Utility EDC Pocket Knife with Carry Pouch",48818,"Collectibles|Knives, Swords & Blades|Collectible Folding Knives|Modern Folding Knives|Factory Manufactured",19,17,0,2,,"Product Line; Lock Type"
2,127389857856,"BC Life BCD Cleaner and Conditioner Household Maintenance - 10 oz",29574,"Sporting Goods|Water Sports|Wetsuits & Drysuits|Other Wetsuits & Drysuits",8,6,0,2,,"Unit Quantity; Unit Type"
2,127389857862,"Universal Safety Vest High Visibility Orange Mesh Unisex One Size Fits All",109677,"Business & Industrial|Facility Maintenance & Safety|Personal Protective Equipment (PPE)|Safety Vests",9,7,0,2,,"Unit Quantity; Unit Type"
2,127389878185,"4pc Hook and Pick Deluxe Swivel Handle Precision Tool Set for Home Improvement",113355,"Crafts|Home Arts & Crafts|Upholstery Tools & Equipment",7,5,0,2,,"Unit Quantity; Unit Type"
2,127389878192,"37pc Universal Tool Wood Burning Pen Set with Assorted Tips",183150,"Crafts|Home Arts & Crafts|Woodworking|Wood Burning Pens",6,4,0,2,,"Unit Quantity; Unit Type"
2,127389878217,"ASR Outdoor Compact 50 Lumens Survival Emergency Mini Zipper Light Keychain",159092,"Sporting Goods|Camping & Hiking|Flashlights, Lanterns & Lights|Other Camping Lights",7,5,0,2,,"Unit Quantity; Unit Type"
2,127389878230,"Baby Yoda Star Wars The Mandalorian Sticker Book Pack - Over 300 Stickers",134570,"Crafts|Kids' Crafts|Stickers",6,4,0,2,,"Handmade; Model"
2,127389932529,"Baby Yoda ""The Child"" Star Wars The Mandalorian Sticker Pad - Over 200 Stickers",134570,"Crafts|Kids' Crafts|Stickers",6,4,0,2,,"Handmade; Model"
2,127389932539,"GEAR AID 10oz BCD Cleaner and Conditioner Sporting Goods Ocean Dive Shampoo",29574,"Sporting Goods|Water Sports|Wetsuits & Drysuits|Other Wetsuits & Drysuits",8,6,0,2,,"Unit Quantity; Unit Type"
2,127389932552,"1 Pair Universal Garden Gloves Unisex One Size, Hi-Vis Dot Knit Grip",43616,"Home & Garden|Tools & Workshop Equipment|Safety & Protective Gear|Gloves & Pads",26,24,0,2,,"Style; Expiration Date"
2,127389932584,"Outdoor Cold Weather Hand Warmer Pocket Camp Fire Survival Prepper Lot of 20",27362,"Sporting Goods|Camping & Hiking|Clothing|Other Camping, Hiking Clothing",8,6,0,2,,"Unit Quantity; Unit Type"
2,127389946581,"PIC Fly Traps Glue Attracts and Traps Flying Insects No Mess No Vapors - 2 Pack",183808,"Business & Industrial|Cleaning & Janitorial Supplies|Pest Control Supplies|Pest Trap Parts & Accessories|Pest Trap Sticky Paper",7,5,0,2,,"Unit Quantity; Unit Type"
2,127389969224,"Kids Jumbo 1:66 Scale Formula Max Toy Race Car, Pull Back Car, Red, Boys Ages 3+",19074,"Toys & Hobbies|Electronic, Battery & Wind-Up|Friction|1970-Now",10,8,0,2,,"Character Family; MPN"
2,127389969233,"200ft High Visibility Marking Ribbon - Red",8504,"Sporting Goods|Camping & Hiking|Other Camping & Hiking",7,5,0,2,,"Unit Quantity; Unit Type"
2,127790044097,"Destination Gear 6ft Italian Market Patio Umbrella Blue White Stripes with Tilt",180998,"Home & Garden|Yard, Garden & Outdoor Living|Garden Structures & Shade|Umbrellas",22,20,0,2,,"Pole Diameter; Manufacturer Warranty"
2,235505374432,"Bendable Mental Health Non-Lethal Flexible Ball Point Pen (Multi-Packs)",7279,"Collectibles|Pens & Writing Instruments|Pens|Ballpoint Pens|Other Collectible Ballpoint",8,6,0,2,,"Vintage; Personalized"
2,235868804322,"(2PK) Gear Aid Tent Waterproofing Spray and Sealer for Nylon Tents Fast Cure Kit",36120,"Sporting Goods|Camping & Hiking|Tents & Canopies|Tent & Canopy Accessories",16,14,0,2,,"Mounting Type; California Prop 65 Warning"
2,236345031419,"Fire Starter Camping Survival Magnesium Pocket Flint Grip Handle",159092,"Sporting Goods|Camping & Hiking|Flashlights, Lanterns & Lights|Other Camping Lights",7,5,0,2,,"Unit Quantity; Unit Type"
2,236345031422,"Kidplokio Kids Keyboard Piano with Microphone Lights Music Sounds, Blue, Boys",145943,"Toys & Hobbies|Electronic, Battery & Wind-Up|Battery Operated|1990-Now|Radios, Musical Toys",9,7,0,2,,"Theme; Age Level"
2,236345031450,"Water Resistant Match Stick Storage Container And Fire Starter Mirror",8504,"Sporting Goods|Camping & Hiking|Other Camping & Hiking",7,5,0,2,,"Unit Quantity; Unit Type"
2,236345031460,"Kidplokio DIY Build Dinosaur Robot Assembly Toy Figure Play Set Boys Ages 3+",19170,"Toys & Hobbies|Preschool Toys & Pretend Play|Dinosaurs",9,7,0,2,,"Character Family; Vintage"
2,236345031474,"ASR Outdoor 12pc Moroccan Break Your Own Geodes Kit with Sledge Hammer",11737,"Toys & Hobbies|Educational|Science & Nature|Other Science & Nature Toys",9,7,0,2,,"Character Family; Vintage"
2,236345056423,"200lb Strength Hobby Sport Survival Paracord Rope - Red, 50ft",310,"Sporting Goods|Other Sporting Goods",7,5,0,2,,"Unit Quantity; Unit Type"
2,236345056438,"Braided Vectran Survival Sport Tactical Cord 200lb Breaking Strength 25' to 1000",50816,"Sporting Goods|Outdoor Sports|Climbing & Caving|Ropes, Cords & Slings",7,5,0,2,,"Suitable For; Country of Origin"
2,236345069153,"Gear Aid Aquaseal Repair Adhesive and Cotol-240 Cure Accelerator Outdoor - Small",8504,"Sporting Goods|Camping & Hiking|Other Camping & Hiking",7,5,0,2,,"Unit Quantity; Unit Type"
