priority,item_id,title,category_id,category_path,schema_aspects,present,missing_required,missing_recommended,missing_required_names,missing_recommended_names
8,236345137224,"12 Pack Universal Home and Office Utility Knife Knives",39057,"Home & Garden|Tools & Workshop Equipment|Hand Tools|Knives & Blades",19,11,0,8,,"Number of Pieces; Handle Material; Blade Material; Blade Width; Manufacturer Warranty; Item Diameter; Unit Quantity; Unit Type"
8,236345160655,"ASR Outdoor Thumb Assisted Folding Knife Belt Clip Seat Belt Cutter Window Punch",48818,"Collectibles|Knives, Swords & Blades|Collectible Folding Knives|Modern Folding Knives|Factory Manufactured",19,11,0,8,,"Type; Product Line; Blade Edge; Lock Type; Tools; Blade Range; Original/Reproduction; Dexterity"
8,236345160667,"ASR Outdoor Camping Pocket Knife Spring Assisted Serrated Tanto Blade Orange",48818,"Collectibles|Knives, Swords & Blades|Collectible Folding Knives|Modern Folding Knives|Factory Manufactured",19,11,0,8,,"Type; Product Line; Blade Edge; Lock Type; Tools; Blade Range; Original/Reproduction; Dexterity"
8,364859505659,"Deluxe Carpenter Tool Belt Pouch Heavy Duty Suede Leather Fits Hammer And Nails",42362,"Home & Garden|Tools & Workshop Equipment|Tool Boxes & Storage|Tool Bags, Belts & Pouches",19,11,0,8,,"Number of Items; Features; Manufacturer Warranty; Item Height; Item Diameter; Item Weight; Unit Quantity; Unit Type"
8,365879832396,"Beille Kitchen Knife Set Cooking Baking Supplies Meal Prep with Wood Storage",20638,"Home & Garden|Kitchen, Dining & Bar|Flatware, Knives & Cutlery|Knife Blocks & Storage",20,12,0,8,,"Number of Slots; Wood Tone; Style; Personalize; Item Depth; Unit Quantity; Unit Type; Personalization Instructions"
8,365879908011,"Kidplokio 8pc Urban City Police Friction Powered Toy Cars with Play Mat, Blue,",19100,"Toys & Hobbies|Games|Board & Traditional Games|Vintage Manufacture",14,6,0,8,,"Game Title; Game Type; Theme; Min. Number of Players; Age Level; Award; Recommended Age Range; Vintage"
8,365879935259,"ToolTreaux High Speed Alloy Steel Circular Saw Blade Woodcutting Hobby Tool",258317,"Business & Industrial|CNC, Metalworking & Manufacturing|Woodworking Equipment|Saws|Circular Saws",18,10,0,8,,"Corded/Cordless; Motor Type; Max Blade Diameter; Amperage; Speed; Voltage; Control; Power Source"
8,365879935280,"Beille Classic Bakers Solid Lotus Wood Rolling Pin Pie Crust Pizza Dough 13"" 15""",32885,"Home & Garden|Kitchen, Dining & Bar|Baking Accs. & Cake Decorating|Rolling Pins",19,11,0,8,,"MPN; Item Length; Theme; Occasion; Model; Unit Quantity; Unit Type; Personalization Instructions"
8,365879935284,"Disney Minnie Mouse Headband and 3 Coil Bracelets, Girls Fashion Hair",57920,"Clothing, Shoes & Accessories|Kids|Girls|Girls' Accessories|Hair Accessories",19,11,0,8,,"Occasion; Hair Type; Accents; Department; Theme; Pattern; Personalize; Personalization Instructions"
8,365879935290,"ASR Outdoor Chrome Finish Leak Proof 23oz Glass Water Bottle with Bamboo Lid",181408,"Sporting Goods|Camping & Hiking|Water Bottles & Hydration|Canteens, Bottles & Flasks",22,14,0,8,,"Set Includes; Theme; Top Type; Personalize; Manufacturer Warranty; Personalization Instructions; Unit Quantity; Unit Type"
8,365879935300,"ASR Outdoor First Aid Kit in Waterproof Dry Sack Emergency Supplies 100 Pieces",75035,"Health & Beauty|Health Care|First Aid|Kits & Bags",20,12,0,8,,"Main Purpose; Expiration Date; Labels & Certifications; Set Includes; Personalize; Personalization Instructions; Unit Quantity; Unit Type"
8,365879935307,"ASR Outdoor 15pc Hand Gun Pistol Cleaning Tool Kit .357 .40 .45 Caliber",22700,"Sporting Goods|Hunting|Gun Smithing & Maintenance|Cleaning Supplies",20,12,0,8,,"Set Includes; Number of Items in Set; Gauge/Caliber; Vintage; Main Purpose; Number in Pack; Unit Quantity; Unit Type"
8,365879935315,"ASR Outdoor Carabiner and Awning Clamp Set Camping Essentials Tarp Clips 4pc Set",20761,"Home & Garden|Tools & Workshop Equipment|Hand Tools|Clamps & Vises",21,13,0,8,,"Number of Pieces; Jaw Size; Manufacturer Warranty; Personalize; Item Diameter; Personalization Instructions; Unit Quantity; Unit Type"
8,365879950523,"10pc Razor Knife Blade Refill Pack Replacement Blades for 8828 Hobby Knife",39057,"Home & Garden|Tools & Workshop Equipment|Hand Tools|Knives & Blades",19,11,0,8,,"Number of Pieces; Handle Material; Blade Material; Blade Width; Manufacturer Warranty; Item Diameter; Unit Quantity; Unit Type"
8,365879950541,"ASR Outdoor Extendable Fly Swatter Durable Telescopic Pole Anti Slip",181042,"Home & Garden|Yard, Garden & Outdoor Living|Weed & Pest Control|Insect & Grub Control|Swatters",24,16,0,8,,"Pest Type; Indoor/Outdoor; Battery Included; Number in Pack; Cable Length; Voltage; Unit Quantity; Unit Type"
8,365879950566,"ASR Outdoor Styled Inlay Pocket Knife Steel Blade Thumb Assist Open Pocket Clip",48818,"Collectibles|Knives, Swords & Blades|Collectible Folding Knives|Modern Folding Knives|Factory Manufactured",19,11,0,8,,"Type; Product Line; Blade Edge; Lock Type; Tools; Blade Range; Original/Reproduction; Dexterity"
8,365879996371,"ASR Outdoor Gun Cleaning Kit Brass Punches Brushes Canvas Pouch 14 Piece Set",22700,"Sporting Goods|Hunting|Gun Smithing & Maintenance|Cleaning Supplies",20,12,0,8,,"Set Includes; Number of Items in Set; Gauge/Caliber; Vintage; Main Purpose; Number in Pack; Unit Quantity; Unit Type"
8,365880042761,"6"" Paracord Wrapped Compact Neck Chain Knife with Sheath (Neon Green) Tactical",73522,"Collectibles|Knives, Swords & Blades|Collectible Fixed Blade Knives|Modern Fixed Blade|Factory Manufactured",15,7,0,8,,"Blade Color; Blade Type; Tang; Blade Length; Blade Edge; Features; Original/Reproduction; Dexterity"
7,126261745604,"Ultra Light Foam Kneeling Pad and Seat Cushion for Home Garden Outdoor 2pk",75669,"Home & Garden|Yard, Garden & Outdoor Living|Garden Clothing & Protective Gear|Garden Kneelers, Cushions & Seats",25,18,0,7,,"Number of Items in Set; Features; Seat Height; FSC Certified; Care Instructions; Manufacturer Warranty; Maximum Weight Capacity"
7,126470733977,"Universal Home Dual Compartment Hobby Craft Tool Box",33089,"Home & Garden|Tools & Workshop Equipment|Tool Boxes & Storage|Tool Boxes",22,15,0,7,,"Number of Items; Number of Drawers; Capacity; Manufacturer Warranty; Item Diameter; Unit Quantity; Unit Type"
7,126473385852,"Home Essentials Manicure Pedicure Foot Scrubber Foot File Callus Remover - Blue",11872,"Health & Beauty|Nail Care, Manicure & Pedicure|Nail Care Tools|Manicure & Pedicure Tools & Kits",16,9,0,7,,"Set Includes; Power Source; Power; Personalize; Personalization Instructions; Unit Quantity; Unit Type"
7,127236581110,"ToolTreaux 10k 14k 18k 22k Complete Gold Testing Kit with Testing Stone 5pc",262020,"Jewelry & Watches|Jewelry Care, Design & Repair|Jewelry Tools & Workbenches",12,5,0,7,,"Suitable For; Material; Set Includes; Seller Warranty; MPN; Unit Quantity; Unit Type"
7,127389768417,"Home Essentials Manicure Pedicure Foot Scrubber Foot File Callus Remover - Red",11872,"Health & Beauty|Nail Care, Manicure & Pedicure|Nail Care Tools|Manicure & Pedicure Tools & Kits",16,9,0,7,,"Set Includes; Power Source; Power; Personalize; Personalization Instructions; Unit Quantity; Unit Type"
7,127389838913,"ASR Outdoor Assorted Camo Design Paracord Bracelet Kit with Buckles 10ft Each",181413,"Sporting Goods|Camping & Hiking|Outdoor Survival Gear|Paracord & Paracord Supplies",19,12,0,7,,"Number in Pack; Number of Strands; Suitable For; Tensile Strength; Rope Diameter; Unit Quantity; Unit Type"
7,127389838926,"7 Inch Sapphire Nail File Home Manicure Pedicure Tool Beauty and Personal Care",11872,"Health & Beauty|Nail Care, Manicure & Pedicure|Nail Care Tools|Manicure & Pedicure Tools & Kits",16,9,0,7,,"Set Includes; Power Source; Power; Personalize; Personalization Instructions; Unit Quantity; Unit Type"
7,127389838940,"ASR Outdoor Assorted Colors Paracord Bracelet Making Kit Matching Buckles 10pc",181413,"Sporting Goods|Camping & Hiking|Outdoor Survival Gear|Paracord & Paracord Supplies",19,12,0,7,,"Number in Pack; Number of Strands; Suitable For; Tensile Strength; Rope Diameter; Unit Quantity; Unit Type"
7,127389838943,"Disney Mickey Mouse Kids Colored Pencils Art and School Supplies Set 8 Pack",28108,"Crafts|Art Supplies|Drawing & Lettering Supplies|Art Pencils & Charcoal",14,7,0,7,,"Brand; Product Line; Hardness; Lead Size; Model; Unit Quantity; Unit Type"
7,127389838944,"Marvel Avengers 6pc Grab and Go Play Pack Coloring Book for Boys Ages 3 and Up",102951,"Home & Garden|School Supplies|Markers & Crayons",14,7,0,7,,"Theme; Style; Pattern; Personalize; Personalization Instructions; Unit Quantity; Unit Type"
7,127389838952,"ASR Outdoor Black Stretch Shock Cord Plastic Ball Utility Cord (Pack Sizes)",109492,"Business & Industrial|Fasteners & Hardware|Clamps, Ties & Cords|Shock Cords & Bungees",16,9,0,7,,"Tensile Strength; MPN; Unit Quantity; Unit Type; Number in Pack; California Prop 65 Warning; Manufacturer Warranty"
7,127389878167,"ASR Outdoor 550 Paracord Rope Strong 7 Strand Parachute Cord - OD Green 100ft",181413,"Sporting Goods|Camping & Hiking|Outdoor Survival Gear|Paracord & Paracord Supplies",19,12,0,7,,"Number in Pack; Number of Strands; Suitable For; Tensile Strength; Rope Diameter; Unit Quantity; Unit Type"
7,127389878198,"ToolTreaux 9 Pocket Leather Tool Belt Large Hammer Drill Tool Pouch",42362,"Home & Garden|Tools & Workshop Equipment|Tool Boxes & Storage|Tool Bags, Belts & Pouches",19,12,0,7,,"MPN; Country of Origin; Manufacturer Warranty; Item Diameter; Item Weight; Unit Quantity; Unit Type"
7,127389878203,"ASR Outdoor Tarp Awning Clamps 2pk",20761,"Home & Garden|Tools & Workshop Equipment|Hand Tools|Clamps & Vises",21,14,0,7,,"Jaw Size; Manufacturer Warranty; Personalize; Item Diameter; Personalization Instructions; Unit Quantity; Unit Type"
7,127389878236,"Flatline Ops Rear Slide Gun Back Butt Plate Cover for Glock Firearm Accessory",73944,"Sporting Goods|Hunting|Gun Parts|Pistol Parts",16,9,0,7,,"Item Length; Model; California Prop 65 Warning; Item Height; Item Weight; Item Width; MPN"
7,127389932527,"Fresh Mint Dental Floss for Teeth and Gum Oral Care Remove Food and Plaque 12pk",159758,"Health & Beauty|Oral Care|Dental Floss & Flossers",15,8,0,7,,"Product Line; Department; Handle Material; Tip Material; Manufacturer Warranty; Unit Quantity; Unit Type"
7,127389932536,"ASR Outdoor 9 Inch Aircraft Grade Aluminum Camping Stakes Tent Pegs (Pack Sizes)",36120,"Sporting Goods|Camping & Hiking|Tents & Canopies|Tent & Canopy Accessories",16,9,0,7,,"Features; Number in Pack; Mounting Type; Suitable For; Item Weight; Unit Quantity; Unit Type"
7,127389932537,"Home Essentials Professional Manicure Pedicure Nail Art Tool Set 3 Pieces",11872,"Health & Beauty|Nail Care, Manicure & Pedicure|Nail Care Tools|Manicure & Pedicure Tools & Kits",16,9,0,7,,"Set Includes; Power Source; Power; Personalize; Personalization Instructions; Unit Quantity; Unit Type"
7,127389932572,"Paw Patrol Push Pop It Sensory Fidget Toy Stress Relief for Kids Keychain - Pink",184590,"Toys & Hobbies|Educational|Special Needs & Autism|Fidget Blocks",13,6,0,7,,"Mechanism Included; Base Color; Age Level; Recommended Age Range; Mechanism Color; Number of Sides; Vintage"
7,127389932574,"10pc Sterile Surgical Grade Replacement Scalpel Blades Universal Fit - Size 11",104229,"Business & Industrial|Healthcare, Lab & Dental|Handpieces & Instruments|Scalpels, Surgical Blades & Handles",12,5,0,7,,"Product; Blade Number; Handle Number; Intended Use/Discipline; Expiration Date; Unit Quantity; Unit Type"
7,127389932575,"Kidplokio Ultimate Fleet 50pc Multicolor Diecast Toy Cars Play Set for Boys 3+",180506,"Toys & Hobbies|Diecast & Toy Vehicles|Cars, Trucks & Vans|Contemporary Manufacture",22,15,0,7,,"Vehicle Make; Scale; Series; Theme; Age Level; Customized; Vintage"
7,127389932576,"ToolTreaux Stainless Steel Heavy Duty Fabric Scissors Sewing Supplies, 12 Inch",28171,"Crafts|Sewing|Cutting Tools|Dressmaker's Scissors & Shears",12,5,0,7,,"Type; Blade Size; Cut Type; Suitable For; Blade Material; Unit Quantity; Unit Type"
7,127389946571,"5 Pack Dove Shea Butter Beauty Cream Moisturizing Bar Soap with Vanilla 3.75oz",180924,"Health & Beauty|Bath & Body|Body Soaps",21,14,0,7,,"Body Area; Department; Pattern; Product Line; Personalization Instructions; Unit Quantity; Unit Type"
7,235226017969,"ToolTreaux Eye Glasses Repair Kit Assorted Replacement Micro Screws 250 Pieces",117039,"Jewelry & Watches|Watches, Parts & Accessories|Parts, Tools & Guides|Tools & Repair Kits",10,3,0,7,,"Type of Tool; Model; Personalize; MPN; Personalization Instructions; Unit Quantity; Unit Type"
7,235436886860,"6inch ASR Outdoor Serrated Fixed Blade Tanto Point Hunting Neck Knife - Black",73522,"Collectibles|Knives, Swords & Blades|Collectible Fixed Blade Knives|Modern Fixed Blade|Factory Manufactured",15,8,0,7,,"Blade Color; Blade Type; Tang; Blade Length; Blade Edge; Original/Reproduction; Dexterity"
7,235450751834,"ASR Outdoor 550 Paracord Rope Strong 7 Strand Cordage - Glow in the Dark 100ft",181413,"Sporting Goods|Camping & Hiking|Outdoor Survival Gear|Paracord & Paracord Supplies",19,12,0,7,,"Number in Pack; Number of Strands; Suitable For; Tensile Strength; Rope Diameter; Unit Quantity; Unit Type"
7,235480965695,"ASR Outdoor 13.5"" Collector's Hunting Knife with Animal Head Pommel Many Styles",73522,"Collectibles|Knives, Swords & Blades|Collectible Fixed Blade Knives|Modern Fixed Blade|Factory Manufactured",15,8,0,7,,"Blade Color; Blade Type; Tang; Blade Edge; Features; Original/Reproduction; Dexterity"
7,235553303692,"Jot 24 Piece Count Mini Colored Pencil Kids Art School Supplies Set",28108,"Crafts|Art Supplies|Drawing & Lettering Supplies|Art Pencils & Charcoal",14,7,0,7,,"Product Line; Color Style; Hardness; Lead Size; Handmade; Unit Quantity; Unit Type"
7,235578359942,"3 Piece Throwing Knife Set 440 Stainless Steel with Compact Carrying Case",73522,"Collectibles|Knives, Swords & Blades|Collectible Fixed Blade Knives|Modern Fixed Blade|Factory Manufactured",15,8,0,7,,"Blade Color; Blade Type; Tang; Blade Length; Blade Edge; Original/Reproduction; Dexterity"
7,236153756994,"ToolTreaux 6pc 10k 14k 18k 22k Complete Gold Testing Kit with Testing Stone",262020,"Jewelry & Watches|Jewelry Care, Design & Repair|Jewelry Tools & Workbenches",12,5,0,7,,"Suitable For; Material; Set Includes; Seller Warranty; MPN; Unit Quantity; Unit Type"
7,236344962444,"Universal 5 Inch Hobby Knife Metal Scalpel Handle Number 3 - 5 Pack",104229,"Business & Industrial|Healthcare, Lab & Dental|Handpieces & Instruments|Scalpels, Surgical Blades & Handles",12,5,0,7,,"Product; Blade Number; Handle Number; Intended Use/Discipline; Expiration Date; Unit Quantity; Unit Type"
7,236345031448,"ASR Outdoor Elastic Shock Cord Natural Rubber 30 Feet 3mm Diameter - Black",109492,"Business & Industrial|Fasteners & Hardware|Clamps, Ties & Cords|Shock Cords & Bungees",16,9,0,7,,"Stretched Bungee Length; Hook Material; Tensile Strength; Unit Quantity; Unit Type; Number in Pack; Manufacturer Warranty"
7,236345031452,"Professional Quality Tapered Diamond File Assorted Grits 10 Piece Set",178974,"Home & Garden|Tools & Workshop Equipment|Hand Tools|Files",19,12,0,7,,"Number of Pieces; Coarseness; Cut; Manufacturer Warranty; Item Diameter; Unit Quantity; Unit Type"
7,236345031475,"GEAR AID Tenacious Tape Reflective Patches for Safety, Jackets, Bike and Outdoor",36120,"Sporting Goods|Camping & Hiking|Tents & Canopies|Tent & Canopy Accessories",16,9,0,7,,"Number in Pack; Color; Mounting Type; Suitable For; California Prop 65 Warning; Unit Quantity; Unit Type"
7,236345069154,"Universal Tool Reeled Solder with Flux Coating 100 Grams 1mm Diameter",124821,"Business & Industrial|CNC, Metalworking & Manufacturing|Welding & Soldering Equipment|Soldering/Desoldering Equipment & Accessories|Solder & Soldering Consumables|Solder",12,5,0,7,,"Solder Form; Solder Type; Container Size; Wire Diameter; Expiration Date; Unit Quantity; Unit Type"
7,236345137152,"2pc Heavy Duty Plastic Cap Knee Pads for Work Gardening Flooring Joint Support",75669,"Home & Garden|Yard, Garden & Outdoor Living|Garden Clothing & Protective Gear|Garden Kneelers, Cushions & Seats",25,18,0,7,,"Seating Capacity; Seat Depth; Seat Height; FSC Certified; Care Instructions; Manufacturer Warranty; Maximum Weight Capacity"
7,236345137156,"(4 Pack) ASR Outdoor Clear Emergency Waterproof Poncho Set (3 Colors)",181415,"Sporting Goods|Camping & Hiking|Outdoor Survival Gear|Other Outdoor Survival Gear",18,11,0,7,,"Set Includes; Vintage; California Prop 65 Warning; Item Weight; MPN; Unit Quantity; Unit Type"
7,236345137193,"Fresh Mint Dental Floss for Teeth and Gum Oral Care Remove Food and Plaque 3pk",159758,"Health & Beauty|Oral Care|Dental Floss & Flossers",15,8,0,7,,"Product Line; Department; Handle Material; Tip Material; Manufacturer Warranty; Unit Quantity; Unit Type"
7,236345137199,"Beille 3pc Wheat Straw Spoons and Ladle Set Cooking Baking Kitchen Utensils",20649,"Home & Garden|Kitchen, Dining & Bar|Kitchen Tools & Gadgets|Cooking Utensils",19,12,0,7,,"Pattern; Theme; Personalize; Making Method; Unit Quantity; Unit Type; Personalization Instructions"
7,236345137221,"Home Essentials Nail Files Buffers Emery Boards Beauty Tools Set Mani Pedi 18pc",11872,"Health & Beauty|Nail Care, Manicure & Pedicure|Nail Care Tools|Manicure & Pedicure Tools & Kits",16,9,0,7,,"Set Includes; Power Source; Power; Personalize; Personalization Instructions; Unit Quantity; Unit Type"
7,236349205704,"ASR Tactical 2000 Lumen 5-Stage Rechargeable Flashlight with Adjustable Beam",16037,"Sporting Goods|Camping & Hiking|Flashlights, Lanterns & Lights|Flashlights",28,21,0,7,,"Operating Range; Voltage; Operating Time; IP Rating; Model; Number of LEDs; Personalization Instructions"
7,363665320900,"Home Kitchen Multi-Pack Thin Clear Flexible Plastic Cutting Board Mat 12"" x 15""",46282,"Home & Garden|Kitchen, Dining & Bar|Kitchen Tools & Gadgets|Cutting Boards",28,21,0,7,,"Wood Tone; Manufacturer Warranty; California Prop 65 Warning; Unit Quantity; Unit Type; Making Method; Personalization Instructions"
7,364584755081,"ASR Outdoor Ceramic Micro Striker Scraper Emergency Fire Starter",166126,"Sporting Goods|Camping & Hiking|Outdoor Survival Gear|Fire Starters",17,10,0,7,,"Features; Number in Pack; Suitable For; MPN; Model; Unit Quantity; Unit Type"
7,364755157439,"ASR Outdoor Ceramic Micro Striker Scraper Emergency Fire Starter",166126,"Sporting Goods|Camping & Hiking|Outdoor Survival Gear|Fire Starters",17,10,0,7,,"Features; Number in Pack; Suitable For; MPN; Model; Unit Quantity; Unit Type"
7,364835511265,"13.5"" American Eagle & Flag Collector Hunting Knife with Scabbard & Etched Blade",73522,"Collectibles|Knives, Swords & Blades|Collectible Fixed Blade Knives|Modern Fixed Blade|Factory Manufactured",15,8,0,7,,"Blade Color; Blade Type; Tang; Blade Length; Blade Edge; Original/Reproduction; Dexterity"
7,365879832357,"Universal Tool Assorted Diamond Burr Set 120 Grit .125 Inch Shank 30 Pieces",50382,"Home & Garden|Tools & Workshop Equipment|Power Tool & Air Tool Accessories|Drill Bits",21,14,0,7,,"Type; Application; Item Diameter; Manufacturer Warranty; Item Depth; Unit Quantity; Unit Type"
7,365879832367,"6 Pack Portable Outdoor Camping Survival Wire Hand Saw With Two 35 cm Blades",75237,"Sporting Goods|Camping & Hiking|Camping Knives & Tools|Camping Saws",20,13,0,7,,"Handle Material; Blade Material; Blade Length; Closed Length; Handle Length; Manufacturer Warranty; Overall Length"
7,365879832376,"3pk Universal Tool Work Gloves Adult Outdoor Home Gardening Heavy Duty Accessory",139864,"Home & Garden|Yard, Garden & Outdoor Living|Garden Clothing & Protective Gear|Gardening Gloves & Knee Pads",21,14,0,7,,"Department; Glove Coating Material; Number of Items; Body Area; Application; Sport/Activity; Manufacturer Warranty"
7,365879832377,"ToolTreaux Tempered Stainless Steel Barber Scissors Hair Cut Shears 5.5 6.5 7.5""",101915,"Health & Beauty|Salon & Spa Equipment|Scissors & Shears",17,10,0,7,,"Item Length; Manufacturer Warranty; MPN; Shape; Model; Unit Quantity; Unit Type"
7,365879907957,"Marvel Spiderman 8pc Eraser Pack School Supplies Stocking Stuffer Boys Age 4 Up",102954,"Home & Garden|School Supplies|Stamps & Stickers",14,7,0,7,,"Sub-Type; Theme; Type; Pattern; Personalized; Unit Quantity; Unit Type"
7,365879908022,"ASR Outdoor Stretch Bungee Cord White with Red Ball Tie Down 6 Inch Large",109492,"Business & Industrial|Fasteners & Hardware|Clamps, Ties & Cords|Shock Cords & Bungees",16,9,0,7,,"Item Width; Tensile Strength; Unit Quantity; Unit Type; Number in Pack; California Prop 65 Warning; Manufacturer Warranty"
7,365879935278,"Universal Tool Professional Power Extension Socket Bits for Drills 3pc Set",50382,"Home & Garden|Tools & Workshop Equipment|Power Tool & Air Tool Accessories|Drill Bits",21,14,0,7,,"Suitable For; Application; Item Diameter; Manufacturer Warranty; Item Depth; Unit Quantity; Unit Type"
7,365879935291,"ToolTreaux Clear 4 Compartment Plastic Pop Top Storage Organizer",33089,"Home & Garden|Tools & Workshop Equipment|Tool Boxes & Storage|Tool Boxes",22,15,0,7,,"Number of Items; Number of Drawers; Capacity; Manufacturer Warranty; Item Diameter; Unit Quantity; Unit Type"
7,365879935314,"ASR Outdoor 550 Paracord Rope Strong 7 Strand Parachute Cord - Black 100ft",181413,"Sporting Goods|Camping & Hiking|Outdoor Survival Gear|Paracord & Paracord Supplies",19,12,0,7,,"Number in Pack; Number of Strands; Suitable For; Tensile Strength; Rope Diameter; Unit Quantity; Unit Type"
7,365879950529,"Gear Aid Explorer Field Repair Kit Outdoor Camping Survival Emergency - Small",36120,"Sporting Goods|Camping & Hiking|Tents & Canopies|Tent & Canopy Accessories",16,9,0,7,,"Mounting Type; Suitable For; Item Weight; California Prop 65 Warning; MPN; Unit Quantity; Unit Type"
7,365879950554,"Girls Cartoon Paddle Detangling Hair Brush Minnie Mouse Barbie Lilo & Stitch",11855,"Health & Beauty|Hair Care & Styling|Brushes & Combs",20,13,0,7,,"Manufacturer Warranty; MPN; Personalize; Model; Personalization Instructions; Unit Quantity; Unit Type"
7,365879950574,"Universal Handy Helpers Fruit and Vegetable Peeler Dishwasher Safe (2 Colors)",20641,"Home & Garden|Kitchen, Dining & Bar|Kitchen Tools & Gadgets|Peelers & Slicers",18,11,0,7,,"Set Includes; Food Compatibility; MPN; Features; Making Method; Unit Quantity; Unit Type"
7,365879950578,"12pc Professional Wood Carving Chisel Set Various Blades Woodworking Clay & Wax",178972,"Home & Garden|Tools & Workshop Equipment|Hand Tools|Chisels",19,12,0,7,,"Handle Material; Blade Material; Blade Width; Manufacturer Warranty; Item Diameter; Unit Quantity; Unit Type"
7,365879950587,"9 Pocket Carpenter Tool Belt Heavy Duty Suede Leather Fits Hammer And Nails",42362,"Home & Garden|Tools & Workshop Equipment|Tool Boxes & Storage|Tool Bags, Belts & Pouches",19,12,0,7,,"MPN; Features; Manufacturer Warranty; Item Diameter; Item Weight; Unit Quantity; Unit Type"
7,365879952718,"ASR Tactical 3000 Lumen 5-Stage Rechargeable Flashlight with Adjustable Beam",16037,"Sporting Goods|Camping & Hiking|Flashlights, Lanterns & Lights|Flashlights",28,21,0,7,,"Operating Range; Voltage; Operating Time; IP Rating; Model; Number of LEDs; Personalization Instructions"
7,365879996340,"Disney Encanto 10pc Girls Hair Accessory Backpack Dress Up Bows Girls 3 and Up",57920,"Clothing, Shoes & Accessories|Kids|Girls|Girls' Accessories|Hair Accessories",19,12,0,7,,"Occasion; Hair Type; Accents; Theme; Pattern; Personalize; Personalization Instructions"
7,365879996375,"Nickelodeon Girls Jojo Siwa Comfortable Breathable Bandana Face Cover Protection",122321,"Clothing, Shoes & Accessories|Kids|Boys|Boys' Accessories|Scarves",19,12,0,7,,"Personalize; Pattern; Style; Handmade; Season; Theme; Personalization Instructions"
7,365879996433,"Universal Full Tang Spiked Axe Tomahawk Wooden Handle Ultra Lightweight Tactical",75234,"Sporting Goods|Camping & Hiking|Camping Knives & Tools|Camping Hatchets & Axes",19,12,0,7,,"Blade Length; Blade Material; Handle Length; Handle Material; Manufacturer Warranty; Unit Quantity; Unit Type"
7,365880019097,"Freesole Shoe and Boot Repair Adhesive",36120,"Sporting Goods|Camping & Hiking|Tents & Canopies|Tent & Canopy Accessories",16,9,0,7,,"Features; Number in Pack; Mounting Type; Suitable For; California Prop 65 Warning; Unit Quantity; Unit Type"
7,365880042741,"Universal Tool Heavy Duty Camp Axe Hatchet with Sheath Buckshot - Survival Prep",75234,"Sporting Goods|Camping & Hiking|Camping Knives & Tools|Camping Hatchets & Axes",19,12,0,7,,"Blade Length; Blade Material; Handle Length; Handle Material; Manufacturer Warranty; Unit Quantity; Unit Type"
7,366442753207,"ToolTreaux 3pc Mini Garden Tools Set with Hand Trowels and Cultivator (7 Inches)",118867,"Home & Garden|Yard, Garden & Outdoor Living|Garden Hand Tools & Equipment|Garden Tool Sets",23,16,0,7,,"Item Weight; California Prop 65 Warning; Manufacturer Warranty; Model; Personalization Instructions; Unit Quantity; Unit Type"
6,126419572927,"ASR Outdoor 3 in 1 Flint Rod Striker Fire Starter Whistle Orange Green Black",166126,"Sporting Goods|Camping & Hiking|Outdoor Survival Gear|Fire Starters",17,11,0,6,,"Features; Number in Pack; Suitable For; MPN; Unit Quantity; Unit Type"
6,126489346392,"ToolTreaux 6pc Diamond Coated Flat File Set, 40 to 600 Grit",178974,"Home & Garden|Tools & Workshop Equipment|Hand Tools|Files",19,13,0,6,,"Coarseness; Cut; Manufacturer Warranty; Item Diameter; Unit Quantity; Unit Type"
6,127389768435,"Shear Scissors Blades Sharp Heat Treated Thread Nipper 4.25 inches",28171,"Crafts|Sewing|Cutting Tools|Dressmaker's Scissors & Shears",12,6,0,6,,"Blade Size; Cut Type; Suitable For; Blade Material; Unit Quantity; Unit Type"
