priority,item_id,title,category_id,category_path,schema_aspects,present,missing_required,missing_recommended,missing_required_names,missing_recommended_names
13,365879996421,"ASR Outdoor Compact Rope Gun Cleaning Tool (4 Caliber Sizes)",22700,"Sporting Goods|Hunting|Gun Smithing & Maintenance|Cleaning Supplies",20,7,0,13,,"Set Includes; Number of Items in Set; Material; Color; Gauge/Caliber; Vintage; Features; Main Purpose; Item Height; Item Length; Item Weight; Item Width; MPN"
13,365920250803,"Beille 17oz Stoneware Terracotta Coffee Mug Farmhouse Decor Kitchen (4 Colors)",20695,"Home & Garden|Kitchen, Dining & Bar|Dinnerware & Serveware|Mugs",28,15,0,13,,"Theme; Pattern; Character Family; MPN; Character; Item Height; Item Width; Manufacturer Warranty; Model; Item Weight; California Prop 65 Warning; Unit Type; Personalization Instructions"
12,126112000074,"7 Inch Jumbo Aluminum Carabiner Hiking Cushion Grip (6 Colors)",52373,"Clothing, Shoes & Accessories|Men|Men's Accessories|Key Chains, Rings & Cases",20,8,0,12,,"Character; Theme; Character Family; Accents; Vintage; Personalize; Handmade; Pattern; Features; MPN; Number of Pieces; Personalization Instructions"
12,126439889445,"The Brief Safe Travel Security Hidden Contents Diversion Safe - Slightly Unusual",112601,"Home & Garden|Home Improvement|Home Security|Safes",26,14,0,12,,"Security Rating; Item Height; Item Width; Fire Rating; Item Depth; Fixture Type; Finish; Manufacturer Warranty; Item Weight; MPN; Unit Quantity; Unit Type"
12,126459398545,"Jumbo 6.5"" XL Carabiner Key Chain With Hand Grip (Many Colors)",52373,"Clothing, Shoes & Accessories|Men|Men's Accessories|Key Chains, Rings & Cases",20,8,0,12,,"Character; Theme; Character Family; Accents; Vintage; Personalize; Handmade; Pattern; Features; MPN; Number of Pieces; Personalization Instructions"
12,126501503524,"ASR Outdoor Illuminated Dry Box Detachable Lid Large Waterproof Storage Case",181390,"Sporting Goods|Camping & Hiking|Camping Storage",27,15,0,12,,"Number of Items in Set; Capacity; Weight Capacity; Number of Compartments; Manufacturer Warranty; Suitable For; Shape; Care Instructions; Item Depth; Item Diameter; Unit Quantity; Unit Type"
12,127389838933,"Kidplokio 2 in 1 Transforming Toys Robot RC Car Lights Sounds Boys Ages 3 and Up",182183,"Toys & Hobbies|Radio Control & Control Line|RC Model Vehicles & Kits|Cars, Trucks & Motorcycles",20,8,0,12,,"Scale; Product Line; Fuel Type; Motor Type; 4WD/2WD; Recommended Surface; Model Grade; Required Assembly; Vintage; Characteristics; Age Level; Replica of"
12,127389838965,"4 Pack Thin Clear Flexible Plastic Kitchen Cutting Board 12 Inch x 15 Inch",46282,"Home & Garden|Kitchen, Dining & Bar|Kitchen Tools & Gadgets|Cutting Boards",28,16,0,12,,"Pattern; Personalize; Wood Tone; Style; Item Depth; Manufacturer Warranty; Theme; California Prop 65 Warning; Unit Quantity; Unit Type; Making Method; Personalization Instructions"
12,127389857882,"ToolTreaux Waterproof Storage Container Lanyard Translucent Durable Plastic",181390,"Sporting Goods|Camping & Hiking|Camping Storage",27,15,0,12,,"Number of Items in Set; Capacity; Weight Capacity; Number of Compartments; Manufacturer Warranty; Suitable For; Shape; Care Instructions; Item Depth; Item Diameter; Unit Quantity; Unit Type"
12,127389878195,"Space Jam 2 Tune Squad Adjustable Baseball Cap for Kids and Adults",52365,"Clothing, Shoes & Accessories|Men|Men's Accessories|Hats",24,12,0,12,,"Theme; Pattern; Fabric Type; Occasion; Vintage; Season; Handmade; Signed; Personalize; Personalization Instructions; Unit Quantity; Unit Type"
12,127389932567,"Beille 5 Piece Home Ergonomic Kitchen Knives Set, 5 Knife Essential Bundle",177005,"Home & Garden|Kitchen, Dining & Bar|Flatware, Knives & Cutlery|Kitchen & Steak Knives",21,9,0,12,,"Type; Set Includes; Number of Items in Set; Food Compatibility; Blade Edge; Handle Material; Personalize; Manufacturer Warranty; Making Method; Unit Quantity; Unit Type; Personalization Instructions"
12,127737051015,"Productive Fitness Poster Series Upper Body Stretching Exercises Non-Laminated",28009,"Art|Art Posters",33,21,0,12,,"Year of Production; Character; Featured Person/Artist; Original/Licensed Reprint; Artist; Culture; Time Period Manufactured; Framing; COA Issued By; Certificate of Authenticity (COA); Personalization Instructions; Signed By"
12,235537299734,"Kidplokio 360 Degree Bump and Go Emergency Responders Fire Truck Police Car Toy",180506,"Toys & Hobbies|Diecast & Toy Vehicles|Cars, Trucks & Vans|Contemporary Manufacture",22,10,0,12,,"Vehicle Make; Scale; Series; Vehicle Type; Features; Theme; Autographed; Age Level; Recommended Age Range; Customized; Country of Origin; Vintage"
12,235612248029,"KidPlay Deluxe Die Cast Car City Set Racing Airport Military Fire Construction",180506,"Toys & Hobbies|Diecast & Toy Vehicles|Cars, Trucks & Vans|Contemporary Manufacture",22,10,0,12,,"Vehicle Make; Scale; Series; Vehicle Type; Model; Features; Theme; Autographed; Age Level; Recommended Age Range; Customized; Vintage"
12,236344962459,"Beille Stainless Steel Kitchen Cutlery Knife Set Carving Paring Utility 6 Piece",177005,"Home & Garden|Kitchen, Dining & Bar|Flatware, Knives & Cutlery|Kitchen & Steak Knives",21,9,0,12,,"Set Includes; Number of Items in Set; Food Compatibility; Blade Edge; Handle Material; Blade Length; Personalize; Manufacturer Warranty; Making Method; Unit Quantity; Unit Type; Personalization Instructions"
12,236345031472,"ASR Outdoor Survival 550 Type III Mil-Spec Tactical Paracord Rope (Many Lengths)",181413,"Sporting Goods|Camping & Hiking|Outdoor Survival Gear|Paracord & Paracord Supplies",19,7,0,12,,"Features; Number in Pack; Number of Strands; Suitable For; Tensile Strength; California Prop 65 Warning; Item Weight; MPN; Model; Rope Diameter; Unit Quantity; Unit Type"
12,236345069168,"SE 8372SH Stone Hammer, 10""",20763,"Home & Garden|Tools & Workshop Equipment|Hand Tools|Hammers & Mallets",21,9,0,12,,"Head/Face Material; Handle Material; Number of Pieces; Handle Size; Model; Manufacturer Warranty; MPN; Personalize; Item Diameter; Personalization Instructions; Unit Quantity; Unit Type"
12,236345069172,"ASR Outdoor Cord 325lb Survival Tactical Polyester Sleeved Rope 25ft 100ft 500ft",181413,"Sporting Goods|Camping & Hiking|Outdoor Survival Gear|Paracord & Paracord Supplies",19,7,0,12,,"Features; Number in Pack; Number of Strands; Country of Origin; Suitable For; Tensile Strength; California Prop 65 Warning; Item Weight; MPN; Rope Diameter; Unit Quantity; Unit Type"
12,236345069183,"Beille 2pk Non Scratch Coconut Plant Based Dish Sponge Kitchen Tools (2 Styles)",129609,"Home & Garden|Household Supplies & Cleaning|Cleaning Tools|Sponges & Scourers",18,6,0,12,,"Capacity; MPN; Color; Model; Theme; California Prop 65 Warning; Item Height; Item Length; Item Weight; Item Width; Unit Quantity; Unit Type"
12,236345069194,"Beille Electronic Kitchen Cooking Baking Digital Food Scale 22lbs Capacity",50419,"Home & Garden|Kitchen, Dining & Bar|Kitchen Tools & Gadgets|Kitchen Scales",23,11,0,12,,"Type; Wood Tone; Power Source; Shape; Style; Power; Pattern; Item Diameter; Manufacturer Warranty; Unit Quantity; Unit Type; Making Method"
12,236345137188,"Vaseline Lip Therapy Rosy Lips .16oz Pink Tinted Lip Balm Pure Petroleum Jelly",36870,"Health & Beauty|Skin Care|Lip Balm & Treatments",26,14,0,12,,"Ingredients; Active Ingredients; Sun Protection Factor (SPF); UVA Protection; Volume; Period After Opening (PAO); Formulation; Personalize; Expiration Date; Personalization Instructions; Unit Quantity; Unit Type"
12,236407324687,"ASR Federal Leather Bifold Minimalist Double ID Card Holder, Black Basketweave",2996,"Clothing, Shoes & Accessories|Men|Men's Accessories|Wallets",24,12,0,12,,"Theme; Features; Character; Accents; Fabric Type; California Prop 65 Warning; Item Length; Item Width; MPN; Personalization Instructions; Unit Quantity; Unit Type"
12,364760331441,"Outdoor Thermal Mat Heat Reflective Sleeping Pad Insulated Winter Chill",36114,"Sporting Goods|Camping & Hiking|Outdoor Sleeping Gear|Air Mattresses & Sleeping Pads",25,13,0,12,,"Suitable For; Shell Material; Department; Insulation Type; Set Includes; Temperature Rating; Care Instructions; Manufacturer Warranty; Packed Size; Stuff Sack Size; Unit Quantity; Unit Type"
12,364824402665,"Fire Engine Rescue Truck with Firefighter Utility Bucket",180506,"Toys & Hobbies|Diecast & Toy Vehicles|Cars, Trucks & Vans|Contemporary Manufacture",22,10,0,12,,"Vehicle Make; Scale; Series; Vehicle Type; Character Family; Features; Theme; Autographed; Age Level; Recommended Age Range; Customized; Vintage"
12,364864238927,"Universal Rubber Head Clamps 3 Inch Secure Lever Lock Metal Body Outdoor",20761,"Home & Garden|Tools & Workshop Equipment|Hand Tools|Clamps & Vises",21,9,0,12,,"Number of Pieces; Jaw Size; Model; Manufacturer Warranty; MPN; Personalize; Item Diameter; California Prop 65 Warning; Item Weight; Personalization Instructions; Unit Quantity; Unit Type"
12,364909134364,"Beille Kitchen Utensils High Heat Resistance Baking Cooking Tools (Many Styles)",20649,"Home & Garden|Kitchen, Dining & Bar|Kitchen Tools & Gadgets|Cooking Utensils",19,7,0,12,,"Set Includes; Handle Material; Number of Items in Set; MPN; Theme; Personalize; Making Method; Model; California Prop 65 Warning; Unit Quantity; Unit Type; Personalization Instructions"
12,365680010387,"Labrea Life + Home Solid Acacia Wooden Kitchen Utensils (Many Styles and Packs)",20649,"Home & Garden|Kitchen, Dining & Bar|Kitchen Tools & Gadgets|Cooking Utensils",19,7,0,12,,"Set Includes; Number of Items in Set; MPN; Theme; Features; Personalize; Making Method; Model; California Prop 65 Warning; Unit Quantity; Unit Type; Personalization Instructions"
12,365879832379,"Beille 3pc Stainless Steel Kitchen Cutlery Knife Set Cutting Santoku Chef Knife",177005,"Home & Garden|Kitchen, Dining & Bar|Flatware, Knives & Cutlery|Kitchen & Steak Knives",21,9,0,12,,"Set Includes; Number of Items in Set; Food Compatibility; Blade Edge; Handle Material; Blade Length; Personalize; Manufacturer Warranty; Making Method; Unit Quantity; Unit Type; Personalization Instructions"
12,365879832393,"ToolTtreaux Beauty Tools Nail Care Facial Care Cosmetic Tools (Many Styles)",11872,"Health & Beauty|Nail Care, Manicure & Pedicure|Nail Care Tools|Manicure & Pedicure Tools & Kits",16,4,0,12,,"Set Includes; Power Source; Material; Features; MPN; Power; Color; Personalize; Model; Personalization Instructions; Unit Quantity; Unit Type"
12,365879908021,"Lady Speed Stick Womens Invisible Dry Deodorant Antiperspirant (3 Scent Choices)",29580,"Health & Beauty|Bath & Body|Deodorants & Antiperspirants",16,4,0,12,,"Formulation; Department; Scent; Features; Product Line; Skin Type; Volume; Ingredients; MPN; Country of Origin; Unit Quantity; Unit Type"
12,365879908024,"ASR Federal Leather Police Bifold RFID Wallet Badge Holder with Removable ID",169271,"Clothing, Shoes & Accessories|Men|Men's Accessories|ID & Document Holders",21,9,0,12,,"Character; Character Family; Theme; Country of Origin; Style; Handmade; Vintage; Personalize; MPN; Item Length; Item Width; Personalization Instructions"
12,365879935319,"Universal Tool Cloth Polishing Buff Wheel 2 Inch Diameter Soft Muslin",42266,"Home & Garden|Tools & Workshop Equipment|Power Tools|Buffers & Polishers",23,11,0,12,,"Action; Disc Diameter; Voltage; Battery Included; Battery Technology; Power; Power Source; Battery Capacity; Manufacturer Warranty; Item Diameter; Unit Quantity; Unit Type"
12,365879950524,"Auto Emergency Hammer With Seatbelt Cutter and Window Punch",20763,"Home & Garden|Tools & Workshop Equipment|Hand Tools|Hammers & Mallets",21,9,0,12,,"Head/Face Material; Handle Material; Number of Pieces; Handle Size; Manufacturer Warranty; MPN; Personalize; Item Diameter; Item Weight; Personalization Instructions; Unit Quantity; Unit Type"
12,365879950549,"ToolTreaux 10 Pocket Heavy Duty Leather Tool Pouch DIY Woodworking, 12 x 10 Inch",42362,"Home & Garden|Tools & Workshop Equipment|Tool Boxes & Storage|Tool Bags, Belts & Pouches",19,7,0,12,,"Model; Features; Country of Origin; Manufacturer Warranty; Item Width; Item Length; Item Height; Item Diameter; California Prop 65 Warning; Item Weight; Unit Quantity; Unit Type"
12,365879950555,"ASR Outdoor Camping Axe Hatchet Multi Tool Black Steel With Cord Cutter",75234,"Sporting Goods|Camping & Hiking|Camping Knives & Tools|Camping Hatchets & Axes",19,7,0,12,,"Blade Length; Features; Handle Length; Manufacturer Warranty; Model; California Prop 65 Warning; Item Height; Item Length; Item Weight; Item Width; Unit Quantity; Unit Type"
12,365879996408,"ASR Tactical 6pk Mini LED Stick On Lights, Battery Operated Magnetic Mount",16037,"Sporting Goods|Camping & Hiking|Flashlights, Lanterns & Lights|Flashlights",28,16,0,12,,"Material; Operating Range; Voltage; Features; Number of Batteries; Battery Technology; Operating Time; IP Rating; Number of Lights; Model; Number of LEDs; Personalization Instructions"
11,125770812748,"HEROCLIP Carabiner Clip Hook Mini for Camping, Organization (Black & Blue)",52373,"Clothing, Shoes & Accessories|Men|Men's Accessories|Key Chains, Rings & Cases",20,9,0,11,,"Character; Theme; Character Family; Accents; Vintage; Personalize; Handmade; Pattern; California Prop 65 Warning; Number of Pieces; Personalization Instructions"
11,126468846680,"ASR Outdoor Portable Toilet Seat with Lid Compatible with 5 Gallon Bucket, Blk",181397,"Sporting Goods|Camping & Hiking|Camping Hygiene & Sanitation|Portable Toilets",24,13,0,11,,"Set Includes; Suitable For; Waste Tank Capacity; Water Tank Capacity; Manufacturer Warranty; Shape; Bowl Shape; Flush Type; Maximum Flow Rate; Unit Quantity; Unit Type"
11,126469785044,"50pc Diamond Burr Bit Set for  Rotary Tool (Multiple Grit Sizes)",260207,"Home & Garden|Tools & Workshop Equipment|Power Tool & Air Tool Accessories|Rotary Tool Accessories",23,12,0,11,,"Application; Model; Voltage; Connection Type; Number of Items in Set; Suitable For; Manufacturer Warranty; Item Diameter; Item Depth; Unit Quantity; Unit Type"
11,127389857805,"ASR Outdoor Comprehensive Wilderness Travel Medicine Guide and Survival Tool",181415,"Sporting Goods|Camping & Hiking|Outdoor Survival Gear|Other Outdoor Survival Gear",18,7,0,11,,"Features; Color; Set Includes; Material; Vintage; Item Height; Item Length; Item Weight; Item Width; MPN; Model"
11,127389857823,"Battle Round Personal Bottle Opener Stealth Key Chain",20688,"Home & Garden|Kitchen, Dining & Bar|Bar Tools & Accessories|Corkscrews & Openers",21,10,0,11,,"Type; Style; Character Family; Personalize; Occasion; Wood Tone; Theme; Character; Unit Quantity; Unit Type; Personalization Instructions"
11,127389857848,"ASR Tactical 2-Mode LED Ultra Violet UV Flashlight Handheld Black Light",16037,"Sporting Goods|Camping & Hiking|Flashlights, Lanterns & Lights|Flashlights",28,17,0,11,,"Operating Range; Voltage; Number of Batteries; Battery Technology; Personalize; Operating Time; IP Rating; Number of Lights; Lumens; Number of LEDs; Personalization Instructions"
11,127389857870,"ASR Outdoor 3 Function Classic Starter Pocket Utility Multi-Tool Camping Outdoor",75236,"Sporting Goods|Camping & Hiking|Camping Knives & Tools|Multi-Tools",20,9,0,11,,"Blade Material; Blade Edge; Blade Length; Features; Model; Item Weight; MPN; Manufacturer Warranty; Overall Length; Unit Quantity; Unit Type"
11,127389878150,"Lady Speed Stick Deodorant 1.4 Ounce Shower Fresh (41ml)",29580,"Health & Beauty|Bath & Body|Deodorants & Antiperspirants",16,5,0,11,,"Type; Formulation; Department; Scent; Product Line; Skin Type; Volume; Ingredients; MPN; Unit Quantity; Unit Type"
11,127389878180,"TychoTyke Construction and Rescue Tools Truck with Light and Sound Yellow",152934,"Toys & Hobbies|Diecast & Toy Vehicles|Construction Equipment|Contemporary Manufacture",21,10,0,11,,"Scale; Vehicle Make; Vehicle Type; Autographed; Features; Character Family; Theme; Age Level; Series; Recommended Age Range; Vintage"
11,127389932563,"Kidplokio Monster Trucks Toy ATV Off Road Friction Trailer Pull Back Cars",180506,"Toys & Hobbies|Diecast & Toy Vehicles|Cars, Trucks & Vans|Contemporary Manufacture",22,11,0,11,,"Vehicle Make; Scale; Series; Vehicle Type; Character Family; Theme; Autographed; Age Level; Recommended Age Range; Customized; Vintage"
11,127389932568,"Kids Racing Game Play Mat Diecast Metal Toy Car Carrier Playset 11pc",180506,"Toys & Hobbies|Diecast & Toy Vehicles|Cars, Trucks & Vans|Contemporary Manufacture",22,11,0,11,,"Vehicle Make; Scale; Series; Vehicle Type; Character Family; Theme; Autographed; Age Level; Recommended Age Range; Customized; Vintage"
11,127389932573,"ASR Outdoor Telescopic BBQ Fork 2 Prong Outdoor Cooking Utensil - 3 Pack",20725,"Home & Garden|Yard, Garden & Outdoor Living|Outdoor Heating, Cooking & Eating|Barbecue Tools",25,14,0,11,,"Set Includes; Number in Pack; Handle Material; Head Material; Personalize; Number of Items in Set; Style; Manufacturer Warranty; Personalization Instructions; Unit Quantity; Unit Type"
11,127389932589,"Set of 4 Non-Stick BBQ Grill Mats Reusable Easy to Clean",20725,"Home & Garden|Yard, Garden & Outdoor Living|Outdoor Heating, Cooking & Eating|Barbecue Tools",25,14,0,11,,"Set Includes; Number in Pack; Handle Material; Head Material; Personalize; Number of Items in Set; Style; Manufacturer Warranty; Personalization Instructions; Unit Quantity; Unit Type"
11,127389946577,"ASR Outdoor Braided Technora 950lb Survival Cord Rope - Natural (Many Lengths)",181413,"Sporting Goods|Camping & Hiking|Outdoor Survival Gear|Paracord & Paracord Supplies",19,8,0,11,,"Color; Features; Number in Pack; Number of Strands; Country of Origin; Suitable For; Tensile Strength; MPN; Rope Diameter; Unit Quantity; Unit Type"
11,127389969234,"ASR Outdoor Foldable Portable Clear Camping Collapsible Water Storage Bag 16.9oz",181409,"Sporting Goods|Camping & Hiking|Water Bottles & Hydration|Water Carriers",19,8,0,11,,"Top Type; California Prop 65 Warning; Item Height; Item Length; Item Weight; Item Width; MPN; Manufacturer Warranty; Model; Unit Quantity; Unit Type"
11,127815670306,"ASR Federal Bifold Leather ID Card Shield Badge Holder Police Gear Smooth Black",2996,"Clothing, Shoes & Accessories|Men|Men's Accessories|Wallets",24,13,0,11,,"Theme; Character; Accents; Fabric Type; California Prop 65 Warning; Item Length; Item Width; MPN; Personalization Instructions; Unit Quantity; Unit Type"
11,235459823131,"HEROCLIP Carabiner Clip Hook Large for Camping, Backpack, Organization (Blue)",52373,"Clothing, Shoes & Accessories|Men|Men's Accessories|Key Chains, Rings & Cases",20,9,0,11,,"Character; Theme; Character Family; Accents; Vintage; Personalize; Handmade; Pattern; California Prop 65 Warning; Number of Pieces; Personalization Instructions"
11,235505374455,"HEROCLIP Carabiner Clip and Hook Small for Purse, Stroller (Black and Red)",52373,"Clothing, Shoes & Accessories|Men|Men's Accessories|Key Chains, Rings & Cases",20,9,0,11,,"Character; Theme; Character Family; Accents; Vintage; Personalize; Handmade; Pattern; California Prop 65 Warning; Number of Pieces; Personalization Instructions"
11,235540665153,"Star Wars UFO Ball Helicopter Mandalorian Yoda Stormtrooper Kids Toy Mini Copter",123847,"Toys & Hobbies|Radio Control & Control Line|RC Model Vehicles & Kits|Helicopters",19,8,0,11,,"Number of Channels; Fuel Type; Scale; Model Grade; System; Required Assembly; Blade Length; Vintage; Lot (Y/N); Age Level; Replica of"
11,235588568699,"10"" Stone Carving Hammer Hardened Steel Mallet for Masonry",20763,"Home & Garden|Tools & Workshop Equipment|Hand Tools|Hammers & Mallets",21,10,0,11,,"Head/Face Material; Handle Material; Number of Pieces; Color; Handle Size; Manufacturer Warranty; Personalize; Item Diameter; Personalization Instructions; Unit Quantity; Unit Type"
11,236167093641,"Beille Beech Wood and Silicone Kitchen Utensils Cooking Supplies (Many Styles)",20649,"Home & Garden|Kitchen, Dining & Bar|Kitchen Tools & Gadgets|Cooking Utensils",19,8,0,11,,"Set Includes; Number of Items in Set; MPN; Pattern; Theme; Personalize; Making Method; Model; Unit Quantity; Unit Type; Personalization Instructions"
11,236345031406,"Emergency Hammer Window Punch and Seat Belt Cutter",20763,"Home & Garden|Tools & Workshop Equipment|Hand Tools|Hammers & Mallets",21,10,0,11,,"Head/Face Material; Handle Material; Number of Pieces; Color; Handle Size; Manufacturer Warranty; Personalize; Item Diameter; Personalization Instructions; Unit Quantity; Unit Type"
11,236345056409,"Gear Aid Revivex Odor Eliminator, for Tents, Footwear and Sports Gear, 2 fl oz",260134,"Home & Garden|Household Supplies & Cleaning|Laundry Supplies|Detergents, Softeners & Stain Removers",18,7,0,11,,"Form; For; Number in Pack; Scent; Capacity; Suitable For; Power Source; California Prop 65 Warning; Labels & Certifications; Unit Quantity; Unit Type"
11,236345056434,"Kidplokio 3 in 1 Ultimate T Rex Diecast Cars Transporter Truck Toy (2 Colors)",180506,"Toys & Hobbies|Diecast & Toy Vehicles|Cars, Trucks & Vans|Contemporary Manufacture",22,11,0,11,,"Vehicle Make; Scale; Vehicle Year; Series; Year of Manufacture; Model; Features; Age Level; MPN; Customized; Vintage"
11,236345069130,"Kidplokio 41pc Police Station for Toy Cars Playset, Blue, Boys, Ages 3+",177918,"Toys & Hobbies|Diecast & Toy Vehicles|Play Sets",20,9,0,11,,"Vehicle Make; Scale; Autographed; Features; Age Level; Series; Vehicle Type; Theme; Recommended Age Range; Character Family; Vintage"
11,236345069169,"ASR Outdoor Portable Telescoping Collapsible Stool with Carry Handle",16038,"Sporting Goods|Camping & Hiking|Camping Furniture",21,10,0,11,,"Frame Material; Tabletop Material; Seat Material; Folded Dimensions; Set Includes; Suitable For; Features; Model; MPN; Unit Quantity; Unit Type"
11,236345137181,"Kids Survival Outdoor Camping Multi Tool Whistle Compass LED 7 in 1 Flashlight",181415,"Sporting Goods|Camping & Hiking|Outdoor Survival Gear|Other Outdoor Survival Gear",18,7,0,11,,"Suitable For; Features; Set Includes; Vintage; California Prop 65 Warning; Item Height; Item Length; Item Weight; Item Width; Unit Quantity; Unit Type"
11,236345137189,"Beille Stainless Steel Black Knife Set Kitchen Utensils, 5pc",177005,"Home & Garden|Kitchen, Dining & Bar|Flatware, Knives & Cutlery|Kitchen & Steak Knives",21,10,0,11,,"Set Includes; Number of Items in Set; Food Compatibility; Blade Edge; Handle Material; Personalize; Manufacturer Warranty; Making Method; Unit Quantity; Unit Type; Personalization Instructions"
11,236345137225,"TychoTyke Construction and Rescue Tools Truck with Light and Sound Red",152934,"Toys & Hobbies|Diecast & Toy Vehicles|Construction Equipment|Contemporary Manufacture",21,10,0,11,,"Scale; Vehicle Make; Vehicle Type; Autographed; Features; Character Family; Theme; Age Level; Series; Recommended Age Range; Vintage"
11,236345146195,"ASR Outdoor Large Translucent Waterproof Camping Storage Container -  5.5 Inch",181390,"Sporting Goods|Camping & Hiking|Camping Storage",27,16,0,11,,"Capacity; Weight Capacity; Number of Compartments; Manufacturer Warranty; Suitable For; Shape; Care Instructions; Item Depth; Item Diameter; Unit Quantity; Unit Type"
11,236345160651,"Diamond Coated Tool Hole Saw Universal Drill Bit Rotary 80 Grit 6 pack",260207,"Home & Garden|Tools & Workshop Equipment|Power Tool & Air Tool Accessories|Rotary Tool Accessories",23,12,0,11,,"Application; Voltage; Connection Type; Number of Items in Set; Suitable For; Color; Manufacturer Warranty; Item Diameter; Item Depth; Unit Quantity; Unit Type"
11,236345160652,"Beille Rubber 4 in 1 Non Slip Multipurpose Adjustable Easy Grip Jar Opener Tool",20688,"Home & Garden|Kitchen, Dining & Bar|Bar Tools & Accessories|Corkscrews & Openers",21,10,0,11,,"Type; Style; Character Family; Personalize; Occasion; Wood Tone; Theme; Character; Unit Quantity; Unit Type; Personalization Instructions"
11,236345160663,"ASR Outdoor (4-Pack) Camping Utensil 3pc Set of Military MRE Camping Accessories",87133,"Sporting Goods|Camping & Hiking|Camping Cooking Supplies|Camping Cooking Utensils",24,13,0,11,,"Sport/Activity; Handle Material; Surface Coating; Number of Items in Set; Heat Resistance; Manufacturer Warranty; Product Line; Set Includes; Stove Type Compatibility; Unit Quantity; Unit Type"
11,236372535013,"ASR Outdoor 3pc Collapsible Lantern Set Hiking Camping Gear Outdoor Lights",168867,"Sporting Goods|Camping & Hiking|Flashlights, Lanterns & Lights|Lanterns",28,17,0,11,,"Voltage; Number of Batteries; Lighting Technology; Battery Technology; Number of Lights; Operating Time; IP Rating; Cord Type; Cable Length; Lumens; Number of LEDs"
11,363572491527,"Universal Multitool Hatchet Hammer Pry Bar Utility Axe for Emergency Survival",181415,"Sporting Goods|Camping & Hiking|Outdoor Survival Gear|Other Outdoor Survival Gear",18,7,0,11,,"Set Includes; Vintage; California Prop 65 Warning; Item Height; Item Length; Item Weight; Item Width; MPN; Model; Unit Quantity; Unit Type"
11,364875044282,"GEAR AID Tenacious Tape Silnylon Patches for Silicone Tent and Tarp Repair,",36120,"Sporting Goods|Camping & Hiking|Tents & Canopies|Tent & Canopy Accessories",16,5,0,11,,"Features; Number in Pack; Color; Mounting Type; Suitable For; Item Length; Item Width; Item Height; California Prop 65 Warning; Unit Quantity; Unit Type"
11,365879832359,"ASR Outdoor Extendable Marshmallow Toaster Telescoping BBQ Fork Camping Utensil",20725,"Home & Garden|Yard, Garden & Outdoor Living|Outdoor Heating, Cooking & Eating|Barbecue Tools",25,14,0,11,,"Set Includes; Number in Pack; Handle Material; Head Material; Personalize; Number of Items in Set; Style; Manufacturer Warranty; Personalization Instructions; Unit Quantity; Unit Type"
