priority,item_id,title,category_id,category_path,schema_aspects,present,missing_required,missing_recommended,missing_required_names,missing_recommended_names
38,235528772889,"Licensed Kids LED Display Digital Touch Screen Watch Boys Girls Cartoons",31387,"Jewelry & Watches|Watches, Parts & Accessories|Watches|Wristwatches",47,9,0,38,,"Reference Number; Customized; Model; Movement; Dial Color; Band Color; Bezel Color; Case Color; Band Material; Case Material; Water Resistance; With Original Box/Packaging; With Papers; Indices; Case Size; Watch Shape; Band/Strap; Number of Jewels; Dial Pattern; Caseback; Bezel Type; Vintage; Band Width; Lug Width; Theme; With Manual/Booklet; Case Finish; Seller Warranty; With Service Records; Handmade; Manufacturer Warranty; Case Thickness; Escapement Type; Max Wrist Size; Closure; Handedness; Unit Quantity; Unit Type"
36,366005344632,"Kidplokio 3pc Space Toy Bundle Sword Blaster and Superhero Cinch Bag (2 Colors)",261068,"Toys & Hobbies|Action Figures & Accessories|Action Figures",44,8,0,36,,"Franchise; Character; Movie; TV Show; Featured Person/Artist; Scale; Material; Model; Grade; Theme; Sport; Convention/Event; Original/Licensed Reproduction; Vintage; Time Period Manufactured; Professional Grader; Certification Number; MPN; Series; Animal Species; Features; Vehicle Type; Animation Studio; Item Height; Signed By; Signed; Personalize; Transformer Faction; Item Length; Item Width; Autograph Authentication; Autograph Authentication Number; Autograph Format; Personalization Instructions; Unit Quantity; Unit Type"
35,127389838909,"Marvel Ultimate Spider-Man Titan Hero Series Action Figure 12 Inch (2 Styles)",261068,"Toys & Hobbies|Action Figures & Accessories|Action Figures",44,9,0,35,,"Featured Person/Artist; Scale; Material; Model; Grade; Sport; Convention/Event; Original/Licensed Reproduction; Vintage; Time Period Manufactured; Professional Grader; Certification Number; MPN; Series; Year Manufactured; Color; Animal Species; Items Included; Features; Vehicle Type; Animation Studio; Country of Origin; Signed By; Signed; Personalize; Age Level; Transformer Faction; Item Length; Item Width; Autograph Authentication; Autograph Authentication Number; Autograph Format; Personalization Instructions; Unit Quantity; Unit Type"
34,127488196314,"Kidplokio Galaxy Space Sword Interactive Toy Real Lights and Sounds (2 Colors)",261068,"Toys & Hobbies|Action Figures & Accessories|Action Figures",44,10,0,34,,"Franchise; Movie; TV Show; Featured Person/Artist; Scale; Model; Grade; Sport; Convention/Event; Original/Licensed Reproduction; Vintage; Time Period Manufactured; Professional Grader; Certification Number; MPN; Series; Animal Species; Vehicle Type; Animation Studio; Item Height; Signed By; Signed; Personalize; Age Level; Transformer Faction; Item Length; Item Width; Autograph Authentication; Autograph Authentication Number; Autograph Format; California Prop 65 Warning; Personalization Instructions; Unit Quantity; Unit Type"
34,236460252577,"Kidplokio 2pc Space Gift Bundle Toy Sword and Superhero Cinch Bag  (2 Colors)",261068,"Toys & Hobbies|Action Figures & Accessories|Action Figures",44,10,0,34,,"Franchise; Movie; TV Show; Featured Person/Artist; Scale; Model; Grade; Sport; Convention/Event; Original/Licensed Reproduction; Vintage; Time Period Manufactured; Professional Grader; Certification Number; MPN; Series; Animal Species; Vehicle Type; Animation Studio; Item Height; Signed By; Signed; Personalize; Age Level; Transformer Faction; Item Length; Item Width; Autograph Authentication; Autograph Authentication Number; Autograph Format; California Prop 65 Warning; Personalization Instructions; Unit Quantity; Unit Type"
34,365879832353,"Universal Rechargeable Phone Stand Table Lamp Touch Switch 120 Lumen",112581,"Home & Garden|Lamps, Lighting & Ceiling Fans|Lamps",50,16,0,34,,"Room; Style; Sensor Type; Number of Settings; Lighting Technology; Power Source; Shade Shape; Character Family; Theme; Character; Pattern; Energy Star; Department; Control Style; EC Range; Item Diameter; Amperage; Personalize; Voltage; Output Voltage; Labels & Certifications; Power Consumption; Color Temperature; IP Rating; Light Color; Lumens; Bulb Life Hours; Bulb Shape Code; Manufacturer Warranty; Product Line; EPREL Registration Number; Personalization Instructions; Unit Quantity; Unit Type"
32,127389857830,"Universal Home LED 7 Color Changing Mood Light Ambiance Home Decor White Light",20702,"Home & Garden|Lamps, Lighting & Ceiling Fans|Night Lights",48,16,0,32,,"Sensor Type; Power Source; Lighting Technology; Theme; Character Family; Room; Light Color; Character; Department; Installation Area; Energy Star; LED String/Strip Type; EC Range; Mounting; Occasion; Style; Voltage; Personalize; Output Voltage; Amperage; Labels & Certifications; Light Direction; IP Rating; Manufacturer Warranty; Number of Lights; Bulb Life Hours; LED Chip Code; Lumens; EPREL Registration Number; Personalization Instructions; Unit Quantity; Unit Type"
32,235396232983,"2pk Home LED 7 Color Changing Mood Lamp Ambiance Light Home Decor",20702,"Home & Garden|Lamps, Lighting & Ceiling Fans|Night Lights",48,16,0,32,,"Sensor Type; Power Source; Lighting Technology; Theme; Character Family; Room; Light Color; Character; Department; Installation Area; Energy Star; LED String/Strip Type; EC Range; Mounting; Occasion; Style; Voltage; Personalize; Output Voltage; Amperage; Labels & Certifications; Light Direction; IP Rating; Manufacturer Warranty; Number of Lights; Bulb Life Hours; LED Chip Code; Lumens; EPREL Registration Number; Personalization Instructions; Unit Quantity; Unit Type"
32,365879832410,"Universal Hanging Cinema String Light Boxes With 90 Characters - 20 Light Boxes",183394,"Home & Garden|Yard, Garden & Outdoor Living|Outdoor Lighting|String Lights",46,14,0,32,,"Style; Installation Area; Power Source; Control Style; LED String/Strip Type; Sensor Type; Lighting Technology; Occasion; Number of Lights; Light Color; Cord Color; Number of Settings; Character; Theme; Amperage; Smart Home Protocol; Voltage; Power Consumption; Smart Home Compatibility; Character Family; Mounting; Assembly Required; Bulb Life Hours; Color Temperature; IP Rating; LED Chip Code; Labels & Certifications; Lumens; Manufacturer Warranty; Required Tools; Unit Quantity; Unit Type"
31,236344962462,"ASR Outdoor Comprehensive Wilderness Travel Medicine Emergency Guide",261186,"Books & Magazines|Books",35,4,0,31,,"Topic; Publisher; Format; Genre; Publication Year; Book Series; Original Language; Features; Type; Edition; Narrative Type; Signed; Intended Audience; Vintage; Ex Libris; Inscribed; Personalize; Personalized; Signed By; Era; Illustrator; Literary Movement; California Prop 65 Warning; Item Height; Item Length; Item Weight; Item Width; Number of Pages; Personalization Instructions; Unit Quantity; Unit Type"
30,236344962456,"Star Wars Baby Yoda 2 Pack Non Woven Tote Bag Kids Travel Bag Ages 3 and Up",261068,"Toys & Hobbies|Action Figures & Accessories|Action Figures",44,14,0,30,,"Franchise; Movie; TV Show; Featured Person/Artist; Scale; Grade; Theme; Convention/Event; Original/Licensed Reproduction; Vintage; Time Period Manufactured; Professional Grader; Certification Number; Series; Color; Animal Species; Items Included; Vehicle Type; Animation Studio; Signed By; Signed; Personalize; Age Level; Transformer Faction; Autograph Authentication; Autograph Authentication Number; Autograph Format; Personalization Instructions; Unit Quantity; Unit Type"
29,127389838928,"Beille 6 Side Stainless Steel Grater Top Handle Zester Slicer 7.75 Inch - Pink",11662,"Collectibles|Kitchen & Home|Kitchen Tools & Gadgets|Graters & Zesters",41,12,0,29,,"Set Includes; Type; Food Compatibility; Number of Items in Set; Components Included; Original/Reproduction; Time Period Manufactured; Shape; Number of Holes; Number in Pack; Style; Theme; Handle Material; Franchise; Antique; Occasion; Character; Pattern; Handmade; Features; Item Diameter; Making Method; Capacity; Department; Item Depth; Manufacturer Warranty; Wood Tone; Unit Quantity; Unit Type"
29,365879996393,"Star Wars Bump N Go D-O with Authentic Voice Kids Plush Toy Action Figure Doll",261068,"Toys & Hobbies|Action Figures & Accessories|Action Figures",44,15,0,29,,"Franchise; Movie; TV Show; Featured Person/Artist; Scale; Grade; Theme; Convention/Event; Original/Licensed Reproduction; Vintage; Time Period Manufactured; Professional Grader; Certification Number; Series; Animal Species; Items Included; Vehicle Type; Animation Studio; Signed By; Signed; Personalize; Age Level; Transformer Faction; Autograph Authentication; Autograph Authentication Number; Autograph Format; Personalization Instructions; Unit Quantity; Unit Type"
28,127389857840,"Universal Antique Grandfather Clock Winding Brass Key 5 Way (Even)",261610,"Collectibles|Decorative Collectibles|Clocks|Other Clocks",40,12,0,28,,"Time Period Manufactured; Display Type; Movement; Power Source; Vintage; Antique; Chime Sequence; Era; Theme; Features; Year Manufactured; Frame Material; Character; Original/Reproduction; Franchise; Style; Department; Signed; Shape; Room; Autograph Authentication; Autograph Authentication Number; Autograph Format; Engraved; Number Type; Signed By; Unit Quantity; Unit Type"
28,127389878199,"ASR Outdoor Pocket Travel Collapsible Day Pack Lightweight Water Resistant",181379,"Sporting Goods|Camping & Hiking|Hiking Backpacks|Backpacks",42,14,0,28,,"Sport/Activity; Capacity; Number of Pockets; Number of Dividers; Frame Material; Closure; Compatible With; EPA Registration Number; Handle/Strap Material; Trim Material; Vintage; Personalized; Season; Accents; Care Instructions; Event; Event Type; Item Depth; Item Weight; MPN; Manufacturer Warranty; Pocket Type; Position; Product Line; Strap Length; Team; Unit Quantity; Unit Type"
27,235240675875,"Universal Antique Grandfather Clock Winding Brass Key 5 Way (Even)",261610,"Collectibles|Decorative Collectibles|Clocks|Other Clocks",40,13,0,27,,"Time Period Manufactured; Display Type; Movement; Power Source; Vintage; Antique; Chime Sequence; Era; Theme; Features; Frame Material; Character; Original/Reproduction; Franchise; Style; Department; Signed; Shape; Room; Autograph Authentication; Autograph Authentication Number; Autograph Format; Engraved; Number Type; Signed By; Unit Quantity; Unit Type"
27,365680341386,"Licensed Kids Coin Tin Piggy Bank Learning Savings Tools for Kids (Many Styles)",10034,"Home & Garden|Home Décor|Other Home Décor",31,4,0,27,,"Material; Style; Color; Theme; Department; Origin; MPN; Room; Character Family; Item Length; Occasion; Item Height; Item Width; Vintage; Personalize; Additional Parts Required; Product Line; Orientation; Battery Type; California Prop 65 Warning; Care Instructions; Customized; Item Weight; Model; Personalization Instructions; Unit Quantity; Unit Type"
26,127389857796,"Aquamira Universal Quick Connect 1/4"" Tubing Splice Kit - Fits Frontier Filter",87125,"Sporting Goods|Camping & Hiking|Hiking Backpacks|Hydration Packs",41,15,0,26,,"Number of Pockets; Number of Dividers; Department; Sport/Activity; Closure; Capacity; Frame Material; Compatible With; EPA Registration Number; Personalized; Handle/Strap Material; Trim Material; Season; Accents; Care Instructions; Event; Event Type; Item Depth; Manufacturer Warranty; Pocket Type; Position; Product Line; Strap Length; Team; Unit Quantity; Unit Type"
26,127389857807,"Universal Antique Grandfather Brass Clock Key 2 Pack Even & Odd",261610,"Collectibles|Decorative Collectibles|Clocks|Other Clocks",40,14,0,26,,"Time Period Manufactured; Display Type; Movement; Power Source; Vintage; Antique; Chime Sequence; Era; Theme; Frame Material; Character; Original/Reproduction; Franchise; Style; Department; Signed; Shape; Room; Autograph Authentication; Autograph Authentication Number; Autograph Format; Engraved; Number Type; Signed By; Unit Quantity; Unit Type"
26,127389857815,"ASR Outdoor Nylon Camping Vest Gold Panning Adjustable Hunting Fishing Jacket",65976,"Sporting Goods|Fishing|Clothing, Shoes & Accessories|Coats, Jackets & Vests",38,12,0,26,,"Performance/Activity; Fabric Type; Closure; Size Type; Insulation Material; Vintage; Occasion; Lining Material; Season; Theme; Character; Product Line; Jacket/Coat Length; Accents; Character Family; Fit; Pattern; Warmth Weight; Sleeve Length; Collar Style; Handmade; Chest Size; Garment Care; Year Manufactured; Unit Quantity; Unit Type"
26,236345056407,"Universal Antique Grandfather Brass Clock Key Odd",261610,"Collectibles|Decorative Collectibles|Clocks|Other Clocks",40,14,0,26,,"Time Period Manufactured; Display Type; Movement; Power Source; Vintage; Antique; Chime Sequence; Era; Theme; Frame Material; Character; Original/Reproduction; Franchise; Style; Department; Signed; Shape; Room; Autograph Authentication; Autograph Authentication Number; Autograph Format; Engraved; Number Type; Signed By; Unit Quantity; Unit Type"
26,236345137201,"Universal Tool Antique Grandfather Brass Clock Key 4 Prongs - Even Numbers",261610,"Collectibles|Decorative Collectibles|Clocks|Other Clocks",40,14,0,26,,"Time Period Manufactured; Display Type; Movement; Power Source; Vintage; Antique; Chime Sequence; Era; Theme; Frame Material; Character; Original/Reproduction; Franchise; Style; Department; Signed; Shape; Room; Autograph Authentication; Autograph Authentication Number; Autograph Format; Engraved; Number Type; Signed By; Unit Quantity; Unit Type"
26,365702408026,"Gear Aid ReviveX Restoration Down Fabric Cleaner Jacket and Sleeping Bag - 10 oz",87100,"Sporting Goods|Camping & Hiking|Outdoor Sleeping Gear|Sleeping Bags",35,9,0,26,,"Insulation Type; Shell Material; Fill Material; Features; Temperature Rating; Shape; Color; Department; Care Instructions; Item Length; Item Width; EPA Registration Number; Lining Material; Season; Sleeping Capacity; Zipper Location; Packed Size; R-Value; Fill Power; Hip Girth; Manufacturer Warranty; Product Line; Shoulder Girth; Stuff Sack Size; Unit Quantity; Unit Type"
26,365879908026,"Universal Antique Grandfather Brass Clock Key 2 Pack",261610,"Collectibles|Decorative Collectibles|Clocks|Other Clocks",40,14,0,26,,"Time Period Manufactured; Display Type; Movement; Power Source; Vintage; Antique; Chime Sequence; Era; Theme; Frame Material; Character; Original/Reproduction; Franchise; Style; Department; Signed; Shape; Room; Autograph Authentication; Autograph Authentication Number; Autograph Format; Engraved; Number Type; Signed By; Unit Quantity; Unit Type"
26,365879996435,"Universal Tool Antique Grandfather Brass Clock Key 4 Prongs - Odd Numbers",261610,"Collectibles|Decorative Collectibles|Clocks|Other Clocks",40,14,0,26,,"Time Period Manufactured; Display Type; Movement; Power Source; Vintage; Antique; Chime Sequence; Era; Theme; Frame Material; Character; Original/Reproduction; Franchise; Style; Department; Signed; Shape; Room; Autograph Authentication; Autograph Authentication Number; Autograph Format; Engraved; Number Type; Signed By; Unit Quantity; Unit Type"
25,127389857846,"ASR Outdoor Black Drawstring Security Strings Bag with Stopper",87122,"Sporting Goods|Camping & Hiking|Hiking Backpacks|Daypacks",41,16,0,25,,"Sport/Activity; Capacity; Department; Frame Material; Closure; Compatible With; EPA Registration Number; Number of Dividers; Trim Material; Handle/Strap Material; Season; Personalized; Accents; Care Instructions; Event; Event Type; Item Depth; Manufacturer Warranty; Pocket Type; Position; Product Line; Strap Length; Team; Unit Quantity; Unit Type"
25,127389932528,"Productive Fitness Poster Series (Medicine Ball) Basic Exercises for At Home Use",28009,"Art|Art Posters",33,8,0,25,,"Subject; Year of Production; Franchise; Character; Theme; Features; Featured Person/Artist; Original/Licensed Reprint; Artist; Material; Culture; Time Period Manufactured; Region of Origin; Framing; Signed; Unit of Sale; Handmade; Personalize; COA Issued By; Certificate of Authenticity (COA); Personalization Instructions; Signed By; Title; Unit Quantity; Unit Type"
25,236206659191,"GEAR AID Care Kit with Revivex Pro Cleaner and Revivex Wash-In Water Repellent",87100,"Sporting Goods|Camping & Hiking|Outdoor Sleeping Gear|Sleeping Bags",35,10,0,25,,"Fill Material; Temperature Rating; Shape; Color; Department; Care Instructions; Item Length; Item Width; MPN; EPA Registration Number; Lining Material; Season; Sleeping Capacity; Zipper Location; Packed Size; R-Value; Fill Power; Hip Girth; Manufacturer Warranty; Model; Product Line; Shoulder Girth; Stuff Sack Size; Unit Quantity; Unit Type"
25,236345031416,"GEAR AID Revivex Down Care Kit for Jackets and Sleeping Bags and Repair Patches",87100,"Sporting Goods|Camping & Hiking|Outdoor Sleeping Gear|Sleeping Bags",35,10,0,25,,"Fill Material; Temperature Rating; Shape; Color; Department; Care Instructions; Item Length; Item Width; MPN; EPA Registration Number; Lining Material; Season; Sleeping Capacity; Zipper Location; Packed Size; R-Value; Fill Power; Hip Girth; Manufacturer Warranty; Model; Product Line; Shoulder Girth; Stuff Sack Size; Unit Quantity; Unit Type"
25,236345069152,"GEAR AID Care Kit Revivex Pro Cleaner, Revivex Wash-In Water Repellent, Patches",87100,"Sporting Goods|Camping & Hiking|Outdoor Sleeping Gear|Sleeping Bags",35,10,0,25,,"Fill Material; Temperature Rating; Shape; Color; Department; Care Instructions; Item Length; Item Width; MPN; EPA Registration Number; Lining Material; Season; Sleeping Capacity; Zipper Location; Packed Size; R-Value; Fill Power; Hip Girth; Manufacturer Warranty; Model; Product Line; Shoulder Girth; Stuff Sack Size; Unit Quantity; Unit Type"
25,236345069175,"Productive Fitness Muscle Diagrams Poster Series Male and Female for Use At Home",28009,"Art|Art Posters",33,8,0,25,,"Subject; Year of Production; Franchise; Character; Theme; Features; Featured Person/Artist; Original/Licensed Reprint; Style; Artist; Material; Culture; Time Period Manufactured; Framing; Signed; Unit of Sale; Handmade; Personalize; COA Issued By; Certificate of Authenticity (COA); Personalization Instructions; Signed By; Title; Unit Quantity; Unit Type"
25,236345137211,"ASR Outdoor 100 Lumen COB Collapsible Camping Lantern Black or Grey (2 Sizes)",168867,"Sporting Goods|Camping & Hiking|Flashlights, Lanterns & Lights|Lanterns",28,3,0,25,,"Color; Power Source; Material; Operating Range; Item Height; Item Length; Item Weight; Item Width; MPN; Voltage; Number of Batteries; Lighting Technology; Features; Battery Technology; Number of Lights; Operating Time; IP Rating; Cord Type; Cable Length; California Prop 65 Warning; Lumens; Model; Number of LEDs; Unit Quantity; Unit Type"
25,236345160660,"Productive Fitness Resistance Tubing Workout Training Poster Series Home Use",28009,"Art|Art Posters",33,8,0,25,,"Subject; Year of Production; Franchise; Character; Theme; Features; Featured Person/Artist; Original/Licensed Reprint; Style; Artist; Material; Culture; Time Period Manufactured; Framing; Signed; Unit of Sale; Handmade; Personalize; COA Issued By; Certificate of Authenticity (COA); Personalization Instructions; Signed By; Title; Unit Quantity; Unit Type"
25,365879935304,"ASR Outdoor Waterproof Backpack Cover Adjustable Fit Camping Essentials - Blue",36109,"Sporting Goods|Camping & Hiking|Hiking Backpacks|Other Camping & Hiking Backpacks",43,18,0,25,,"Number of Dividers; Closure; Capacity; Frame Material; Compatible With; EPA Registration Number; Personalized; Signed; Vintage; Handle/Strap Material; Trim Material; Season; Manufacturer Warranty; Accents; Care Instructions; Event; Event Type; Item Depth; Pocket Type; Position; Product Line; Strap Length; Team; Unit Quantity; Unit Type"
24,236345031444,"Beille Set of 6 Clear Classic Goblet Water Glasses Home Decor Glassware, 7.43oz",260384,"Home & Garden|Kids & Teens at Home|Kitchen & Dining|Cups, Mugs & Glasses",36,12,0,24,,"Glassware Type; Department; Beverage Type; Capacity; Set Includes; Character Family; Service For; Shape; Theme; Character; Personalize; Occasion; Pattern; Design; Keeps Cold For; Keeps Hot For; Lid Type; Manufacturer Warranty; Number of Items in Set; Unit Quantity; Unit Type; Style; Care Instructions; Personalization Instructions"
24,236345056390,"Waterproof Durable Backpack Cover Blue Universal Fit Adjustable Draw String",181379,"Sporting Goods|Camping & Hiking|Hiking Backpacks|Backpacks",42,18,0,24,,"Capacity; Number of Dividers; Frame Material; Closure; Compatible With; EPA Registration Number; Handle/Strap Material; Trim Material; Vintage; Personalized; Season; Accents; Care Instructions; Event; Event Type; Item Depth; Manufacturer Warranty; Pocket Type; Position; Product Line; Strap Length; Team; Unit Quantity; Unit Type"
24,236345056400,"Kidplokio Bible Coloring Book for Kids Activity Book with Puzzles 96 Pages - 2pk",261186,"Books & Magazines|Books",35,11,0,24,,"Topic; Publisher; Format; Genre; Publication Year; Book Series; Original Language; Edition; Narrative Type; Signed; Intended Audience; Vintage; Ex Libris; Inscribed; Personalize; Personalized; Signed By; Era; Illustrator; Literary Movement; Number of Pages; Personalization Instructions; Unit Quantity; Unit Type"
24,364881885930,"Kidplokio Pirate Ship Ocean Adventure Playset, Lights Sounds Action Figures, Red",261069,"Toys & Hobbies|Action Figures & Accessories|Action Figures Playsets",40,16,0,24,,"Franchise; TV Show; Movie; Set Includes; Grade; Certification Number; Professional Grader; Animation Studio; Convention/Event; Occasion; Theme Park/Store; Genre; Signed By; Signed; Features; Age Level; Time Period Manufactured; Autograph Authentication; Autograph Authentication Number; Autograph Format; Number of Items in Set; Packaging; Unit Quantity; Unit Type"
23,126450542804,"Productive Fitness Poster Series - Yoga Exercises | Laminated or Non-Laminated",28009,"Art|Art Posters",33,10,0,23,,"Subject; Year of Production; Franchise; Character; Theme; Features; Featured Person/Artist; Original/Licensed Reprint; Artist; Culture; Time Period Manufactured; Framing; Signed; Unit of Sale; Handmade; Personalize; COA Issued By; Certificate of Authenticity (COA); Personalization Instructions; Signed By; Title; Unit Quantity; Unit Type"
23,127389838912,"Productive Fitness Poster Series - Dumbbell Exercises (Upper & Core) Home Use",28009,"Art|Art Posters",33,10,0,23,,"Subject; Year of Production; Franchise; Character; Theme; Features; Featured Person/Artist; Original/Licensed Reprint; Artist; Culture; Time Period Manufactured; Framing; Signed; Unit of Sale; Handmade; Personalize; COA Issued By; Certificate of Authenticity (COA); Personalization Instructions; Signed By; Title; Unit Quantity; Unit Type"
23,127389838951,"Kids Licensed Character Analog Wall Clock Kids Bedroom Home Decor Wall Art",20561,"Home & Garden|Home Décor|Clocks|Wall Clocks",40,17,0,23,,"Movement; Theme; Power Source; Display Type; Style; Room; Frame Material; Chime Sequence; Era; Shape; Number Type; Department; Personalize; Original/Reproduction; Smart Home Protocol; Manufacturer Warranty; Protection Plan; Smart Home Compatibility; Engraved; Product Line; Personalization Instructions; Unit Quantity; Unit Type"
23,127389878186,"ASR Outdoor 18.5 Inch Travel Backpack with Laptop Sleeve School Supplies, Grey",181379,"Sporting Goods|Camping & Hiking|Hiking Backpacks|Backpacks",42,19,0,23,,"Number of Pockets; Number of Dividers; Frame Material; Compatible With; EPA Registration Number; Handle/Strap Material; Trim Material; Vintage; Personalized; Season; Accents; Care Instructions; Event; Event Type; Item Depth; Manufacturer Warranty; Pocket Type; Position; Product Line; Strap Length; Team; Unit Quantity; Unit Type"
23,236345056414,"Dumbbell Exercises Laminated Fitness Poster 4 Pack",28009,"Art|Art Posters",33,10,0,23,,"Subject; Year of Production; Franchise; Character; Theme; Featured Person/Artist; Original/Licensed Reprint; Style; Artist; Culture; Time Period Manufactured; Framing; Signed; Unit of Sale; Handmade; Personalize; COA Issued By; Certificate of Authenticity (COA); Personalization Instructions; Signed By; Title; Unit Quantity; Unit Type"
23,236345137232,"ASR Outdoor Round Duffel Bag Adjustable Shoulder Strap Travel 16 Liter",52357,"Clothing, Shoes & Accessories|Men|Men's Accessories|Bags",34,11,0,23,,"Theme; Lining Material; Handle/Strap Material; Character; Pattern; Closure; Bag Width; Vintage; Bag Height; Bag Depth; Customized; Product Line; Occasion; Fabric Type; Hardware Material; Handmade; Handle Style; Personalize; Year Manufactured; Personalization Instructions; Strap Drop; Unit Quantity; Unit Type"
22,126370118291,"Productive Fitness Home Gym Work Out Poster - Laminated (Many Exercises)",28009,"Art|Art Posters",33,11,0,22,,"Year of Production; Franchise; Character; Theme; Features; Featured Person/Artist; Original/Licensed Reprint; Artist; Culture; Time Period Manufactured; Framing; Signed; Unit of Sale; Handmade; Personalize; COA Issued By; Certificate of Authenticity (COA); Personalization Instructions; Signed By; Title; Unit Quantity; Unit Type"
22,126481444436,"Productive Fitness Poster Series Lower Body Stretching Exercises Non-Laminated",28009,"Art|Art Posters",33,11,0,22,,"Subject; Year of Production; Franchise; Character; Theme; Featured Person/Artist; Original/Licensed Reprint; Artist; Culture; Time Period Manufactured; Framing; Signed; Unit of Sale; Handmade; Personalize; COA Issued By; Certificate of Authenticity (COA); Personalization Instructions; Signed By; Title; Unit Quantity; Unit Type"
