item_id,title,category_id,category_path,aspect_count,status
365879907973,"ASR Outdoor 13lb Gemstone Mining Kit Geology Paydirt Classifier Assorted Stones",15913,"Collectibles|Science & Medicine (1930-Now)|Mining|Equipment",5,OK
365879950551,"ASR Outdoor Mosquito Head Net Bug Hat for Camping Fishing",65965,"Sporting Goods|Camping & Hiking|Outdoor Survival Gear|Insect Nets",18,OK
365879996362,"Beille Modern Bamboo and Confetti Household Cleaning Tools (Many Styles)",259344,"Home & Garden|Household Supplies & Cleaning|Cleaning Tools|Cleaning Brushes",12,OK
126113669997,"6pc Universal Tool Heavy Duty Leather Hollow Punch Set",28133,"Crafts|Leathercrafts|Leathercraft Tools|Other Leather Tools",11,OK
236345056438,"Braided Vectran Survival Sport Tactical Cord 200lb Breaking Strength 25' to 1000",50816,"Sporting Goods|Outdoor Sports|Climbing & Caving|Ropes, Cords & Slings",8,OK
236345069135,"Disney Minnie Mouse Girls Beaded Ring Bracelet Glitter Charm Jewelry Gift",19172,"Toys & Hobbies|Preschool Toys & Pretend Play|Dress-Up, Costumes",12,OK
