item_id,title,category_id,category_path,aspect_count,status
126487251794,"Girls Gold Star Bundle Set with Barbie Dangle Earrings Dress Up",19172,"Toys & Hobbies|Preschool Toys & Pretend Play|Dress-Up, Costumes",13,OK
127239775819,"DC Comics Superman 2pc Cinch Bag Drawstring Backpacks Bundle Boys Age 3 and Up",260988,"Clothing, Shoes & Accessories|Kids|Backpacks & Bags",28,OK
127752367320,"ASR Outdoor 5lb Rough Gemstone Paydirt Bag Gold Panning Kits (8 Styles)",14955,"Business & Industrial|Test, Measurement & Inspection|Test Meters & Detectors|Metal Detectors",11,OK
236206634313,"8pc ASR Outdoor Complete Gold Rush Sifting Classifier Sieve Set for Prospecting",15913,"Collectibles|Science & Medicine (1930-Now)|Mining|Equipment",6,OK
127502681657,"Disney Mickey Mouse Kids Pencil Case EVA Foam School Supplies Zipper Pen Holder",3142,"Home & Garden|School Supplies|Other School Supplies",13,OK
365737133639,"ASR Outdoor 5pc Gold Panning Classifier Screen Set Mesh Soil for Prospecting",15913,"Collectibles|Science & Medicine (1930-Now)|Mining|Equipment",6,OK
127815670306,"ASR Federal Bifold Leather ID Card Shield Badge Holder Police Gear Smooth Black",2996,"Clothing, Shoes & Accessories|Men|Men's Accessories|Wallets",21,OK
236206659191,"GEAR AID Care Kit with Revivex Pro Cleaner and Revivex Wash-In Water Repellent",87100,"Sporting Goods|Camping & Hiking|Outdoor Sleeping Gear|Sleeping Bags",11,OK
127239950660,"ASR Outdoor 50"" Aluminum Folding Sluice Box Gold Prospecting Backpack Kit Green",15913,"Collectibles|Science & Medicine (1930-Now)|Mining|Equipment",7,OK
127239967300,"ASR Outdoor Complete Fine Gold Recovery Kit Gold Prospecting Equipment, 18pc",15913,"Collectibles|Science & Medicine (1930-Now)|Mining|Equipment",4,OK
365405773744,"ASR Outdoor Gold Rush Sifting Classifier Sieve Mini 6 Inch Prospect Pan 0 Holes",15913,"Collectibles|Science & Medicine (1930-Now)|Mining|Equipment",2,OK
364534656652,"Heavy Duty 1/2"" Classifier Screen Sieve w/ Handles 5 Gallon Bucket Deep Stacking",15913,"Collectibles|Science & Medicine (1930-Now)|Mining|Equipment",7,OK
235392003566,"ASR Outdoor Complete Mini Sluice Box with 3.5 Gal Bucket Gold Panning Kit, 20pc",163824,"Business & Industrial|Test, Measurement & Inspection|Test Meters & Detectors|Metal Detector Accessories",12,OK
235436886860,"6inch ASR Outdoor Serrated Fixed Blade Tanto Point Hunting Neck Knife - Black",73522,"Collectibles|Knives, Swords & Blades|Collectible Fixed Blade Knives|Modern Fixed Blade|Factory Manufactured",17,OK
126383530718,"Diamond Sharpening Stone Knife and Blade Variety Coarse Grit Universal Set of 3",116005,"Home & Garden|Kitchen, Dining & Bar|Kitchen Tools & Gadgets|Sharpeners",13,OK
364899577155,"ToolTreaux 5 Pocket Heavy Duty Leather Tool Pouch DIY Woodworking, 10.5 x 9.5",42362,"Home & Garden|Tools & Workshop Equipment|Tool Boxes & Storage|Tool Bags, Belts & Pouches",19,OK
364899577169,"ASR Outdoor Technora Composite Survival Cord Rope 1200lb Strength 25' to 1000'",50816,"Sporting Goods|Outdoor Sports|Climbing & Caving|Ropes, Cords & Slings",10,OK
235054823492,"Paracord Mil-Spec Commercial Grade 550lb Type III Nylon Cord Rope Many Lengths",181413,"Sporting Goods|Camping & Hiking|Outdoor Survival Gear|Paracord & Paracord Supplies",20,OK
235349304256,"ASR Outdoor Aluminum Sluice Box with Rubber Sluice Box Matting for Gold",15913,"Collectibles|Science & Medicine (1930-Now)|Mining|Equipment",7,OK
126099617598,"Magnetic Separator Pick Up Tool Industrial Quality 8 lbs Quick Release Handle",11704,"Home & Garden|Tools & Workshop Equipment|Other Tools & Workshop Equipment",12,OK
365680010387,"Labrea Life + Home Solid Acacia Wooden Kitchen Utensils (Many Styles and Packs)",20649,"Home & Garden|Kitchen, Dining & Bar|Kitchen Tools & Gadgets|Cooking Utensils",13,OK
235792850839,"Kidplokio 15pc Space Toys Explorer Voyager Backpack Light Up Astronaut, 10 Inch",1187,"Toys & Hobbies|Robots, Monsters & Space Toys|Space Toys|1970-Now",11,OK
364849235207,"ASR Outdoor 30 Inch Portable Riffled Sluice Box for Gold Panning Dredging",15913,"Collectibles|Science & Medicine (1930-Now)|Mining|Equipment",4,OK
235480965677,"Fishing Fillet Knife with Sheath and Floating Handle for Outdoor Sports - 6 Inch",73522,"Collectibles|Knives, Swords & Blades|Collectible Fixed Blade Knives|Modern Fixed Blade|Factory Manufactured",18,OK
235480965695,"ASR Outdoor 13.5"" Collector's Hunting Knife with Animal Head Pommel Many Styles",73522,"Collectibles|Knives, Swords & Blades|Collectible Fixed Blade Knives|Modern Fixed Blade|Factory Manufactured",15,OK
126384427949,"Kids Camping Outdoor Survival Multitool with Whistle Compass, 7 in 1 Flashlight",75236,"Sporting Goods|Camping & Hiking|Camping Knives & Tools|Multi-Tools",18,OK
235480965806,"ASR Outdoor Gold Classifier Sifting Prospecting Pan 1/50"" Inch Mesh",15913,"Collectibles|Science & Medicine (1930-Now)|Mining|Equipment",5,OK
126488763142,"18 Inch Kids Licensed Cartoon Cinch Bag Travel Backpack Drawstring Tote",260988,"Clothing, Shoes & Accessories|Kids|Backpacks & Bags",25,OK
365680341386,"Licensed Kids Coin Tin Piggy Bank Learning Savings Tools for Kids (Many Styles)",10034,"Home & Garden|Home Décor|Other Home Décor",14,OK
126100329974,"ASR Outdoor Gold Prospecting Black Sand 5lb Magnetic Steel Pocket Separator Pen",15913,"Collectibles|Science & Medicine (1930-Now)|Mining|Equipment",5,OK
235570931965,"Path Blazer Friction Power Monster Truck Speed Boat Hauler With Trailer",180506,"Toys & Hobbies|Diecast & Toy Vehicles|Cars, Trucks & Vans|Contemporary Manufacture",20,OK
364487898405,"ASR Outdoor 11pc Gold Panning Kit Prospecting Equipment, Classifier Screens",15913,"Collectibles|Science & Medicine (1930-Now)|Mining|Equipment",5,OK
126489346392,"ToolTreaux 6pc Diamond Coated Flat File Set, 40 to 600 Grit",178974,"Home & Garden|Tools & Workshop Equipment|Hand Tools|Files",19,OK
124304800806,"3 Piece Gold Panning Mining Mini 6"" Inch Classifier Prospect Pan 3 Sizes",15913,"Collectibles|Science & Medicine (1930-Now)|Mining|Equipment",10,OK
235571605042,"3 Piece Professional ASR Tactical Black Stainless Steel Throwing Knife Set",73522,"Collectibles|Knives, Swords & Blades|Collectible Fixed Blade Knives|Modern Fixed Blade|Factory Manufactured",18,OK
126439889445,"The Brief Safe Travel Security Hidden Contents Diversion Safe - Slightly Unusual",112601,"Home & Garden|Home Improvement|Home Security|Safes",20,OK
126439889588,"ASR Outdoor Sluice Box Gold Panning Kit Classifier Combo Set 16pc",15913,"Collectibles|Science & Medicine (1930-Now)|Mining|Equipment",5,OK
235528772889,"Licensed Kids LED Display Digital Touch Screen Watch Boys Girls Cartoons",31387,"Jewelry & Watches|Watches, Parts & Accessories|Watches|Wristwatches",22,OK
235482459293,"Retractable Sewing Tape Measure 60 inch Tailor Seamstress for Arts and Crafts",183295,"Crafts|Sewing|Measuring Tools|Measuring Tapes",11,OK
236475639551,"Disney Mickey Mouse Kids 40pc Art Supplies Coloring Marker Crayon Paint Pad Set",28108,"Crafts|Art Supplies|Drawing & Lettering Supplies|Art Pencils & Charcoal",12,OK
234665838880,"ASR Outdoor 12"" Inch Portable Mini Gold Panning Sluice Box with Rubber Matting",15913,"Collectibles|Science & Medicine (1930-Now)|Mining|Equipment",7,OK
126145377750,"ASR Tactical Braided HMPE Cord 260lb Strength Survival Cord Rope",50816,"Sporting Goods|Outdoor Sports|Climbing & Caving|Ropes, Cords & Slings",8,OK
236475895875,"Hello Kitty & Friends 4pc Nail Polish Glitter Set Girls with Travel Tin Ages 3+",11873,"Health & Beauty|Nail Care, Manicure & Pedicure|Nail Polish & Powders|Nail Polish",11,OK
235439416399,"ToolTreaux Gardening Soil Sifter Fine and Coarse Planting Screens (Many Sizes)",3186,"Home & Garden|Yard, Garden & Outdoor Living|Garden Hand Tools & Equipment|Other Garden Hand Tools & Equipment",15,OK
126440196718,"Beille 4pc Bamboo Kitchen Spoons Utensils Cooking Baking Accessories",20649,"Home & Garden|Kitchen, Dining & Bar|Kitchen Tools & Gadgets|Cooking Utensils",11,OK
234517180623,"ASR Outdoor Hook and Pick Precision Gold Prospecting Crevice Tool Set 6 Pieces",163824,"Business & Industrial|Test, Measurement & Inspection|Test Meters & Detectors|Metal Detector Accessories",11,OK
126386406454,"ASR Outdoor Technora Survival Cord Rope 400lb Break Strength",50816,"Sporting Goods|Outdoor Sports|Climbing & Caving|Ropes, Cords & Slings",9,OK
364743674623,"ASR Outdoor 6 Piece Sluice Box Gold Panning Kit Snuffer Trowel Hooks Gold Pan",15913,"Collectibles|Science & Medicine (1930-Now)|Mining|Equipment",7,OK
364743674714,"Deluxe 9 Piece Wood Burning Pen Tool Hobby & Craft Kit",183150,"Crafts|Home Arts & Crafts|Woodworking|Wood Burning Pens",9,OK
235214767866,"Wetsuit Drysuit Neoprene Seal Cement Waterproof Repair - 4 oz Black",29574,"Sporting Goods|Water Sports|Wetsuits & Drysuits|Other Wetsuits & Drysuits",11,OK
235483317325,"Braided Vectran Survival Sport Tactical Cord 600lb Breaking Strength",181413,"Sporting Goods|Camping & Hiking|Outdoor Survival Gear|Paracord & Paracord Supplies",19,OK
364851559092,"Beille Cooking Baking Supplies Glass Pinch Bowl Ramekin Kitchen Essentials Set",25846,"Home & Garden|Kitchen, Dining & Bar|Bakeware|Other Bakeware & Ovenware",21,OK
364312027365,"Gold Sifting Classifier 1/4"" Mesh Screen Sieve Prospect Pan",15913,"Collectibles|Science & Medicine (1930-Now)|Mining|Equipment",6,OK
365242110528,"ASR Outdoor Fixed Blade Utility Fishing Fillet Knife, 6 Inch",73522,"Collectibles|Knives, Swords & Blades|Collectible Fixed Blade Knives|Modern Fixed Blade|Factory Manufactured",17,OK
366005344632,"Kidplokio 3pc Space Toy Bundle Sword Blaster and Superhero Cinch Bag (2 Colors)",261068,"Toys & Hobbies|Action Figures & Accessories|Action Figures",24,OK
236402678858,"ASR Tactical EDC Mini Zipper Pull Folding Pocket Knife (2 Sizes, Colors)",48818,"Collectibles|Knives, Swords & Blades|Collectible Folding Knives|Modern Folding Knives|Factory Manufactured",20,OK
363809308977,"GEAR AID Tenacious Tape Repair Patches for Jackets, Outdoor Gear, 2.5"" 1.5"" Hex",36120,"Sporting Goods|Camping & Hiking|Tents & Canopies|Tent & Canopy Accessories",16,OK
364539226155,"6"" 2 Sided Knife Blade Sharpener Sharpening Stone (Grit: 120 / 240)",43220,"Collectibles|Knives, Swords & Blades|Blade Parts, Supplies & Accs|Blade Sharpeners & Stones",11,OK
364852422084,"ASR Outdoor 12"" Inch Green Dual Riffle Gold Panning Pan for Mining Prospecting",15913,"Collectibles|Science & Medicine (1930-Now)|Mining|Equipment",5,OK
233565736200,"Sluice Box Rubber Mat Riffled Matting for Gold Recovery Mining 27x10 inch",15913,"Collectibles|Science & Medicine (1930-Now)|Mining|Equipment",6,OK
126246015049,"ASR Outdoor Heavy Duty Hand Scoop Trowel For Gold Panning Dredging Sluice",163824,"Business & Industrial|Test, Measurement & Inspection|Test Meters & Detectors|Metal Detector Accessories",12,OK
235441319364,"100pc Self Locking Plastic Bags 2mm Thick All Purpose Storage Baggies",86174,"Business & Industrial|Material Handling|Packing & Shipping|Packing & Shipping Bags|Reclosable & Zipper Bags",14,OK
235396232983,"2pk Home LED 7 Color Changing Mood Lamp Ambiance Light Home Decor",20702,"Home & Garden|Lamps, Lighting & Ceiling Fans|Night Lights",28,OK
127877523832,"Beille 100% Cotton Kitchen Dish Cloths, Machine Washable Reusable Towels, 10pk",20664,"Home & Garden|Kitchen, Dining & Bar|Linens & Textiles|Towels & Dishcloths",22,OK
366424712404,"Beille 100% Cotton Kitchen Dish Cloth and Tea Towels Set, Machine Washable, 5pk",20664,"Home & Garden|Kitchen, Dining & Bar|Linens & Textiles|Towels & Dishcloths",22,OK
126493144658,"ASR Outdoor Ninja Grappling Hook with 33 Feet Nylon Rope Compact Black Finish",179791,"Sporting Goods|Boxing, Martial Arts & MMA|Training Equipment & Supplies|Other Combat Sport Training",10,OK
235574892230,"ASR Outdoor 27"" Flared Aluminum Sluice Box  5 Gal Bucket Gold Panning Kit 18pc",15913,"Collectibles|Science & Medicine (1930-Now)|Mining|Equipment",4,OK
126443316370,"ASR Outdoor 3 Stage Super Bright Hanging Puck Light,  240 Lumen COB LED",159092,"Sporting Goods|Camping & Hiking|Flashlights, Lanterns & Lights|Other Camping Lights",10,OK
364365610077,"ASR Outdoor 24pc Complete 50"" Folding Sluice Box Backpack Gold Panning Kit",163824,"Business & Industrial|Test, Measurement & Inspection|Test Meters & Detectors|Metal Detector Accessories",12,OK
236770623835,"Beille 8 Inch Stainless Steel Scissors, Break Apart Kitchen Shears, Grey, 1pc",122938,"Home & Garden|Kitchen, Dining & Bar|Flatware, Knives & Cutlery|Scissors & Shears",18,OK
236015325652,"ASR Outdoor 7.5 Inch Finger Hole Bearing Knife Tactical Drop Point Fixed Blade",73522,"Collectibles|Knives, Swords & Blades|Collectible Fixed Blade Knives|Modern Fixed Blade|Factory Manufactured",16,OK
363267267278,"6pc Professional Jack Ripper Throwing Knife Set 440 Stainless Steel with Sheath",73522,"Collectibles|Knives, Swords & Blades|Collectible Fixed Blade Knives|Modern Fixed Blade|Factory Manufactured",19,OK
235264218835,"144pk ASR Tactical Escape and Evasion Saw Set Outdoor Emergency EE Kit",181415,"Sporting Goods|Camping & Hiking|Outdoor Survival Gear|Other Outdoor Survival Gear",19,OK
235397488898,"ParaLace 550 Paracord Shoelaces for Hiking Boots Shoes (45 54 60 72 or 81 Inch)",169282,"Clothing, Shoes & Accessories|Specialty|Clothing & Shoe Care|Shoe Care & Repair|Shoe Laces",11,OK
125427420003,"ASR Outdoor 11pc Double Classifier Gold Panning Kit with Scoop Vials Sand Magnet",15913,"Collectibles|Science & Medicine (1930-Now)|Mining|Equipment",5,OK
235575573637,"Heavy Duty 1/8"" Classifier Screen Sieve w/ Handles 5 Gallon Bucket Deep Stacking",15913,"Collectibles|Science & Medicine (1930-Now)|Mining|Equipment",7,OK
126494001373,"Heavy Duty 1/4"" Classifier Screen Sieve w/ Handles 5 Gallon Bucket Deep Stacking",15913,"Collectibles|Science & Medicine (1930-Now)|Mining|Equipment",7,OK
364906595367,"3 Piece Coarse Classifier Screen Sieve Set with Side Handles (1/2, 1/4, 1/8)",15913,"Collectibles|Science & Medicine (1930-Now)|Mining|Equipment",7,OK
363665320900,"Home Kitchen Multi-Pack Thin Clear Flexible Plastic Cutting Board Mat 12"" x 15""",46282,"Home & Garden|Kitchen, Dining & Bar|Kitchen Tools & Gadgets|Cutting Boards",26,OK
236407324687,"ASR Federal Leather Bifold Minimalist Double ID Card Holder, Black Basketweave",2996,"Clothing, Shoes & Accessories|Men|Men's Accessories|Wallets",21,OK
364855706606,"ASR Outdoor 22pc Backpack Kit, Beach Combing Metal Detector Accessories Set",163824,"Business & Industrial|Test, Measurement & Inspection|Test Meters & Detectors|Metal Detector Accessories",12,OK
235148716431,"ASR Outdoor Queen Size 60x80 Southwest Wilderness Adventure Fleece Throw Blanket",175750,"Home & Garden|Bedding|Blankets & Throws",23,OK
126149513414,"ASR Outdoor Clear Pocket Portable Travel Gold Panning Kit for Prospecting 11pc",15913,"Collectibles|Science & Medicine (1930-Now)|Mining|Equipment",5,OK
365816245798,"ASR Outdoor 3 Inch Locking Aluminum Carabiner Clip EDC Camping Gear (3 Colors)",50814,"Sporting Goods|Outdoor Sports|Climbing & Caving|Carabiners & Hardware",10,OK
365938401688,"ASR Federal Bifold Leather ID Card Shield Badge Holder Police Gear Basketweave",2996,"Clothing, Shoes & Accessories|Men|Men's Accessories|Wallets",21,OK
126495205134,"ASR Outdoor 50"" Aluminum Folding Sluice Box Gold Prospecting Backpack Kit Black",15913,"Collectibles|Science & Medicine (1930-Now)|Mining|Equipment",7,OK
235399090909,"Cord Made with Kevlar Survival Paracord Rope 200lbs Strength (Various Lengths)",181413,"Sporting Goods|Camping & Hiking|Outdoor Survival Gear|Paracord & Paracord Supplies",20,OK
235100299670,"ToolTreaux 10pc Double Ended Fine Cut Riffler File Set for Metal Jewelry Work",178974,"Home & Garden|Tools & Workshop Equipment|Hand Tools|Files",21,OK
126495661048,"ASR Outdoor Line Posting Hunting Boundary Hiking Trail Tape Marker Ribbon - Pink",178968,"Home & Garden|Tools & Workshop Equipment|Measuring & Layout Tools|Chalk Lines & Marking Tools",18,OK
126495661368,"10-Pack Ceramic Utility Knife Razor Blades for Box Cutter Replacement Blades",83982,"Crafts|Multi-Purpose Craft Supplies|Crafting Tools|Cutting Tools|Craft Knives & Blades",9,OK
126391796563,"ToolTreaux Brass Pin Punch Set for Crafting Woodworking Assorted Sizes - 8pc",50380,"Home & Garden|Tools & Workshop Equipment|Hand Tools|Punches",15,OK
364856425787,"ASR Outdoor 24pc Gold Panning Kit, 5 Gallon Bucket, 10lb Bobby Bo Paydirt, Black",15913,"Collectibles|Science & Medicine (1930-Now)|Mining|Equipment",4,OK
127389768398,"3pc Large Serrated Tweezer Tong Set with Case- 12, 10, and 8 Inch",262020,"Jewelry & Watches|Jewelry Care, Design & Repair|Jewelry Tools & Workbenches",14,OK
127389768400,"ASR Outdoor Magnesium Fire Starter Camping Survival Pocket Flint Grip Handle",166126,"Sporting Goods|Camping & Hiking|Outdoor Survival Gear|Fire Starters",17,OK
236344962434,"Universal Tool Stainless Steel Tweezer Set Assorted Tips Precision Tools - 4pc",122718,"Crafts|Multi-Purpose Craft Supplies|Crafting Tools|Craft Tweezers",11,OK
127389768402,"Universal Tool Deluxe Wood Burning Kit Assorted Tips Stencils and Tweezers",183150,"Crafts|Home Arts & Crafts|Woodworking|Wood Burning Pens",7,OK
127389768403,"ASR Outdoor Hiking Companion Whistles Emergency Survival Tools 105 dB Rating",181414,"Sporting Goods|Camping & Hiking|Outdoor Survival Gear|Safety Whistles",20,OK
127389768404,"250 Piece Universal Eye Glasses And Watch Repair Screw Kit Revolving Organizer",117039,"Jewelry & Watches|Watches, Parts & Accessories|Parts, Tools & Guides|Tools & Repair Kits",11,OK
127389768405,"Flatline Ops Nylon Hanging Strap Bag Attachment Snap Hook (Tan)",177887,"Sporting Goods|Hunting|Range & Shooting Equipment|Benches & Rests",20,OK
127389768406,"ASR Outdoor Double Sided Gun Cleaning Brushes Versatile Bristles 3 Piece Set",22700,"Sporting Goods|Hunting|Gun Smithing & Maintenance|Cleaning Supplies",21,OK
127389768407,"White Hook and Loop 3/4 wide Fabric Tape Roll  Self Adhesive 40 inch Fastener",180927,"Crafts|Sewing|Closures & Connectors|Hook & Loop Tape",11,OK
127389768408,"ASR Outdoor 8mm Sling Shot Ball Bearings Steel 100 Piece Set",117141,"Sporting Goods|Outdoor Sports|Air Guns & Slingshots|Slingshots",12,OK
127389768410,"Aluminum Dog Tag Military GI Blank Key Chain 1 Piece Set",156462,"Collectibles|Militaria|Current Militaria (2001-Now)|Original Items|Personal, Field Gear|Dog Tags",6,OK
127389768411,"Drop Point Outdoor Folding Pocket Knife 4.75 Inch with Window Punch, Camo Styles",48818,"Collectibles|Knives, Swords & Blades|Collectible Folding Knives|Modern Folding Knives|Factory Manufactured",20,OK
127389768412,"Aluminum Dog Tags Engraveable Blank Key Chains Military Identification 12 Pack",156462,"Collectibles|Militaria|Current Militaria (2001-Now)|Original Items|Personal, Field Gear|Dog Tags",6,OK
127389768415,"Flatline Ops 30mm Rifle Scope Mount ADI/ACI Ring System for Scopes",52510,"Sporting Goods|Hunting|Scopes, Optics & Lasers|Scope Mounts & Accessories",25,OK
127389768417,"Home Essentials Manicure Pedicure Foot Scrubber Foot File Callus Remover - Red",11872,"Health & Beauty|Nail Care, Manicure & Pedicure|Nail Care Tools|Manicure & Pedicure Tools & Kits",17,OK
127389768418,"ToolTreaux 6pc Metal Spring Heavy Duty Universal Clamps Set Rubber Grip",20761,"Home & Garden|Tools & Workshop Equipment|Hand Tools|Clamps & Vises",20,OK
127389768419,"Gear Aid Plastic Snap Hook for Camping Hiking Webbing Strap Customization Black",27362,"Sporting Goods|Camping & Hiking|Clothing|Other Camping, Hiking Clothing",10,OK
127389768421,"UV Tech Protectant and Rejuvenator Marine Gear 4oz",27363,"Sporting Goods|Camping & Hiking|Hiking Gear|Other Hiking Gear",9,OK
127389768422,"ASR Outdoor Mini Plastic Key Chain Sized Emergency Flashlight w/ Lanyard Black",16037,"Sporting Goods|Camping & Hiking|Flashlights, Lanterns & Lights|Flashlights",20,OK
127389768426,"ASR Tactical Full Tang Clip Point Blade Slim Kydex Sheath Hook Handle - Rainbow",179793,"Sporting Goods|Boxing, Martial Arts & MMA|Martial Arts Weapons|Knives",9,OK
127389768427,"Universal Tool High Speed Steel Step Drill Bits Locking Hex Shank Assorted - 3pc",50382,"Home & Garden|Tools & Workshop Equipment|Power Tool & Air Tool Accessories|Drill Bits",21,OK
127389768429,"ToolTreaux 10 Watt Mini Glue Gun and Hot Glue Sticks Crafting Supplies Kit, 3pc",183124,"Crafts|Multi-Purpose Craft Supplies|Adhesives & Tape|Glue Guns & Sticks",11,OK
127389768430,"Universal Home Soothing Exfoliating Bath Mitt Shower Accessory - White",45452,"Baby|Bathing & Grooming|Health & Grooming",11,OK
127389768431,"Universal Tool 100pc Polish Sand Cut Rotary Accessory Set in Wooden Box",260207,"Home & Garden|Tools & Workshop Equipment|Power Tool & Air Tool Accessories|Rotary Tool Accessories",20,OK
127389768433,"ASR Outdoor Safety Disposable Vest High Visibility One Size Fits Most Lime Green",88433,"Everything Else|Every Other Thing",5,OK
127389768434,"4.5 Inch 4 Prong Metal Pick-Up Tool Hobby Crafts Jewelry Making with Case",31726,"Crafts|Beads & Jewelry Making|Other Beads & Jewelry Making",11,OK
127389768435,"Shear Scissors Blades Sharp Heat Treated Thread Nipper 4.25 inches",28171,"Crafts|Sewing|Cutting Tools|Dressmaker's Scissors & Shears",15,OK
127389768437,"32 Sheet Disappearing Notebook Dissolving Message Note Pad - Reflection Paper",20164,"Business & Industrial|Office|Office Supplies|Paper Products|Note Pads",10,OK
127389768441,"Beille Stainless Steel and Wheat Fiber Handle Kitchen Knives (Many Styles)",177005,"Home & Garden|Kitchen, Dining & Bar|Flatware, Knives & Cutlery|Kitchen & Steak Knives",15,OK
127389768442,"ASR Outdoor 7pc Gold Panning Kit Glass Vials Snifter Bottle Glass Vials Tweezer",15913,"Collectibles|Science & Medicine (1930-Now)|Mining|Equipment",2,OK
127389768444,"ASR Federal 21 Bulb UV Light LED Flashlight Black Light Crime Scene Investigate",16037,"Sporting Goods|Camping & Hiking|Flashlights, Lanterns & Lights|Flashlights",23,OK
127389768445,"Jumbo 6.5 inch XL Carabiner Key Chain  - Blue",52373,"Clothing, Shoes & Accessories|Men|Men's Accessories|Key Chains, Rings & Cases",16,OK
236344962435,"American Flag Non-Slip Gun and Electronics Cleaning Mat Washable 18 Inch",177907,"Sporting Goods|Hunting|Range & Shooting Equipment|Other Range & Shooting Equipment",8,OK
236344962436,"ToolTreaux Nylon Storage Tool Bag with Side Pockets and Shoulder Strap 18 x 8.5",42362,"Home & Garden|Tools & Workshop Equipment|Tool Boxes & Storage|Tool Bags, Belts & Pouches",19,OK
236344962437,"ASR Outdoor 9 in 1 Multitool Folding Pocket Knife with G10 Handle, Black",75236,"Sporting Goods|Camping & Hiking|Camping Knives & Tools|Multi-Tools",21,OK
236344962442,"Emergency Outdoor Essential Survival Pop Tent Canopy for Camping Hiking - Red",181415,"Sporting Goods|Camping & Hiking|Outdoor Survival Gear|Other Outdoor Survival Gear",20,OK
236344962443,"Hand Warmers 10 Hour Protection Heat Pads for Outdoor Activities",159183,"Sporting Goods|Winter Sports|Skiing, Snowboarding & Snowshoeing|Accessories|Hand & Foot Warmers",16,OK
236344962444,"Universal 5 Inch Hobby Knife Metal Scalpel Handle Number 3 - 5 Pack",104229,"Business & Industrial|Healthcare, Lab & Dental|Handpieces & Instruments|Scalpels, Surgical Blades & Handles",11,OK
236344962447,"(6 Pack) Aluminum Dog Tag Military GI Blank Key Chain",158439,"Collectibles|Militaria|Surplus|Personal, Field Gear|Dog Tags",4,OK
236344962451,"7pc Spatula Wax Carver Ceramic Pottery Double Ended Tool Set",183319,"Crafts|Sculpting, Molding & Ceramics|Other Sculpting Supplies",10,OK
236344962452,"ASR Outdoor Ninja Throwing Knives American Flag Bald Eagle Design 6.5 Inch",73522,"Collectibles|Knives, Swords & Blades|Collectible Fixed Blade Knives|Modern Fixed Blade|Factory Manufactured",17,OK
236344962453,"Beille 11oz Water Glasses Clear Tumbler Set Kitchen Essentials Glassware, 4pk",20696,"Home & Garden|Kitchen, Dining & Bar|Glassware & Drinkware",25,OK
236344962454,"ToolTreaux 2 Inch Metal Spring Heavy Duty Clamps Set Rubber Tipped Grip 6pc",20761,"Home & Garden|Tools & Workshop Equipment|Hand Tools|Clamps & Vises",20,OK
236344962455,"Kidplokio 12pc Army Semi Truck Superhero Cinch Bag Backpack Gift Bundle Boys 3+",260988,"Clothing, Shoes & Accessories|Kids|Backpacks & Bags",24,OK
236344962456,"Star Wars Baby Yoda 2 Pack Non Woven Tote Bag Kids Travel Bag Ages 3 and Up",261068,"Toys & Hobbies|Action Figures & Accessories|Action Figures",31,OK
236344962459,"Beille Stainless Steel Kitchen Cutlery Knife Set Carving Paring Utility 6 Piece",177005,"Home & Garden|Kitchen, Dining & Bar|Flatware, Knives & Cutlery|Kitchen & Steak Knives",11,OK
236344962462,"ASR Outdoor Comprehensive Wilderness Travel Medicine Emergency Guide",261186,"Books & Magazines|Books",27,OK
236344962465,"ASR Tactical TitanLace 2500 Technora Work Boot Lace (Multiple Sizes and Colors)",169282,"Clothing, Shoes & Accessories|Specialty|Clothing & Shoe Care|Shoe Care & Repair|Shoe Laces",12,OK
236344962467,"10 Pack of .25in Hex Shank Magnetic Bit Extension Holder for Power Tools",50382,"Home & Garden|Tools & Workshop Equipment|Power Tool & Air Tool Accessories|Drill Bits",22,OK
236344962468,"6 in 1 Multi-Head Aluminum Jewelry Hammer for Precious Metal Jewely Design",262020,"Jewelry & Watches|Jewelry Care, Design & Repair|Jewelry Tools & Workbenches",12,OK
236344962469,"Universal Tool Acid Brush Set 6 Inch Metal Handle for Acid Glue Paste 12pc Set",183161,"Crafts|Home Arts & Crafts|Woodworking|Other Woodworking Supplies",10,OK
236344962470,"Universal Home 100 Count 4"" Cable Wire Hose Zip Ties",57007,"Business & Industrial|Fasteners & Hardware|Clamps, Ties & Cords|Cable Ties",17,OK
236344962472,"SE Paper Trimmer 12 Inch Cutting Board Magnetic with Grid Guide Base",183235,"Crafts|Scrapbooking & Paper Crafts|Scrapbooking|Scrapbooking Tools|Paper Trimmers",10,OK
236344962474,"Heininger 4016 HitchMate Cargo Stabilizer Bar for Full-Size Trucks",177849,"Sporting Goods|Cycling|Car & Truck Racks",13,OK
