item_id,title,category_id,category_path,aspect_count,status
236345031442,"Gold Rush Sifting Classifier Sieve Mini 6 Inch Prospect Pan 10 Holes per Sq Inch",15913,"Collectibles|Science & Medicine (1930-Now)|Mining|Equipment",7,OK
236345031444,"Beille Set of 6 Clear Classic Goblet Water Glasses Home Decor Glassware, 7.43oz",260384,"Home & Garden|Kids & Teens at Home|Kitchen & Dining|Cups, Mugs & Glasses",30,OK
236345031445,"Gear Aid UV Cure AquaSeal for Camping Outdoor In Field Repair Adhesive - .25oz",27362,"Sporting Goods|Camping & Hiking|Clothing|Other Camping, Hiking Clothing",7,OK
236345031446,"Beille 3pc Stainless Steel Colander for Kitchen, Nesting Food Strainers",20636,"Home & Garden|Kitchen, Dining & Bar|Kitchen Tools & Gadgets|Colanders, Strainers & Sifters",16,OK
236345031447,"ASR Outdoor 5lb Madagascar Gemstone Mining Kit Geology Paydirt Classifier and ID",15913,"Collectibles|Science & Medicine (1930-Now)|Mining|Equipment",6,OK
236345031448,"ASR Outdoor Elastic Shock Cord Natural Rubber 30 Feet 3mm Diameter - Black",109492,"Business & Industrial|Fasteners & Hardware|Clamps, Ties & Cords|Shock Cords & Bungees",15,OK
236345031449,"Nickelodeon Paw Patrol 11pc Stationery Set Kids School Supplies Pen Pencil Paper",102950,"Home & Garden|School Supplies|Notebooks & Binders",14,OK
236345031450,"Water Resistant Match Stick Storage Container And Fire Starter Mirror",8504,"Sporting Goods|Camping & Hiking|Other Camping & Hiking",10,OK
236345031451,"Universal Tool Hanging Hook Work Light 400 Lumen Dual COB LEDs Magnetic Base",126393,"Home & Garden|Tools & Workshop Equipment|Workshop Equipment|Flashlights & Work Lights",23,OK
236345031452,"Professional Quality Tapered Diamond File Assorted Grits 10 Piece Set",178974,"Home & Garden|Tools & Workshop Equipment|Hand Tools|Files",19,OK
236345031453,"ASR Outdoor Multi Function Outdoor Travel Camping Utensil Set Knife Fork Spoon",87133,"Sporting Goods|Camping & Hiking|Camping Cooking Supplies|Camping Cooking Utensils",24,OK
236345031454,"ASR Outdoor 3 IN-1 Rechargeable LED Camping Headlamp Bike Light with Magnet",106984,"Sporting Goods|Camping & Hiking|Flashlights, Lanterns & Lights|Headlamps",20,OK
236345031456,"Disney Princess 6pc Girls BFF Fashion Jewelry Hair Accessories Set with",19172,"Toys & Hobbies|Preschool Toys & Pretend Play|Dress-Up, Costumes",13,OK
236345031460,"Kidplokio DIY Build Dinosaur Robot Assembly Toy Figure Play Set Boys Ages 3+",19170,"Toys & Hobbies|Preschool Toys & Pretend Play|Dinosaurs",10,OK
236345031462,"Universal Tool Quality 8Pc Brass Pin Punch Set Hobby Craft Woodworking",50380,"Home & Garden|Tools & Workshop Equipment|Hand Tools|Punches",14,OK
236345031463,"3 Piece Gold Panning Mining Classifier Sifting Set 1/50"" 1/70"" 1/100"" Fine Mesh",15913,"Collectibles|Science & Medicine (1930-Now)|Mining|Equipment",6,OK
236345031465,"Disney Minnie Mouse 8pc Diary with Lock Stationery Set Girls Ages 3 and Up",45112,"Business & Industrial|Office|Office Supplies|Calendars & Planners|Blank Diaries & Journals",15,OK
236345031466,"ToolTreaux Stainless Steel Double Ended Knurled Picks Hobby Craft Tools - 4pc",160677,"Crafts|Home Arts & Crafts|Woodworking|Wood Carving Hand Tools",10,OK
236345031468,"ASR Tactical Trip Wire Perimeter Cotter Pin for Alarm Signal Device (Pin Only)",183936,"Business & Industrial|Fasteners & Hardware|Fastening Pins|Hairpin & Straight Cotter Pins",14,OK
236345031469,"ASR Outdoor 8.25 Inch Rescue Knife with Belt Clip Seat Belt Cutter - Black",48818,"Collectibles|Knives, Swords & Blades|Collectible Folding Knives|Modern Folding Knives|Factory Manufactured",18,OK
236345031470,"12 inch Stainless Steel Ruler Metric and SAE Measurements",29524,"Home & Garden|Tools & Workshop Equipment|Measuring & Layout Tools|Measuring Tapes & Rulers",21,OK
236345031472,"ASR Outdoor Survival 550 Type III Mil-Spec Tactical Paracord Rope (Many Lengths)",181413,"Sporting Goods|Camping & Hiking|Outdoor Survival Gear|Paracord & Paracord Supplies",19,OK
236345031473,"12PC Small Glass Vials with Screw Top Lids, Gold Flake and Essential Oil, 1 Dram",15913,"Collectibles|Science & Medicine (1930-Now)|Mining|Equipment",6,OK
236345031474,"ASR Outdoor 12pc Moroccan Break Your Own Geodes Kit with Sledge Hammer",11737,"Toys & Hobbies|Educational|Science & Nature|Other Science & Nature Toys",9,OK
236345031475,"GEAR AID Tenacious Tape Reflective Patches for Safety, Jackets, Bike and Outdoor",36120,"Sporting Goods|Camping & Hiking|Tents & Canopies|Tent & Canopy Accessories",14,OK
236345031479,"Hitchmate Cargo Stabilizer Bar for Truck Automotive Exterior Accessories - Small",177849,"Sporting Goods|Cycling|Car & Truck Racks",14,OK
236345031480,"ToolTreaux Clear Plastic Watch Case Coffin Travel Essentials Jewelry Organizers",260330,"Jewelry & Watches|Watches, Parts & Accessories|Watch Accessories|Boxes & Cases",19,OK
236345031482,"Beille Kitchen Gadgets Cooking Baking Supplies Meal Prep Tool Set Pastel",20649,"Home & Garden|Kitchen, Dining & Bar|Kitchen Tools & Gadgets|Cooking Utensils",15,OK
236345031486,"ASR Outdoor American Flag Eagle Fixed Blade Hunting Knife Patriotic Gift 3 Style",73522,"Collectibles|Knives, Swords & Blades|Collectible Fixed Blade Knives|Modern Fixed Blade|Factory Manufactured",19,OK
236345031488,"ASR Outdoor Sand Sifting Beach Combing Kids Metal Detector Accessory - 4 Colors",163824,"Business & Industrial|Test, Measurement & Inspection|Test Meters & Detectors|Metal Detector Accessories",13,OK
365879907969,"ASR Tactical Full Tang Clip Point Blade Slim Kydex Sheath Hook Handle - Chrome",179793,"Sporting Goods|Boxing, Martial Arts & MMA|Martial Arts Weapons|Knives",9,OK
365879907970,"ASR Outdoor Black Gold Mining Pans for Gold Prospecting 2 Riffle Types 4pc Set",15913,"Collectibles|Science & Medicine (1930-Now)|Mining|Equipment",5,OK
365879907973,"ASR Outdoor 13lb Gemstone Mining Kit Geology Paydirt Classifier Assorted Stones",15913,"Collectibles|Science & Medicine (1930-Now)|Mining|Equipment",6,OK
365879907974,"Shimmer and Shine Girls Fashion Accessory Hair Bow Barrette Sparkle Clip",19172,"Toys & Hobbies|Preschool Toys & Pretend Play|Dress-Up, Costumes",12,OK
365879907976,"ToolTreaux Safety 18k Gold Testing Kit, 7pc",258289,"Business & Industrial|CNC, Metalworking & Manufacturing|Semiconductor & PCB Manufacturing Equipment|Semiconductor Test & Assembly Equipment|Testing Equipment",10,OK
365879907979,"Universal Tool Graphite Crucible for Melting Gold Silver Metals (Many Sizes)",262020,"Jewelry & Watches|Jewelry Care, Design & Repair|Jewelry Tools & Workbenches",13,OK
365879907980,"ASR Outdoor Stainless Steel 8.75in Gardening Folding Trowel with 1mm Nylon Pouch",75233,"Sporting Goods|Camping & Hiking|Camping Knives & Tools|Camping Shovels",21,OK
365879907983,"ToolTreaux 144pc Jewelry Saw Blades Set 0/3 Size 5.25"" 50 TPI Steel",262020,"Jewelry & Watches|Jewelry Care, Design & Repair|Jewelry Tools & Workbenches",14,OK
365879907984,"Sonic the Hedgehog 2pc Pullback Race Cars Toy Vehicles Set for Boys Age 3 and Up",177918,"Toys & Hobbies|Diecast & Toy Vehicles|Play Sets",16,OK
365879907985,"ASR Outdoor 7pc Kids Gold Panning Kit Beginner Equipment with Paydirt - Blue",15913,"Collectibles|Science & Medicine (1930-Now)|Mining|Equipment",5,OK
365879907986,"ToolTreaux Safety Silver Testing Kit with Testing Stone, 7pc",262020,"Jewelry & Watches|Jewelry Care, Design & Repair|Jewelry Tools & Workbenches",14,OK
365879907987,"2pk UV Spy Pen Invisible Ink Marker Security Pen Novelty Gadgets (Green Blue)",28109,"Crafts|Art Supplies|Drawing & Lettering Supplies|Art Pens & Markers",13,OK
365879907988,"ASR Outdoor 9 Piece Complete Gold Panning Kit, Classifier Sifter Vials - Black",15913,"Collectibles|Science & Medicine (1930-Now)|Mining|Equipment",5,OK
365879907990,"ASR Outdoor Gemstone Paydirt Bag Gold Panning Kit (Many Styles and Sizes)",14955,"Business & Industrial|Test, Measurement & Inspection|Test Meters & Detectors|Metal Detectors",11,OK
365879907991,"ASR Outdoor Large Mineral Gold Prospecting Pay Dirt Hand Trowel",163824,"Business & Industrial|Test, Measurement & Inspection|Test Meters & Detectors|Metal Detector Accessories",11,OK
365879907994,"ASR Tactical Ninja Shoe Foot Spike Claws Attachment Adjustable",475,"Collectibles|Knives, Swords & Blades|Other Collectible Blades",10,OK
365879907995,"13.5 Inch Collectors Hunting Knife Scabbard and Handle (5 Styles)",73522,"Collectibles|Knives, Swords & Blades|Collectible Fixed Blade Knives|Modern Fixed Blade|Factory Manufactured",20,OK
365879907999,"Chrome Stainless Steel Premium Portable Hip Flask 8oz",63505,"Home & Garden|Kitchen, Dining & Bar|Bar Tools & Accessories|Flasks",20,OK
365879908001,"ASR Outdoor 10L Collapsible Bucket Stand Backpacking Gold Prospecting Equipment",310,"Sporting Goods|Other Sporting Goods",10,OK
365879908002,"ASR Outdoor 9 Piece Complete Gold Panning Kit, Classifier Sifter Vials - Green",15913,"Collectibles|Science & Medicine (1930-Now)|Mining|Equipment",5,OK
365879908004,"Colortivity Bible Fun Coloring Book with Activities for Kids 96pg 2pk Assorted",11735,"Toys & Hobbies|Educational|Music & Art",11,OK
365879908006,"Lady Speed Stick Womens Invisible Dry Deodorant Antiperspirant Powder Fresh 3pk",29580,"Health & Beauty|Bath & Body|Deodorants & Antiperspirants",15,OK
365879908007,"2pk Bella Linda Skin Care Face Moisturizer Cream Lotion for Hydration 6.5oz",21205,"Health & Beauty|Skin Care|Moisturizers",19,OK
365879908009,"Frozen II Girls Canteen Water Bottle Anna Elsa Pop Up Lid with Shoulder Strap",177058,"Home & Garden|Kids & Teens at Home|Kitchen & Dining|Water Bottles & Vacuum Flasks",32,OK
365879908011,"Kidplokio 8pc Urban City Police Friction Powered Toy Cars with Play Mat, Blue,",19100,"Toys & Hobbies|Games|Board & Traditional Games|Vintage Manufacture",14,OK
365879908012,"ToolTreaux Mini Hook and Pick Set Precision Cleaning and Hobby Tools - 4 Pieces",303,"Home & Garden|Tools & Workshop Equipment|Hand Tools|Other Hand Tools",19,OK
365879908015,"Marvel Spiderman 200pc Sticker Book 4 Sheets Puffy Stickers Boys Ages 3 and Up",34002,"Crafts|Scrapbooking & Paper Crafts|Scrapbooking|Scrapbooking Embellishments|Scrapbooking Stickers",14,OK
365879908017,"Dove Hair Care Anti Knot Hydration Formula Shampoo 350mL 12 Ounce Bottle",177661,"Health & Beauty|Hair Care & Styling|Shampoos & Conditioners",18,OK
365879908019,"ASR Outdoor 3lbs Paydirt Complete Backpack Gold Panning Kit with Rubber Sluice",15913,"Collectibles|Science & Medicine (1930-Now)|Mining|Equipment",5,OK
365879908020,"Universal Home Non-slip Flexible Cutting Mat Food Contact Dishwasher Safe - Pink",46282,"Home & Garden|Kitchen, Dining & Bar|Kitchen Tools & Gadgets|Cutting Boards",22,OK
365879908021,"Lady Speed Stick Womens Invisible Dry Deodorant Antiperspirant (3 Scent Choices)",29580,"Health & Beauty|Bath & Body|Deodorants & Antiperspirants",12,OK
365879908022,"ASR Outdoor Stretch Bungee Cord White with Red Ball Tie Down 6 Inch Large",109492,"Business & Industrial|Fasteners & Hardware|Clamps, Ties & Cords|Shock Cords & Bungees",16,OK
365879908023,"Universal Tool Plastic Jewelers Eye Loupe Set 2.5X 5X 7.5X 10X Magnifiers 4pc",262020,"Jewelry & Watches|Jewelry Care, Design & Repair|Jewelry Tools & Workbenches",14,OK
365879908024,"ASR Federal Leather Police Bifold RFID Wallet Badge Holder with Removable ID",169271,"Clothing, Shoes & Accessories|Men|Men's Accessories|ID & Document Holders",19,OK
365879908026,"Universal Antique Grandfather Brass Clock Key 2 Pack",261610,"Collectibles|Decorative Collectibles|Clocks|Other Clocks",16,OK
365879908034,"Beille Silicone Baby Feeding Essentials Ages One and Up (Many Styles and Colors)",117386,"Baby|Feeding|Cups, Dishes & Utensils|Feeding Sets",10,OK
127389857795,"(2 Pack) ASR Outdoor 3oz Plastic Heavy Duty Gold Snifter Bottle with Nozzle",15913,"Collectibles|Science & Medicine (1930-Now)|Mining|Equipment",5,OK
127389857796,"Aquamira Universal Quick Connect 1/4"" Tubing Splice Kit - Fits Frontier Filter",87125,"Sporting Goods|Camping & Hiking|Hiking Backpacks|Hydration Packs",22,OK
127389857797,"Brass Fort Smith Prison Guard Belt Buckle",29464,"Collectibles|Cultures & Ethnicities|Western Americana|Belt Buckles",7,OK
127389857802,"Kidplokio Kids Die Cast Toy Race Car Set Assorted Colors Boys Toys (6 Sizes)",180506,"Toys & Hobbies|Diecast & Toy Vehicles|Cars, Trucks & Vans|Contemporary Manufacture",16,OK
127389857805,"ASR Outdoor Comprehensive Wilderness Travel Medicine Guide and Survival Tool",181415,"Sporting Goods|Camping & Hiking|Outdoor Survival Gear|Other Outdoor Survival Gear",17,OK
127389857806,"ToolTreaux Signature Inscription Marking Stamp for Jewelry Making - Silver 999",183696,"Crafts|Beads & Jewelry Making|Beading & Jewelry Making Tools|Jewelry Punches & Stamps",12,OK
127389857807,"Universal Antique Grandfather Brass Clock Key 2 Pack Even & Odd",261610,"Collectibles|Decorative Collectibles|Clocks|Other Clocks",16,OK
127389857808,"Metal Polish #1 Buffing Compound Removes Oxidation For Jewelry",183145,"Crafts|Leathercrafts|Leather Treatments & Paints|Polishing & Creasing Tools",12,OK
127389857809,"Universal Tool Multipurpose Kitchen Scissors - Black or Green",122938,"Home & Garden|Kitchen, Dining & Bar|Flatware, Knives & Cutlery|Scissors & Shears",20,OK
127389857810,"ASR Outdoor 3pc Metal Detecting Plastic Scoop Magnet Glass Vial Gold Panning Kit",15913,"Collectibles|Science & Medicine (1930-Now)|Mining|Equipment",2,OK
127389857811,"144pk ASR Tactical Escape Saw Blades Outdoor Emergency and Personal Defense",75237,"Sporting Goods|Camping & Hiking|Camping Knives & Tools|Camping Saws",18,OK
127389857812,"ASR Outdoor Adjustable Ear Protection Ear Muffs for Gun Shooting Firing Range",53152,"Business & Industrial|Facility Maintenance & Safety|Personal Protective Equipment (PPE)|Ear Plugs & Ear Muffs|Ear Plugs",10,OK
127389857815,"ASR Outdoor Nylon Camping Vest Gold Panning Adjustable Hunting Fishing Jacket",65976,"Sporting Goods|Fishing|Clothing, Shoes & Accessories|Coats, Jackets & Vests",26,OK
127389857816,"Star Wars The Mandalorian Kids Inflatable Punching Bop Bag Exercise Toy",11742,"Toys & Hobbies|Outdoor Toys & Structures|Other Outdoor Toys, Structures",13,OK
127389857817,"ASR Outdoor 5-in-1 Mini EDC Small Pocket Knife Multi Tool - LOGO Red",75235,"Sporting Goods|Camping & Hiking|Camping Knives & Tools|Camping Knives",19,OK
127389857818,"ToolTreaux Clear Craft Cutting Mat Art Supplies Hobby Tools (3 Sizes)",183175,"Crafts|Multi-Purpose Craft Supplies|Crafting Tools|Cutting Tools|Cutting Mats",10,OK
127389857819,"4 Pack 60 Inch in/mm Retractable Tailors Measuring Tape for Sewing Craft Hobby",29524,"Home & Garden|Tools & Workshop Equipment|Measuring & Layout Tools|Measuring Tapes & Rulers",19,OK
127389857821,"Universal Emergency Hammer Window Punch and Seat Belt Cutter Car Tools 4 Pack",20763,"Home & Garden|Tools & Workshop Equipment|Hand Tools|Hammers & Mallets",13,OK
127389857822,"750 Lumen Durable Portable Work Light Indoor Outdoor Multi Use Black",126393,"Home & Garden|Tools & Workshop Equipment|Workshop Equipment|Flashlights & Work Lights",22,OK
127389857823,"Battle Round Personal Bottle Opener Stealth Key Chain",20688,"Home & Garden|Kitchen, Dining & Bar|Bar Tools & Accessories|Corkscrews & Openers",17,OK
127389857824,"4pc Shopkins Stretchy Silicone Bracelets Gift Set D'Lish Donut Apple Blossom",261974,"Jewelry & Watches|Children's Jewelry|Bracelets & Charms",24,OK
127389857825,"6"" Outdoor Tactical Neck Chain Knife Survival Paracord Wrapped Handle",310,"Sporting Goods|Other Sporting Goods",10,OK
127389857827,"Disney Pixar Toy Story 4 Shaped Spiral Notebook with Pink Pen - Bo Peep",145939,"Toys & Hobbies|Educational|Reading & Writing|Grade School",13,OK
127389857829,"ASR Outdoor Collectible Dagger Bowie Knife Etched Bear Sheath Ergonomic Handle",73522,"Collectibles|Knives, Swords & Blades|Collectible Fixed Blade Knives|Modern Fixed Blade|Factory Manufactured",17,OK
127389857830,"Universal Home LED 7 Color Changing Mood Light Ambiance Home Decor White Light",20702,"Home & Garden|Lamps, Lighting & Ceiling Fans|Night Lights",28,OK
127389857832,"TychoTyke Kids Light Up 10 Inch Flying Disc Outdoor Fun Picnic Park Toys Orange",19017,"Toys & Hobbies|Outdoor Toys & Structures|Balls, Flying Discs & Boomerangs",12,OK
127389857833,"Jumbo 6.5"" XL Carabiner Key Chain  - Purple",52373,"Clothing, Shoes & Accessories|Men|Men's Accessories|Key Chains, Rings & Cases",15,OK
127389857834,"ASR Outdoor Stainless Steel Multi-tool Utility EDC Pocket Knife with Carry Pouch",48818,"Collectibles|Knives, Swords & Blades|Collectible Folding Knives|Modern Folding Knives|Factory Manufactured",18,OK
127389857835,"ASR Outdoor Paka Wood Pocket Knife Folding Blade 440 Stainless Steel Clip Point",48818,"Collectibles|Knives, Swords & Blades|Collectible Folding Knives|Modern Folding Knives|Factory Manufactured",12,OK
127389857836,"Frozen II 16oz Pull Top Water Bottle Kids Canteen Girls Hydration Ages 3 and Up",177058,"Home & Garden|Kids & Teens at Home|Kitchen & Dining|Water Bottles & Vacuum Flasks",31,OK
127389857837,"ASR Outdoor Collapsible Silicone 10 Liter Gold Panning Water Bucket Container",163824,"Business & Industrial|Test, Measurement & Inspection|Test Meters & Detectors|Metal Detector Accessories",11,OK
127389857838,"ASR Tactical 8.25"" Spear Point Full Tang Hunting Knife, Chrome",179793,"Sporting Goods|Boxing, Martial Arts & MMA|Martial Arts Weapons|Knives",9,OK
127389857839,"Harry Potter School Supplies 9.5 Inch Gryffindor Kids Mini Backpack with Art Kit",260988,"Clothing, Shoes & Accessories|Kids|Backpacks & Bags",26,OK
127389857840,"Universal Antique Grandfather Clock Winding Brass Key 5 Way (Even)",261610,"Collectibles|Decorative Collectibles|Clocks|Other Clocks",22,OK
127389857841,"ASR Outdoor Gold Classifier Sifting Prospecting Pan 1/100"" Inch Mesh Screen",15913,"Collectibles|Science & Medicine (1930-Now)|Mining|Equipment",5,OK
127389857843,"Emergency Sleeping Bag Mylar Insulated Heat Light Weight 84x36 Inch",181415,"Sporting Goods|Camping & Hiking|Outdoor Survival Gear|Other Outdoor Survival Gear",20,OK
127389857844,"ASR Federal Heavy Duty Black Leather Double ID Holder - Fits 2 Standard IDs",71482,"Business & Industrial|Retail & Services|Security & Surveillance|Other Retail Security",13,OK
127389857845,"Kidplokio 2pc Space Toy Bundle Blue Blaster and Superhero Cinch Bag Boys 3 Up",19181,"Toys & Hobbies|Preschool Toys & Pretend Play|Other Preschool & Pretend Play",15,OK
127389857846,"ASR Outdoor Black Drawstring Security Strings Bag with Stopper",87122,"Sporting Goods|Camping & Hiking|Hiking Backpacks|Daypacks",25,OK
127389857848,"ASR Tactical 2-Mode LED Ultra Violet UV Flashlight Handheld Black Light",16037,"Sporting Goods|Camping & Hiking|Flashlights, Lanterns & Lights|Flashlights",23,OK
127389857849,"Tooltreaux High Speed Stainless Steel Drill Bits Set 1.05 to 2mm 15 Pieces",50382,"Home & Garden|Tools & Workshop Equipment|Power Tool & Air Tool Accessories|Drill Bits",21,OK
236345069150,"Beille Ceramic Stoneware Modern Dipped Coffee Cups 3pc Set, Assorted Colors",262378,"Pottery & Glass|Decorative Cookware, Dinnerware & Serveware|Mugs",29,OK
236345069151,"Universal Tool 958 Silver Marking Jewelry Stamp for  Precious Metal Working",31726,"Crafts|Beads & Jewelry Making|Other Beads & Jewelry Making",12,OK
236345069152,"GEAR AID Care Kit Revivex Pro Cleaner, Revivex Wash-In Water Repellent, Patches",87100,"Sporting Goods|Camping & Hiking|Outdoor Sleeping Gear|Sleeping Bags",11,OK
236345069153,"Gear Aid Aquaseal Repair Adhesive and Cotol-240 Cure Accelerator Outdoor - Small",8504,"Sporting Goods|Camping & Hiking|Other Camping & Hiking",10,OK
236345069154,"Universal Tool Reeled Solder with Flux Coating 100 Grams 1mm Diameter",124821,"Business & Industrial|CNC, Metalworking & Manufacturing|Welding & Soldering Equipment|Soldering/Desoldering Equipment & Accessories|Solder & Soldering Consumables|Solder",13,OK
236345069155,"20oz Geology Rock Pick Hammer Ergonomic Handle Mining Tool",20763,"Home & Garden|Tools & Workshop Equipment|Hand Tools|Hammers & Mallets",22,OK
236345069157,"4 Pack 10"" Inch Riffled Black Gold Panning Pan Mining Dredging Sluice Tool",15913,"Collectibles|Science & Medicine (1930-Now)|Mining|Equipment",4,OK
236345069158,"ToolTreaux Chrome Vanadium Steel Security Bit Set Magnetic Extension Holder 33pc",260207,"Home & Garden|Tools & Workshop Equipment|Power Tool & Air Tool Accessories|Rotary Tool Accessories",20,OK
236345069159,"Toy Story 4 Kids Cinch Bag Travel Backpack with 4pc Sticker Sheet Bundle Set",260988,"Clothing, Shoes & Accessories|Kids|Backpacks & Bags",28,OK
236345069160,"ASR Outdoor Emergency Survival 5 Liter Water Flask Compact Portable",181408,"Sporting Goods|Camping & Hiking|Water Bottles & Hydration|Canteens, Bottles & Flasks",22,OK
236345069161,"5pk Lady Speed Stick Womens Invisible Dry Deodorant Antiperspirant Powder Fresh",29580,"Health & Beauty|Bath & Body|Deodorants & Antiperspirants",15,OK
236345069162,"100Pk Bendable Non Lethal Safety Pen, Flexible Ball Point Writing Pen Tool",257906,"Business & Industrial|Office|Office Supplies|Pens, Pencils & Markers|Ballpoint & Rollerball Pens",6,OK
236345069163,"Universal Tool 100 Pack Black Stretch Cord with Black Ball 8 Inch Length",85917,"Home & Garden|Tools & Workshop Equipment|Workshop Equipment|Tie Downs & Straps",20,OK
236345069164,"Disney Princess Purple Glitter Elastic Hair Band Headband Hair Bow for Girls",57920,"Clothing, Shoes & Accessories|Kids|Girls|Girls' Accessories|Hair Accessories",17,OK
236345069166,"Double Ended Steel Pick Set with Grooved Grip Metal Working Pottery Craft Tools",116496,"Crafts|Sculpting, Molding & Ceramics|Ceramics & Pottery|Pottery Tools & Sets",12,OK
236345069168,"SE 8372SH Stone Hammer, 10""",20763,"Home & Garden|Tools & Workshop Equipment|Hand Tools|Hammers & Mallets",15,OK
236345069169,"ASR Outdoor Portable Telescoping Collapsible Stool with Carry Handle",16038,"Sporting Goods|Camping & Hiking|Camping Furniture",17,OK
236345069170,"Emergency Outdoor Winter Blanket Insulated Thermal Reflector 4 Pack",181415,"Sporting Goods|Camping & Hiking|Outdoor Survival Gear|Other Outdoor Survival Gear",20,OK
236345069171,"Marvel Avengers Super Hero Suction Dart Blaster with Targets",158749,"Toys & Hobbies|Outdoor Toys & Structures|Dart Guns & Soft Darts",13,OK
236345069172,"ASR Outdoor Cord 325lb Survival Tactical Polyester Sleeved Rope 25ft 100ft 500ft",181413,"Sporting Goods|Camping & Hiking|Outdoor Survival Gear|Paracord & Paracord Supplies",19,OK
236345069173,"ASR Outdoor 3 in 1 Hiking Camping Survival Multi Tool Fire Starter Pocket Knife",75236,"Sporting Goods|Camping & Hiking|Camping Knives & Tools|Multi-Tools",21,OK
236345069174,"Gear Aid Revivex Odor Eliminator for Tents, Footwear and Sports Gear, 1 Gallon",27363,"Sporting Goods|Camping & Hiking|Hiking Gear|Other Hiking Gear",11,OK
236345069175,"Productive Fitness Muscle Diagrams Poster Series Male and Female for Use At Home",28009,"Art|Art Posters",24,OK
236345069177,"ASR Outdoor 6.25"" Pocket Knife Stainless Steel Tactical Mini Clip Point Blade",73522,"Collectibles|Knives, Swords & Blades|Collectible Fixed Blade Knives|Modern Fixed Blade|Factory Manufactured",17,OK
236345069178,"Light Up Dancing Dino RC T-Rex Dinosaur Predator With Radio Control - Brown",84912,"Toys & Hobbies|Radio Control & Control Line|Remote-Controlled Toys",14,OK
236345069181,"ASR Outdoor 400lb Neodymium Magnet Fishing Kit with 550 Paracord Rope, 3pc",27414,"Sporting Goods|Fishing|Fishing Equipment|Other Fishing Equipment",18,OK
236345069182,"Universal Tool Chefs Kitchen Knife Sharpener 12 Inch T13 Steel Rod",116005,"Home & Garden|Kitchen, Dining & Bar|Kitchen Tools & Gadgets|Sharpeners",13,OK
236345069183,"Beille 2pk Non Scratch Coconut Plant Based Dish Sponge Kitchen Tools (2 Styles)",129609,"Home & Garden|Household Supplies & Cleaning|Cleaning Tools|Sponges & Scourers",10,OK
236345069184,"ASR Tactical TitanLace 950 Technora Work Boot Lace (Multiple Sizes and Colors)",169282,"Clothing, Shoes & Accessories|Specialty|Clothing & Shoe Care|Shoe Care & Repair|Shoe Laces",11,OK
236345069185,"ASR Outdoor 32 dB Noise Reduction Rated Safety Ear Plugs (10 Pairs) Protect Ears",180940,"Health & Beauty|Health Care|Ear Care|Ear Plugs",17,OK
236345069187,"ASR Outdoor 16 Inch Everyday Carry Travel Tool or Duffel Bag, Black",52357,"Clothing, Shoes & Accessories|Men|Men's Accessories|Bags",23,OK
236345069189,"3 Pack Double Sided 60 inch Tailors Tape Measure Seamstress Alteration Sewing",183295,"Crafts|Sewing|Measuring Tools|Measuring Tapes",9,OK
236345069190,"1 Watt Flashlight - 120 Lumens",16037,"Sporting Goods|Camping & Hiking|Flashlights, Lanterns & Lights|Flashlights",22,OK
365879950523,"10pc Razor Knife Blade Refill Pack Replacement Blades for 8828 Hobby Knife",39057,"Home & Garden|Tools & Workshop Equipment|Hand Tools|Knives & Blades",18,OK
365879950524,"Auto Emergency Hammer With Seatbelt Cutter and Window Punch",20763,"Home & Garden|Tools & Workshop Equipment|Hand Tools|Hammers & Mallets",18,OK
365879950525,"Gold Rush Sifting Classifier Sieve Mini 6 Inch Prospect Pan 30 Holes per Sq Inch",15913,"Collectibles|Science & Medicine (1930-Now)|Mining|Equipment",7,OK
365879950526,"Beille 4pc 100% Cotton Terry Classic Windowpane Dish Towels Set (2 Colors)",20664,"Home & Garden|Kitchen, Dining & Bar|Linens & Textiles|Towels & Dishcloths",18,OK
365879950527,"Silicone O Ring Valve Protection Grease for Diving Gear - 1/4 oz",29574,"Sporting Goods|Water Sports|Wetsuits & Drysuits|Other Wetsuits & Drysuits",10,OK
365879950529,"Gear Aid Explorer Field Repair Kit Outdoor Camping Survival Emergency - Small",36120,"Sporting Goods|Camping & Hiking|Tents & Canopies|Tent & Canopy Accessories",14,OK
365879950530,"KidPlay Products Fingerlings Friendship at your Fingertips Secret Diary 7 Pieces",45112,"Business & Industrial|Office|Office Supplies|Calendars & Planners|Blank Diaries & Journals",13,OK
