item_id,title,category_id,category_path,aspect_count,status
127389932574,"10pc Sterile Surgical Grade Replacement Scalpel Blades Universal Fit - Size 11",104229,"Business & Industrial|Healthcare, Lab & Dental|Handpieces & Instruments|Scalpels, Surgical Blades & Handles",12,OK
127389932575,"Kidplokio Ultimate Fleet 50pc Multicolor Diecast Toy Cars Play Set for Boys 3+",180506,"Toys & Hobbies|Diecast & Toy Vehicles|Cars, Trucks & Vans|Contemporary Manufacture",21,OK
127389932576,"ToolTreaux Stainless Steel Heavy Duty Fabric Scissors Sewing Supplies, 12 Inch",28171,"Crafts|Sewing|Cutting Tools|Dressmaker's Scissors & Shears",15,OK
127389932577,"ASR Outdoor Green Self Coiling Bike Lock 2 Keys Bicycle Cable Lock 6 Feet Long",58100,"Sporting Goods|Cycling|Bicycle Accessories|Locks & Security",20,OK
127389932578,"Hello Kitty 4pc Plant Based Lip Balm Gift Set with Tin Girls Makeup Age 3 and Up",36870,"Health & Beauty|Skin Care|Lip Balm & Treatments",15,OK
127389932579,"ASR Outdoor Cold Weather 10 Hour Hand Warmer Pocket Camp Fire Survival Prepper",159183,"Sporting Goods|Winter Sports|Skiing, Snowboarding & Snowshoeing|Accessories|Hand & Foot Warmers",15,OK
127389932580,"Sunny Day Girls Faux Hair Extension Clip and Style with Snap Barrettes Gift Set",19172,"Toys & Hobbies|Preschool Toys & Pretend Play|Dress-Up, Costumes",11,OK
127389932581,"Universal Tool 276 Pc Rotary Tool Accessories Kit on Revolving Stand",260207,"Home & Garden|Tools & Workshop Equipment|Power Tool & Air Tool Accessories|Rotary Tool Accessories",21,OK
127389932582,"Baby Yoda Star Wars Mandalorian Bop Bag and Sticker Bundle Gift Set for Boys 3+",154,"Collectibles|Science Fiction & Horror|Star Wars Collectibles|Other Star Wars Collectibles",9,OK
127389932583,"Large Universal Car Emergency Hammer Window Punch Seat Belt Cutter Tool 2pk 4pk",20763,"Home & Garden|Tools & Workshop Equipment|Hand Tools|Hammers & Mallets",15,OK
127389932584,"Outdoor Cold Weather Hand Warmer Pocket Camp Fire Survival Prepper Lot of 20",27362,"Sporting Goods|Camping & Hiking|Clothing|Other Camping, Hiking Clothing",9,OK
127389932585,"ToolTreaux Carbon Steel Punch Set Leather Working Tools, 6pc",28133,"Crafts|Leathercrafts|Leathercraft Tools|Other Leather Tools",12,OK
127389932586,"Medical Lightweight Diagnostic Non Chill Single Head Stethoscope 30in Universal",183080,"Crafts|Art Supplies|Collage Supplies",9,OK
127389932587,"ASR Outdoor Tri Fold Steel Shovel Multi Functional Outdoor Use 23 Inch",75233,"Sporting Goods|Camping & Hiking|Camping Knives & Tools|Camping Shovels",22,OK
127389932589,"Set of 4 Non-Stick BBQ Grill Mats Reusable Easy to Clean",20725,"Home & Garden|Yard, Garden & Outdoor Living|Outdoor Heating, Cooking & Eating|Barbecue Tools",21,OK
127389932590,"24pk ASR Outdoor 3 1/4 Inch x 1 Inch Tarp Camping Secure Grip Awning Clamps",20761,"Home & Garden|Tools & Workshop Equipment|Hand Tools|Clamps & Vises",19,OK
236345137167,"GEAR AID Ni Glo, 2"" Glowing Keychain for Camping, SCUBA and Night Fishing Orange",181415,"Sporting Goods|Camping & Hiking|Outdoor Survival Gear|Other Outdoor Survival Gear",18,OK
236345137179,"ASR Outdoor 6 Inch Mini Gold Prospecting Sifting Pan 4 Holes Per Square Inch",8504,"Sporting Goods|Camping & Hiking|Other Camping & Hiking",13,OK
236345137181,"Kids Survival Outdoor Camping Multi Tool Whistle Compass LED 7 in 1 Flashlight",181415,"Sporting Goods|Camping & Hiking|Outdoor Survival Gear|Other Outdoor Survival Gear",21,OK
236345137183,"ToolTreaux 9 Inch Heavy Duty Revolving Leather Hole Punch Tool 2.0-4.5mm",183134,"Crafts|Leathercrafts|Leathercraft Tools|Hollow Punching Tools",14,OK
236345137184,"ASR Outdoor Emergency Poncho Green Polyethylene Rain Gear Camping One Size",181415,"Sporting Goods|Camping & Hiking|Outdoor Survival Gear|Other Outdoor Survival Gear",21,OK
236345137186,"ASR Outdoor Collectible Dagger Bowie Knife Etched Eagle Sheath Ergonomic Handle",73522,"Collectibles|Knives, Swords & Blades|Collectible Fixed Blade Knives|Modern Fixed Blade|Factory Manufactured",17,OK
236345137187,"ASR Outdoor 6mm Sling Shot Ball Bearings Steel 50 Piece Set",117141,"Sporting Goods|Outdoor Sports|Air Guns & Slingshots|Slingshots",14,OK
236345137188,"Vaseline Lip Therapy Rosy Lips .16oz Pink Tinted Lip Balm Pure Petroleum Jelly",36870,"Health & Beauty|Skin Care|Lip Balm & Treatments",21,OK
236345137189,"Beille Stainless Steel Black Knife Set Kitchen Utensils, 5pc",177005,"Home & Garden|Kitchen, Dining & Bar|Flatware, Knives & Cutlery|Kitchen & Steak Knives",21,OK
236345137191,"Kidplokio Assorted Truck Toys Action Figures Lights Sounds Playset (2 Themes)",180506,"Toys & Hobbies|Diecast & Toy Vehicles|Cars, Trucks & Vans|Contemporary Manufacture",17,OK
236345137192,"ASR Outdoor 6 Piece 6.5 Inch Ninja Kunai Set Assorted Colors With Sheath Set",73522,"Collectibles|Knives, Swords & Blades|Collectible Fixed Blade Knives|Modern Fixed Blade|Factory Manufactured",15,OK
236345137193,"Fresh Mint Dental Floss for Teeth and Gum Oral Care Remove Food and Plaque 3pk",159758,"Health & Beauty|Oral Care|Dental Floss & Flossers",14,OK
236345137194,"Kidplokio Fire Truck Firefighter Rescue Toy Pull Back Cars, Red, Boys Ages 3+",19074,"Toys & Hobbies|Electronic, Battery & Wind-Up|Friction|1970-Now",12,OK
236345137195,"4pk BLACK 10"" Gold Rush Gravity Trap Gold Pan - High Impact Flexible Plastic",15913,"Collectibles|Science & Medicine (1930-Now)|Mining|Equipment",5,OK
236345137196,"ToolTreaux Straight Blade Stainless Steel Stork Embroidery Scissors - 3.5 Inch",183191,"Crafts|Needlecrafts & Yarn|Embroidery & Cross Stitch|Hand Embroidery Tools & Accs|Embroidery Scissors",15,OK
236345137197,"Universal Tool Texturising Hammer Dual Face Square Stripe Patterns Wooden Handle",262020,"Jewelry & Watches|Jewelry Care, Design & Repair|Jewelry Tools & Workbenches",14,OK
236345137198,"Minnie Mouse BFF Complete Manicure Pediure Girls Fashion Nail Kit - 4pc",19172,"Toys & Hobbies|Preschool Toys & Pretend Play|Dress-Up, Costumes",13,OK
236345137199,"Beille 3pc Wheat Straw Spoons and Ladle Set Cooking Baking Kitchen Utensils",20649,"Home & Garden|Kitchen, Dining & Bar|Kitchen Tools & Gadgets|Cooking Utensils",19,OK
236345137201,"Universal Tool Antique Grandfather Brass Clock Key 4 Prongs - Even Numbers",261610,"Collectibles|Decorative Collectibles|Clocks|Other Clocks",25,OK
236345137202,"ASR Outdoor Survival Blanket Mylar Extreme Emergency Accessory Orange",181415,"Sporting Goods|Camping & Hiking|Outdoor Survival Gear|Other Outdoor Survival Gear",21,OK
236345137203,"4 Pack Universal Tool Tempered Steel Salon Hairdressing Barber Scissor 5.5 inch",101915,"Health & Beauty|Salon & Spa Equipment|Scissors & Shears",18,OK
236345137205,"ToolTreaux Stainless Steel Precision Tweezer Set Serrated Tips Secure Grip - 4pc",122718,"Crafts|Multi-Purpose Craft Supplies|Crafting Tools|Craft Tweezers",10,OK
236345137206,"ASR Outdoor 19L Griptape Backpack Dual Zip Two Tone Navy OD Green Travel Bag",181379,"Sporting Goods|Camping & Hiking|Hiking Backpacks|Backpacks",33,OK
236345137207,"(4 Pack) 8oz.Outdoor Camping Chrome Stainless Steel Pocket Hip Flask",63505,"Home & Garden|Kitchen, Dining & Bar|Bar Tools & Accessories|Flasks",20,OK
236345137210,"Dino Control Jurassic Rex RC Dinosaur Predator With Lights and Sounds - Green",84912,"Toys & Hobbies|Radio Control & Control Line|Remote-Controlled Toys",14,OK
236345137211,"ASR Outdoor 100 Lumen COB Collapsible Camping Lantern Black or Grey (2 Sizes)",168867,"Sporting Goods|Camping & Hiking|Flashlights, Lanterns & Lights|Lanterns",11,OK
236345137212,"Gear Aid Revivex Nubuck and Suede Footware Wash and Waterproofing Kit",27362,"Sporting Goods|Camping & Hiking|Clothing|Other Camping, Hiking Clothing",8,OK
236345137213,"Kidplokio 1:24 Scale Diecast 11pc Hot Rod Car Carrier Truck for Toy Race Cars",180506,"Toys & Hobbies|Diecast & Toy Vehicles|Cars, Trucks & Vans|Contemporary Manufacture",17,OK
236345137214,"Universal 8 inch 2 Sided Knife Blade Sharpening Stone for Home Improvement",43220,"Collectibles|Knives, Swords & Blades|Blade Parts, Supplies & Accs|Blade Sharpeners & Stones",8,OK
236345137216,"ToolTreaux Wooden Steel Handheld Garden Tools Set Rake Shovel Cultivator",118867,"Home & Garden|Yard, Garden & Outdoor Living|Garden Hand Tools & Equipment|Garden Tool Sets",19,OK
236345137218,"10pc Sterile Surgical Grade Replacement Scalpel Blades Universal Fit - Size 10",104229,"Business & Industrial|Healthcare, Lab & Dental|Handpieces & Instruments|Scalpels, Surgical Blades & Handles",12,OK
236345137219,"Kidplokio 8pc Urban City Fire Truck Friction Powered Toy Cars with Play Mat,",2646,"Toys & Hobbies|Preschool Toys & Pretend Play|Brio",13,OK
236345137220,"TychoTyke Toss and Catch Self Stick Paddle Game Set Orange",19017,"Toys & Hobbies|Outdoor Toys & Structures|Balls, Flying Discs & Boomerangs",12,OK
236345137221,"Home Essentials Nail Files Buffers Emery Boards Beauty Tools Set Mani Pedi 18pc",11872,"Health & Beauty|Nail Care, Manicure & Pedicure|Nail Care Tools|Manicure & Pedicure Tools & Kits",17,OK
236345137222,"Nannini Italy Quick 7.9 Lightweight Reading Glasses (Many Strengths and Colors)",67670,"Health & Beauty|Vision Care|Reading Glasses",17,OK
236345137223,"Toy Story 3 Kids School Supplies Study Set Notebook Pencil Sharpener Eraser 4pc",13844,"Collectibles|Disneyana|Contemporary (1968-Now)|Paper, Notepads",9,OK
236345137224,"12 Pack Universal Home and Office Utility Knife Knives",39057,"Home & Garden|Tools & Workshop Equipment|Hand Tools|Knives & Blades",18,OK
236345137225,"TychoTyke Construction and Rescue Tools Truck with Light and Sound Red",152934,"Toys & Hobbies|Diecast & Toy Vehicles|Construction Equipment|Contemporary Manufacture",19,OK
236345137226,"32 Sheet Disappearing Note Pad Dissolving Message Notebook Paper - Spy Journal",20164,"Business & Industrial|Office|Office Supplies|Paper Products|Note Pads",10,OK
236345137227,"Aluminum Colored Carabiner Key Chain Spring Clip Small Size Assorted Colors",50814,"Sporting Goods|Outdoor Sports|Climbing & Caving|Carabiners & Hardware",11,OK
236345137228,"ASR Tactical Full Tang Clip Point Blade Slim Kydex Sheath Hook Handle - Flag",179793,"Sporting Goods|Boxing, Martial Arts & MMA|Martial Arts Weapons|Knives",9,OK
236345137232,"ASR Outdoor Round Duffel Bag Adjustable Shoulder Strap Travel 16 Liter",52357,"Clothing, Shoes & Accessories|Men|Men's Accessories|Bags",23,OK
236345137233,"Beille Oak Wood Stainless Steel Barrel Classic Bakers Rolling Pin Baking 13"" 17""",32885,"Home & Garden|Kitchen, Dining & Bar|Baking Accs. & Cake Decorating|Rolling Pins",17,OK
236345137237,"(3 Pack) ASR Outdoor Emergency Glow Stick BOB High Visibility Safety Light",159091,"Sporting Goods|Camping & Hiking|Flashlights, Lanterns & Lights|Glow Sticks",16,OK
365879996375,"Nickelodeon Girls Jojo Siwa Comfortable Breathable Bandana Face Cover Protection",122321,"Clothing, Shoes & Accessories|Kids|Boys|Boys' Accessories|Scarves",19,OK
365879996381,"(2 Pack) Kids Indoor Golf Club Toddler Activity Pretend Play Set, Ages 3-8",19181,"Toys & Hobbies|Preschool Toys & Pretend Play|Other Preschool & Pretend Play",14,OK
365879996382,"ASR Outdoor Hawkbill Style Folding Knife Digital Camo Navy Blue Pocket Blade",42577,"Sporting Goods|Hunting|Knives & Tools|Folding Blade",20,OK
365879996383,"Universal Tool 6 in 1 Multi-head Nylon Hammer",75564,"Crafts|Multi-Purpose Craft Supplies|Other Multi-Purpose Crafting",11,OK
365879996385,"ToolTreaux Nylon Storage Tool Bag with Side Pockets Shoulder Strap 18 x 8.5 In",42362,"Home & Garden|Tools & Workshop Equipment|Tool Boxes & Storage|Tool Bags, Belts & Pouches",18,OK
365879996387,"ASR Outdoor 8"" Inch Black Dual Riffle Gold Panning Pan for Mining Prospecting",15913,"Collectibles|Science & Medicine (1930-Now)|Mining|Equipment",5,OK
365879996390,"ASR Outdoor 4 LED Adjustable Hiking Headlamp, Basic Campsite Essential",106984,"Sporting Goods|Camping & Hiking|Flashlights, Lanterns & Lights|Headlamps",21,OK
365879996391,"Universal Tool 30ft Roll Gray Duct Tape 2 Inch Wide High Quality Adhesive Gear",183125,"Crafts|Multi-Purpose Craft Supplies|Adhesives & Tape|Other Adhesives & Tape",11,OK
365879996392,"ToolTreaux 14k Gold Testing Kit, 7pc",262020,"Jewelry & Watches|Jewelry Care, Design & Repair|Jewelry Tools & Workbenches",14,OK
365879996393,"Star Wars Bump N Go D-O with Authentic Voice Kids Plush Toy Action Figure Doll",261068,"Toys & Hobbies|Action Figures & Accessories|Action Figures",33,OK
365879996394,"ToolTreaux 10x Aluminum Jewelers Loupe 22mm Diameter Glass Lens Magnifier",262020,"Jewelry & Watches|Jewelry Care, Design & Repair|Jewelry Tools & Workbenches",14,OK
365879996395,"ASR Outdoor 5in Plastic Heavy Duty Gold Snifter Bottle w/ Nozzle (Various Packs)",15913,"Collectibles|Science & Medicine (1930-Now)|Mining|Equipment",5,OK
365879996397,"SE JT114RS 10"" Aluminum Ring Stick",262020,"Jewelry & Watches|Jewelry Care, Design & Repair|Jewelry Tools & Workbenches",15,OK
365879996399,"Universal Tool Texturising Hammer Dual Face Dimple Stripe Patterns Wooden Handle",262020,"Jewelry & Watches|Jewelry Care, Design & Repair|Jewelry Tools & Workbenches",14,OK
365879996401,"Universal Home Black Stainless Steel Kitchen Knives Set 5 Knife Types 5 Piece",177005,"Home & Garden|Kitchen, Dining & Bar|Flatware, Knives & Cutlery|Kitchen & Steak Knives",19,OK
365879996403,"ToolTreaux Nylon Storage Tool Bag with Side Pockets and Shoulder Strap 15 x 9 In",42362,"Home & Garden|Tools & Workshop Equipment|Tool Boxes & Storage|Tool Bags, Belts & Pouches",18,OK
365879996405,"Marvel Spiderman 18pc Cinch Bag Drawstring Backpack Stickers Toys Gift Bundle",260988,"Clothing, Shoes & Accessories|Kids|Backpacks & Bags",28,OK
365879996408,"ASR Tactical 6pk Mini LED Stick On Lights, Battery Operated Magnetic Mount",16037,"Sporting Goods|Camping & Hiking|Flashlights, Lanterns & Lights|Flashlights",19,OK
365879996410,"5/32"" Chain Saw Diamond Sharpening Burr 1/8"" Shank ASR Outdoor",43220,"Collectibles|Knives, Swords & Blades|Blade Parts, Supplies & Accs|Blade Sharpeners & Stones",9,OK
365879996412,"ASR Outdoor 100 Pack Black Stretch Cord with Black Ball 6 Inch Length",85917,"Home & Garden|Tools & Workshop Equipment|Workshop Equipment|Tie Downs & Straps",20,OK
365879996413,"ToolTreaux Stainless Steel Scissors 5.5 Inch Straight Blade Blunt Point Edge",183191,"Crafts|Needlecrafts & Yarn|Embroidery & Cross Stitch|Hand Embroidery Tools & Accs|Embroidery Scissors",15,OK
365879996414,"Beille Black BBQ Grill Accessories Reusable Non Stick Grilling Mats 13x15"" 2pk",20725,"Home & Garden|Yard, Garden & Outdoor Living|Outdoor Heating, Cooking & Eating|Barbecue Tools",25,OK
365879996419,"Galvanized Non-Rust Tent Peg Stake with Green Stopper 25pk",36120,"Sporting Goods|Camping & Hiking|Tents & Canopies|Tent & Canopy Accessories",18,OK
365879996421,"ASR Outdoor Compact Rope Gun Cleaning Tool (4 Caliber Sizes)",22700,"Sporting Goods|Hunting|Gun Smithing & Maintenance|Cleaning Supplies",17,OK
365879996423,"ToolTreaux Diamond Coated Cutting Burrs Set Assorted Rotary Tools 12pc 150 Grit",260207,"Home & Garden|Tools & Workshop Equipment|Power Tool & Air Tool Accessories|Rotary Tool Accessories",21,OK
365879996424,"ASR Tactical Double Edge Full Tang Spear Point Blade Hook Handle Sheath - Flag",179793,"Sporting Goods|Boxing, Martial Arts & MMA|Martial Arts Weapons|Knives",9,OK
365879996425,"Disney Pixar Toy Story 4 Art Lapdesk Paint Color Design Stickers Travel Activity",134569,"Crafts|Kids' Crafts|Drawing & Painting|Paint Sets",9,OK
365879996432,"ASR Outdoor Wilderness Adventure Performance Comfort Hiking Sock (8 Styles)",181362,"Sporting Goods|Camping & Hiking|Clothing|Men's|Socks",12,OK
365879996433,"Universal Full Tang Spiked Axe Tomahawk Wooden Handle Ultra Lightweight Tactical",75234,"Sporting Goods|Camping & Hiking|Camping Knives & Tools|Camping Hatchets & Axes",21,OK
365879996435,"Universal Tool Antique Grandfather Brass Clock Key 4 Prongs - Odd Numbers",261610,"Collectibles|Decorative Collectibles|Clocks|Other Clocks",25,OK
127389946569,"ASR Outdoor 200 Lumen LED Camping Backpacking Running Cap Light (3 Colors)",106984,"Sporting Goods|Camping & Hiking|Flashlights, Lanterns & Lights|Headlamps",18,OK
127389946571,"5 Pack Dove Shea Butter Beauty Cream Moisturizing Bar Soap with Vanilla 3.75oz",180924,"Health & Beauty|Bath & Body|Body Soaps",20,OK
127389946574,"ASR Outdoor Pocket Sport Belt for Running Jogging Travel Fanny Pack Black",98968,"Travel|Travel Accessories|Money Belts & Wallets",8,OK
236345146194,"ASR Outdoor 7pc Kids Gold Panning Kit Beginner Equipment with Paydirt - Green",15913,"Collectibles|Science & Medicine (1930-Now)|Mining|Equipment",5,OK
365880019095,"Kidplokio Camo Rescue Mission Toy Blaster with Lights Sounds Boys Ages 3 and Up",158749,"Toys & Hobbies|Outdoor Toys & Structures|Dart Guns & Soft Darts",13,OK
365880019096,"ASR Outdoor Gold Sluice Box Folding Aluminum Portable Gold Prospecting, 50 Inch",15913,"Collectibles|Science & Medicine (1930-Now)|Mining|Equipment",6,OK
127389946575,"ASR Outdoor Gold Rush Gold Prospecting Kit Classifiers Vials Sifting Pans - 11pc",15913,"Collectibles|Science & Medicine (1930-Now)|Mining|Equipment",5,OK
127389946576,"Universal Hobby Specialty 7pc Professional Jewelry Hammer Tool Set with Display",262020,"Jewelry & Watches|Jewelry Care, Design & Repair|Jewelry Tools & Workbenches",15,OK
127389946577,"ASR Outdoor Braided Technora 950lb Survival Cord Rope - Natural (Many Lengths)",181413,"Sporting Goods|Camping & Hiking|Outdoor Survival Gear|Paracord & Paracord Supplies",18,OK
127389946578,"Gear Aid ReviveX Spray On Waterproofing Footware Protection Outdoor Rec - 4 oz",8504,"Sporting Goods|Camping & Hiking|Other Camping & Hiking",10,OK
127389946579,"Heavy Duty Mylar Emergency Sleeping Bag Outdoor Camping Survival Shelter",181415,"Sporting Goods|Camping & Hiking|Outdoor Survival Gear|Other Outdoor Survival Gear",21,OK
127389946581,"PIC Fly Traps Glue Attracts and Traps Flying Insects No Mess No Vapors - 2 Pack",183808,"Business & Industrial|Cleaning & Janitorial Supplies|Pest Control Supplies|Pest Trap Parts & Accessories|Pest Trap Sticky Paper",10,OK
127389946586,"ASR Outdoor Sluice Box Gold Prospecting Kit Pan Vial Snifter Trowel Tweezer 7pc",15913,"Collectibles|Science & Medicine (1930-Now)|Mining|Equipment",5,OK
236345146195,"ASR Outdoor Large Translucent Waterproof Camping Storage Container -  5.5 Inch",181390,"Sporting Goods|Camping & Hiking|Camping Storage",22,OK
236345146196,"ASR Outdoor Multifunctional EDC Small Pocket Knife Multi Tool (5 Colors)",75236,"Sporting Goods|Camping & Hiking|Camping Knives & Tools|Multi-Tools",21,OK
236345146197,"ASR Outdoor 6"" Inch Mini Gold Panning Classifier Sift 20 Holes per Square Inch",15913,"Collectibles|Science & Medicine (1930-Now)|Mining|Equipment",7,OK
236345146198,"Lot of 5 14"" Green Gold Pans w/ Gold Snuffer Bottle Panning Kit Mining Backpack",15913,"Collectibles|Science & Medicine (1930-Now)|Mining|Equipment",5,OK
236345146199,"ASR Outdoor TraversaLace 550 Paracord Survival Laces for Shoes and Hiking Boots",169282,"Clothing, Shoes & Accessories|Specialty|Clothing & Shoe Care|Shoe Care & Repair|Shoe Laces",12,OK
236345146200,"ASR Outdoor Stainless Steel Wire Hand Saw Camping Gear Hiking Blade - 24 Inch",75237,"Sporting Goods|Camping & Hiking|Camping Knives & Tools|Camping Saws",19,OK
236345146202,"Wetsuit Drysuit Shampoo Cleaner for Marine Scuba Dive Gear - 10oz",159151,"Sporting Goods|Water Sports|Other Water Sports",8,OK
365880019097,"Freesole Shoe and Boot Repair Adhesive",36120,"Sporting Goods|Camping & Hiking|Tents & Canopies|Tent & Canopy Accessories",16,OK
365880019098,"ASR Outdoor Metal Detector Sand Scoop w/ Probe, Hand Trowel for Treasure Hunting",163824,"Business & Industrial|Test, Measurement & Inspection|Test Meters & Detectors|Metal Detector Accessories",12,OK
365880019099,"ASR Outdoor - Wrist Brace Slingshot with Adjustable Iron Frame - Ammo Included",27363,"Sporting Goods|Camping & Hiking|Hiking Gear|Other Hiking Gear",9,OK
365880019102,"ASR Outdoor 36 or 48 Hour Survival Candle for Camping Emergency Fire Starter",168867,"Sporting Goods|Camping & Hiking|Flashlights, Lanterns & Lights|Lanterns",19,OK
127389969219,"Foam Kneeling Pad and Hand Trowel Shovel Outdoor Home Garden Combo Set",75669,"Home & Garden|Yard, Garden & Outdoor Living|Garden Clothing & Protective Gear|Garden Kneelers, Cushions & Seats",24,OK
127389969220,"Bald Eagle Dagger 3pc American Flag Knife Collector Set",73522,"Collectibles|Knives, Swords & Blades|Collectible Fixed Blade Knives|Modern Fixed Blade|Factory Manufactured",18,OK
127389969224,"Kids Jumbo 1:66 Scale Formula Max Toy Race Car, Pull Back Car, Red, Boys Ages 3+",19074,"Toys & Hobbies|Electronic, Battery & Wind-Up|Friction|1970-Now",11,OK
127389969226,"ToolTreaux Assorted Abrasive Stone Burrs with Mandrels High Speed Sanding 100pc",260207,"Home & Garden|Tools & Workshop Equipment|Power Tool & Air Tool Accessories|Rotary Tool Accessories",21,OK
127389969229,"6 Pack Utility Knives Home and Office Razor Blades",39057,"Home & Garden|Tools & Workshop Equipment|Hand Tools|Knives & Blades",18,OK
127389969233,"200ft High Visibility Marking Ribbon - Red",8504,"Sporting Goods|Camping & Hiking|Other Camping & Hiking",10,OK
127389969234,"ASR Outdoor Foldable Portable Clear Camping Collapsible Water Storage Bag 16.9oz",181409,"Sporting Goods|Camping & Hiking|Water Bottles & Hydration|Water Carriers",19,OK
127389969236,"24 Piece set ASR Outdoor Gun Cleaning Kit Brass Punches Brushes and Patches",22700,"Sporting Goods|Hunting|Gun Smithing & Maintenance|Cleaning Supplies",21,OK
127389969237,"Universal Tool Ice Tempered S Steel Salon Hairdressing Barber Scissor 6.5 inch",101915,"Health & Beauty|Salon & Spa Equipment|Scissors & Shears",18,OK
127389969238,"ASR Outdoor 5 Piece Gun Cleaning Brush And Pick Set",22700,"Sporting Goods|Hunting|Gun Smithing & Maintenance|Cleaning Supplies",20,OK
127389969239,"ToolTreaux 16oz Texturizing Dual Face Jewelry Hammer Wooden Handle 10.25 Inch",183133,"Crafts|Leathercrafts|Leathercraft Tools|Hammer & Mallets",11,OK
127389969242,"Disney Minnie Mouse Purple Blue Faux Hair Braid Ponytail Extension with Pink Bow",19172,"Toys & Hobbies|Preschool Toys & Pretend Play|Dress-Up, Costumes",13,OK
236345160651,"Diamond Coated Tool Hole Saw Universal Drill Bit Rotary 80 Grit 6 pack",260207,"Home & Garden|Tools & Workshop Equipment|Power Tool & Air Tool Accessories|Rotary Tool Accessories",19,OK
236345160652,"Beille Rubber 4 in 1 Non Slip Multipurpose Adjustable Easy Grip Jar Opener Tool",20688,"Home & Garden|Kitchen, Dining & Bar|Bar Tools & Accessories|Corkscrews & Openers",17,OK
236345160655,"ASR Outdoor Thumb Assisted Folding Knife Belt Clip Seat Belt Cutter Window Punch",48818,"Collectibles|Knives, Swords & Blades|Collectible Folding Knives|Modern Folding Knives|Factory Manufactured",19,OK
236345160656,"ASR Outdoor 4 in 1 350 Lumen Multi Color Tilting Head Lamp Camping Garden Hiking",106984,"Sporting Goods|Camping & Hiking|Flashlights, Lanterns & Lights|Headlamps",21,OK
236345160657,"10 Pack Universal Fit Standard Issue Law Enforcement Standard Handcuff Key",39665,"Collectibles|Historical Memorabilia|Police|Handcuffs & Keys",7,OK
236345160659,"ToolTreaux Woodcarving Chisel Set Professional Craft and Hobby Tools - 12 Pieces",13871,"Collectibles|Tools, Hardware & Locks|Tools|Carpentry, Woodworking|Chisels",6,OK
236345160660,"Productive Fitness Resistance Tubing Workout Training Poster Series Home Use",28009,"Art|Art Posters",26,OK
236345160661,"Universal Tool Ice Tempered S Steel Salon Hairdressing Barber Scissor 7.5 inch",101915,"Health & Beauty|Salon & Spa Equipment|Scissors & Shears",18,OK
236345160662,"ASR Outdoor Brass Body Nickel Plated Pull Apart Key Ring Travel Accessory",52373,"Clothing, Shoes & Accessories|Men|Men's Accessories|Key Chains, Rings & Cases",16,OK
236345160663,"ASR Outdoor (4-Pack) Camping Utensil 3pc Set of Military MRE Camping Accessories",87133,"Sporting Goods|Camping & Hiking|Camping Cooking Supplies|Camping Cooking Utensils",21,OK
236345160666,"Universal Hobby Number and Letter Stamping Set Automatic Punch Crafts 38 Pieces",16507,"Crafts|Stamping & Embossing|Tools & Equipment",9,OK
236345160667,"ASR Outdoor Camping Pocket Knife Spring Assisted Serrated Tanto Blade Orange",48818,"Collectibles|Knives, Swords & Blades|Collectible Folding Knives|Modern Folding Knives|Factory Manufactured",19,OK
236345160668,"ASR Outdoor Paracord Bracelet Side Release Buckle Multipack Set 15mm 20mm",181413,"Sporting Goods|Camping & Hiking|Outdoor Survival Gear|Paracord & Paracord Supplies",18,OK
365880042741,"Universal Tool Heavy Duty Camp Axe Hatchet with Sheath Buckshot - Survival Prep",75234,"Sporting Goods|Camping & Hiking|Camping Knives & Tools|Camping Hatchets & Axes",20,OK
365880042745,"ASR Outdoor Snapatite 4 in 1 Utensil Set Lightweight Pocket-sized Cutlery 4pc",87133,"Sporting Goods|Camping & Hiking|Camping Cooking Supplies|Camping Cooking Utensils",21,OK
365880042746,"Safety Goggles Eye Protection",67019,"Business & Industrial|Facility Maintenance & Safety|Personal Protective Equipment (PPE)|Safety Glasses & Goggles",11,OK
365880042748,"ToolTreaux 10X Jewelers Loupe 25mm Diameter Glass Lens Magnifier Plastic",262020,"Jewelry & Watches|Jewelry Care, Design & Repair|Jewelry Tools & Workbenches",14,OK
365880042750,"ToolTreaux Deluxe Hobby Craft DIY Vinyl Cutting Kit with Self Healing Mat Clamps",183175,"Crafts|Multi-Purpose Craft Supplies|Crafting Tools|Cutting Tools|Cutting Mats",10,OK
365880042752,"ASR Outdoor 7/32"" Chain Saw Diamond Sharpening Burr 1/8"" Shank 120 Grit",43220,"Collectibles|Knives, Swords & Blades|Blade Parts, Supplies & Accs|Blade Sharpeners & Stones",9,OK
365880042756,"ASR Outdoor Mini EDC Small Pocket Knife Multi Tool - LOGO Green",75236,"Sporting Goods|Camping & Hiking|Camping Knives & Tools|Multi-Tools",22,OK
