"sku","parent.sku","character_ebay","handle_material_ebay","age_group","style_ebay","blade_edge_type_amazon","recommended_age_range","voltage_ebay","dexterity_walmart","power_source","blade_length_ebay","care_instructions_amazon","occasion","capacity","blade_material_ebay","ingredients_amazon","battery_technology_ebay","fill_material_type_amazon","sport_type_amazon","fragrance","fabric_type_amazon","formulation","frame_material","name"
"SON-STEELDIGGER-GRN","","","","Adult","","","","","","","","","","","","","","","","","","","","ASR Outdoor 13"" Gold Rush Prospectors Trowel Pay Dirt Steel Edge Digger"
"MCN-WILDERNESSTRAVELGUIDE","","","","","","","","","","","","","","","","","","","","","","","","Wilderness Travel Medicine Emergency Guide"
"4SN-BEAUTYTOOLKIT-9PC-BUN","4SN-BEAUTYTOOLKIT-PARENT","","","","","","","","","","","","","","","","","","","","","","","ToolTreaux Beauty Tool Kit Nail Clipper Brush Eyelash Curler Pore Cleaner - 9pc"
"4SN-BLACKKNIFESET-4PC","","","","","","straight_edged","","","","","","","","","","","","","","","","","","Beille 5 Piece Home Ergonomic Kitchen Knives Set, 5 Knife Essential Bundle"
"4SN-CALLUSREMOV-BLU-42121","","","","Adult","","","","","","","","","","","","","","","","","","","","Home Essentials Manicure Pedicure Foot Scrubber Foot File Callus Remover - Blue"
"4SN-FINGERLINGS-DIARY-10408","","","","","","","","","","","","","","","","","","","","","","","","KidPlay Products Fingerlings Friendship at your Fingertips Secret Diary 7 Pieces"
"4SN-JOJOTOOTHBRUSH-CAP","","","","","","","","","","","","","","","","","","","","","","","","JoJo Siwa Brush Buddies Kids Toothbrush Ultra Soft Bristles with Plastic Cap"
"SON-DSSWCCPASSWC-625X25-SLVR","","","","Adult","","","","","","","","","","","","","","","","","","","","Dual Sided 12pc Wax Clay Carving Pick Spatula Tool Set with Case Arts and Crafts"
"SON-SSSWCTS-7PC","SON-SSDESWCT-PARENT","","","","","","","","","","","","","","","","","","","","","","","Universal Tool Spatula Wax Carver Ceramic Pottery Double Ended Tool Set, 7pc"
"ASR-ASROUTDOORBLACKSTRETCH","ASR-AOBSCWBB-PARENT","","","Adult","","","","","","","","","","","","","","","","","","","","ASR Outdoor Black Stretch Shock Cord Plastic Ball Utility Cord Camping Tool 100pk"
"ASR-ASROUTDOORGREENGLOW","","","","Adult","","","","","","","","","","","","","","","","","","","","(3 Pack) ASR Outdoor Emergency Glow Stick BOB High Visibility Safety Light"
"ASR-BFTOU-BUN-3PK-STD-SLVR","","","","Adult","","","","","","","","","","","","","","","","","","","","(3 Pack) ASR Outdoor Extendable Marshmallow Toaster Telescoping BBQ Fork Utensil"
"ASR-EDACS-BUN-3PC-MED-BNDL","","","","Adult","","","","","","","Over 5in.","","","","Stainless Steel","","","","","","","","","Bald Eagle Dagger 3pc American Flag Knife Collector Set"
"ASR-ETB84X-BUN-24PK-84X52-SLVR","","","","Adult","","","","","","","","","","","","","","","","","","","","ASR Outdoor Emergency Mylar Outdoor Blanket Insulated Thermal Reflector, 24pk"
"SON-B14GRGTGP-14-BLCK","","","","Adult","","","","","","","","","","","","","","","","","","","","Gold Rush Gravity Trap Gold Pan High Impact Flexible Plastic - BLACK 14 inch"
"SON-AOMDBWSB-17X125-BLCK","","","","Adult","","","","","","","","","","","","","","","","","","","","ASR Outdoor Black Drawstring Backpack Gym Bag Hiking Gear, 20 x 16 Inches"
"SON-AO125IGPSSFGP-LG-GRN","SON-SANDSCOOPER-PARENT","","","","","","","","","","","","","","","","","","","","","","","ASR Outdoor 12.5 Inch Large Sand Scoop Plastic Trowel for Metal Detector Gold Panning, Green"
"SON-MAGNIFYINGTWEEZER-1PK","","","","Adult","","","","","","","","","","","","","","","","","","","","ASR Outdoor Gold Rush Gold Panning 4x Magnification Magnifying Tweezers"
"SON-MSPT-8LBS","","","","Adult","","","","","","","","","","","","","","","","","","","","ASR Outdoor Gold Panning Portable Compact 8lb Magnetic Pickup Tool with Quick Release Rubber Handle - Black"
"SON-POCKETSLUICEBOX-GRN","","","","Adult","","","","","","","","","","","","","","","","","","","","ASR Outdoor Pocket Mini Sluice Box for Gold Panning 3 Riffle TPR Rubber Groove Mat, 12"""
"SON-AO8IBGRGTGP-8-BLCK1","SON-GOLDMININGPAN-PARENT","","","","","","","","","","","","","","","","","","","","","","","ASR Outdoor 8 inch Gold Pan with Dual Riffles for Gold Prospecting, Black"
"SON-G10GRGTGP-10-GRN","SON-10GOLDRUSHPAN-PARENT","","","","","","","","","","","","","","","","","","","","","","","Green 10"" Gold Rush Gravity Trap Gold Pan - High Impact Flexible Plastic"
"SON-ADTMGBKC-SML-ASSRTD","","","","Adult","","","","","","","","","","","","","","","","","","","","Aluminum Dog Tags Engraveable Blank Key Chains Military Identification - 1 pc"
"SON-GRCSS10HPSI-6-GRN","SON-GRC-PAN-PARENT-2","","","","","","","","","","","","","","","","","","","","","","","Gold Rush Sifting Classifier Sieve Mini 6 Inch Prospect Pan 10 Holes per Sq Inch"
"SON-GRCSS20HPSI-6-GRN","SON-GRC-PAN-PARENT-2","","","","","","","","","","","","","","","","","","","","","","","Gold Rush Sifting Classifier Sieve Mini 6 Inch Prospect Pan 20 Holes per Sq Inch"
"SON-GRCSS50HPSI-50HPS-GRN2","SON-GRC-PAN-PARENT-2","","","","","","","","","","","","","","","","","","","","","","","Gold Rush Sifting Classifier Sieve Mini 6 Inch Prospect Pan 50 Holes Per Sq Inch"
"SON-GRCSS100HPSI-6-GRN","SON-GRC-PAN-PARENT-2","","","","","","","","","","","","","","","","","","","","","","","ASR Outdoor Gold Rush Sifting Classifier Sieve 6 Inch Prospect Pan 100 Holes per Sq Inch"
"SON-20OZERPMH-STD","","","","Adult","","","","","","","","","","","","","","","","","","","","ASR Outdoor Gold Prospecting Geology Rock Pick Mining Hammer, 20oz Pointed Tip"
"SON-AOPMTSFGP-SML-GRY","","","","Adult","","","","","","","","","","","","","","","","","","","","ASR Outdoor 2 Inch Precious Metal Testing Stone for Gold Panning"
"SON-BFTOU-MED-BLCK","","","","Adult","","","","","","","","","","","","","","","","","","","","ASR Outdoor BBQ Fork Telescoping 2 Prong Cooking Utensil - Camping Accessories"
"SON-AO40LWRDS","","","","Adult","","","","","","","","","","","","","","","","","","","","ASR Outdoor Ultimate Dry Sack 40L PVC Water Resistant 9 Inch Diamater"
"SON-16FTHVMRNG-16F-NNGRN","SON-MARKINGRIBBON-PARENT","","","","","","","","","","","","","","","","","","","","","","","ASR Outdoor Hiking Gear 200ft High Visibility Marking Ribbon, Neon Green"
"ASR-GRIPREDKEEPSPORTING","CARABINER-JUMBO-PARENT","","","","","","","","","","","","","","","","","","","","","","","(2 Pack) ASR Outdoor Jumbo 6.5 Inch XL Key Chain Hand Grip Black and Silver"
"ASR-MEDIUMSIZECARABINERSKEEP","","","","","","","","","","","","","","","","","","","","","","","","Aluminum Colored Carabiner Key Chain Spring Clip Medium Size Assorted Colors 6pk"
"SON-UFDSVHVO-29-ORNG","","","","Adult","","","","","","","","","","","","","","","","","","","","Universal Safety Disposable Vest High Visibility One Size Fits Most Orange"
"SON-AOBCP-SML-RD","","","","Adult","","","","","","","","","","","","","","","","","","","","Metal Detector Brass Coin Probe"
"ASR-SO4BGMN-BUN-2PC-2PK-LG-BLCK","","","","Adult","","","","","","","","","","","","","","","","","","","","Set of 4 Non-Stick BBQ Grill Mats Reusable Easy to Clean"
"SON-AOUFSVLG-ONE-GRN","","","","Adult","","","","","","","","","","","","","","","","","","","","ASR Federal Universal Fit Safety Vest High Visibility Lime Green Reflective"
"SON-BGMN-LG-BLCK","","","","","","","","","","","","","","","","","","","","","","","","BBQ Grill Mat Non-Stick Heavy Duty Outdoor Patio Eating and Cooking Tools - 2Pk"
"SON-7IN1SURVIVALWHISTLE-ODGRN","SON-7IN1SURVIVALWHISTLE-PARENT","","","","","","","","","","","","","","","","","","","","","","","7 in 1 Survival Whistle Multi-Case with LED Flashlight Compass Mirror - Green"
"SON-3IN1CUSKFS-3PC-ONE-SLVR","","","","Adult","","","","","","","","","","","","","","","","","","","","ASR Outdoor 3pc Camping Utensil Set Military Ration Knife Fork Spoon Accessories"
"CARABINER-JUMBO-BLACK","CARABINER-JUMBO-PARENT","","","","","","","","","","","","","","","","","","","","","","","ASR Outdoor 6.5 Inch Jumbo Aluminum Carabiner Hiking Cushion Grip - Black"
"CARABINER-JUMBO-BLUE","CARABINER-JUMBO-PARENT","","","","","","","","","","","","","","","","","","","","","","","ASR Outdoor 6.5 Inch Jumbo Aluminum Carabiner Hiking Cushion Grip - Blue"
"CARABINER-JUMBO-GREEN","CARABINER-JUMBO-PARENT","","","","","","","","","","","","","","","","","","","","","","","ASR Outdoor 6.5 Inch Jumbo Aluminum Carabiner Hiking Cushion Grip - Green"
"CARABINER-JUMBO-PINK","CARABINER-JUMBO-PARENT","","","Adult","","","","","","","","","","","","","","","","","","","","ASR Outdoor 6.5 Inch Jumbo Aluminum Carabiner Hiking Cushion Grip - Pink"
"CARABINER-JUMBO-SILVER","CARABINER-JUMBO-PARENT","","","Adult","","","","","","","","","","","","","","","","","","","","ASR Outdoor 6.5 Inch Jumbo Aluminum Carabiner Hiking Cushion Grip - Silver"
"CHAINSAW-SHARPENING-BURR-3-16","","","","Adult","","","","","","","","","","","","","","","","","","","","3/16"" File Chain Saw Blade Diamond Sharpening Burr Shank 120 Grit"
"COLLAPSIBLE-WATER-CARRIER-5-GALLON","","","","Adult","","","","","","","","","","","","","","","","","","","","ASR Outdoor Collapsible Water Carrier with Handle 5 Gallon Hiking Camping"
"SON-J65XCKCWHGP-XL-PURPLE","","","","Adult","","","","","","","","","","","","","","","","","","","","Jumbo 6.5"" XL Carabiner Key Chain  - Purple"
"SON-ABSAS-15PC-A-BLCK","","","","","","","","","","","","","","","","","","","","","","","","ToolTreaux Artist Paint Brushes Natural Hair Bristles Wooden Grip Assorted 15pc"
"SON-CEGRKCFFAKOG-11PC-SML-CLR","","","","Adult","","","","","","","","","","","","","","","","","","","","Universal Compact Eye Glasses Repair Kit with Screwdriver, 11pc"
"SON-SGSURSB-10PC-11-MTL","","","","Adult","","","","","","","","","","","","","","","","","","","","10pc Sterile Surgical Grade Replacement Scalpel Blades Universal Fit - Size 11"
"SON-WBSTAS-28PC-28PC-BRNZ","","","","Adult","","","","","","","","","","","","","","","","","","","","28pc Wood Burning Wood Working and Assorted Soldering Tips Stencil Set Crafting"
"SON-PHWWKS-16PC-STD-BL","","","","Adult","","","","","","","","","","","","","","","","","","","","Hobby Knife Precision Set 16pc Exacto Blades Cutting Sculpting Craft Hobby DIY"
"SON-JEL14XMFPHCP-14X-BLCK","","","","Adult","","","","","","","","","","","","","","","","","","","","Jewelers Eye Loupe 14X Magnification for Precision Hobby Arts and Craft Projects"
"MCN-SCNRKFDGWPAB-2OZ-BLCK","","","","Adult","","","","","","","","","","","","","","","","","","","","GEAR AID Aquaseal NEO Contact Cement for Neoprene and Wetsuit Repair, 1.5 fl oz"
"SON-HDLHPS-6PC-C-SLVR","","","","Adult","","","","","","","","","","","","","","","","","","","","6pc Universal Heavy Duty Leather Hollow Punch Set"
"SON-CKK12ITSHSR-12E-SLVR","","","","Adult","","","","","","","","","","","","","","","","","","","","Beille 12 Inch Steel Sharpening Rod for Knives Knife Sharpeners Kitchen Gadgets"
"SON-ESSBL-LG-SLVR","","","","Adult","","","","","","","","","","","","","","","","","","","","Emergency Sleeping Bag Mylar Insulated Heat Light Weight 84x36 Inch"
"SON-DHCSDBS-6PC","","","","Adult","","","","","","","","","","","","","","","","","","","","6pc Diamond Drill Bit Hole Saw Set Core 5/32 - 1/2"" Tile Glass Marble"
"DEL-EXFOLBATHMITT-WHITE","","","","","","","","","","","","","","","","","","","","","","","","Universal Home Soothing Exfoliating Bath Mitt Shower Accessory - White"
"SON-15IFSCFNP-15-ORNG","","","","","","","","","","","","","","","","","","","","","","","","Heavy Duty Flat Nail Puller Forged Steel Cats Paw Carpenters 15 Inches"
"UPD-MICKEY-JUMP-ROPE","UPD-DELUXEJUMPROPE-PARENT","","","","","","","","","","","","","","","","","","","","","","","Disney Mickey Mouse Roadster Racers Jump Rope Kids Exercise Toy"
"DLX-NAILFILES-18PC","","","","","","","","","","","","","","","","","","","","","","","","Home Essentials Nail Files Buffers Emery Boards Beauty Tools Set Mani Pedi 18pc"
"SON-SAFETYGOGGLES","","","","Adult","","","","","","","","","","","","","","plastic","","","","","","Safety Goggles Eye Protection"
"SHM-UV9LF-SML-BLCK","","","","Adult","","","","","","","","","","","","","","","","","","","","ASR Federal 51 LED UV Black Light 395nm Dual Mode Flashlight 6 Inch"
"HWK-MYLAR-BLANKET","","","","Adult","","","","","","","","","","","","","","","","","","","","ASR Outdoor First Aid Bug Out Emergency Light Mylar Foil Space Blanket"
"DOY-WILD-ANIMAL-DAGGER-SET-BNDLE","","","","Adult","","","","","","","Over 5in.","","","","Stainless Steel","","","","","","","","","3pc Animal Head Fixed Blade Ornamental Dagger Collector Knife Decorative Gift Set, Wolf Eagle and Dragon"
"FLL-HNHSTBAT","","","","","","","","","","","","","","","","","","","","","","","","Flatline Ops Nylon Hanging Strap Bag Attachment Snap Hook (Tan)"
"SON-DHDCUT-2PC-4-SLVR","","","","Adult","","","","","","manual","","","","","","","","","","","","","","7 Function Small Pocket Camping Utensil Flatware, Spoon Fork Knife"
"SON-SFKFHSS-P-GRY","","","","Adult","","","","","","","","","","","","","","","","","","","","Small Field Knife Pocket Fishing Tackle Box Grooved Angle Sharpening Stone"
"SON-HACBPCMTS-8PC","","","","Adult","","","","","","","","","","","","","","","","","","","","8pc Basic Pottery Kit Clay Molding Hobby Arts and Craft Tool Set for Beginners"
"SON-35ISTSSSTS-35-SLVR","","","","Adult","","","","","","","","","","","","","","","","","","","","Stainless Steel Tailors Stork Craft Scissors Straight Sharp Tip, 3.5 inch"
"ZKT-TKRHBCCFZ-SML-BLCK","","","","Adult","","","","","","","","","","","","","","","","","","","","Tactical Keyring Holder Belt Connector Clip ZT55"
"HAWK-SLFHEALMAT-GR","HAWK-SLFHEALMAT-PARENT","","","","","","","","","","","","","","","","","","","","","","","ToolTreaux DIY Craft Self Healing Cutting Mat Art Supply Tool 5 x 9 Inch - Green"
"SON-5FT60IRTSMT","","","","Adult","","","","","","","","","","","","","","","","","","","","Retractable Sewing Tape Measure 60 inch Tailor Seamstress for Arts and Crafts"
"HWK-TBPHDPSLFHAN-9P-PNK","","","","Adult","","","","","","","","","","","","","","","","","","","","9 Pocket Tool Belt Heavy Duty Suede Leather For Hammer Nails, Pink Toolbelt"
"KOL-BARBIE-STAR-EARRINGS-PC316","","","","Child","","","","","","","","","","","","","","","","","","","","Girls Gold Star Bundle Set with Barbie Dangle Earrings Dress Up"
"KOL-FRUITVEGGIEPEELER-PARENT","","","","","","","","","","","","","","","","","","","","","","","","Universal Handy Helpers Fruit and Vegetable Peeler Dishwasher Safe (2 Colors)"
"SON-AORUBZ500FR-11-BLCK","","","","","","","","","","","","","","","","","","","","","","","","ASR Outdoor 360 Degree Standard Plug-in UV Light Bug Zapper Metal Hanging Hook"
"LST-KARAOKE-KEYBOARD-A57","LST-KARAOKE-KEYBOARD-PARENT","","","","","","","","","","","","","","","","","","","","","","","KidPlay Products Little Pianist Singing Musical Karaoke Keyboard Lights Up Blue"
"LST-KPKO-DANCEDINO-JQ2210-GRN","LST-KPKO-DANCEDINO-JQ2210-PARENT","","","","","","","","","","","","","","","","","","","","","","","Kidplokio RC Remote Control Dinosaur T Rex Toys for Boys, LED Lights Sounds, Green, Ages 3+"
"LST-PICNICFOOD-XJ330Z-8","","Chef","","Child","1 Pack","","","","","","","","","","","","","","","","","","","Kidplokio Kids Pretend Play Food Set Fun Picnic Plastic Food Utensils Assorted, Multicolor, Ages 3+"
"MCN-AKUADIVEKNIFE-BLACK","MCN-AKUADIVEKNIFE-PARENT","","","","","","","","","","","","","","","","","","","","","","","Akua Dive Knife with Tang Blunt Tip Blade and Sheath Water Sport - Black"
"MCN-AQUASEAL-PARENT","","","","Adult","","","","","","","","","","","","","","","","","","","","Gear Aid Aquaseal Aquaseal FD Flexible Durable Repair Adhesive Sealant"
"MCN-BURIDIVEKNIFE-PARENT","","","","","","","","","","","","","","","","","","","","","","","","Tactical Buri Multipurpose Utility Dive Knife 8 Inch (2 Colors)"
"MCN-DOWNCLEANER-GALLON","MCN-REVIVEXDOWNCLEANER-PARENT","","","","","","","","","","","","","","","","","","","","","","","Gear Aid Revivex Down Cleaner Gentle Formula Outerwear Gear Repair 1 Gallon"
"MCN-ELSTIC-SHOCKCORD-HPNR","","","","Adult","","","","","","","","","","","","","","","","","","","","GEAR AID Elastic Shock Cord for Tent Poles and Jackets, 84"", Black"
"MCNETT-MICROTERRY-TOWEL-4009-BUN-1","","","","","","","","","","","","","","","","","","","","","","","","GEAR AID Quick Dry Microfiber Towel for Travel, Camping and Sports, OD Green, M, 20"" x 40"""
"MCN-GADWNCLN10OZ-10OZ-HVAR","MCN-REVIVEXDOWNCLEANER-PARENT","","","","","","","","","","","","","","","","","","","","","","","Gear Aid ReviveX Down Cleaner"
"MCN-GAMEAACCRA-3PC-SML-CLR","","","","Adult","","","","","","","","","","","","","","","","","","","","Gear Aid Aquaseal Cotol-240 Combo Repair Glue Adhesive Outdoor Rec"
"MCN-GAMEAACCRA-3PC-SML-CLR-PARENT","","","","","","","","","","","","","","","","","","","","","","","","GEAR AID Aquaseal FD Flexible Durable Repair Adhesive and Cure Accelerator"
"MCN-GARDWP10OZ-10OZ-CLR-3","MCN-WATERPROOFSPRAY-PARENT","","","","","","","","","","","","","","","","","","","","","","","Gear Aid Revivex Durable Water Proofing 10oz"
"MCN-GARDWR-169OZ-36226","","","","Adult","","","","","","","","","","","","","","","","","","","","GEAR AID Revivex Durable Water Repellent (DWR) Spray for Reproofing Jackets, 16.9 fl oz"
"MCN-GARNASFWAWK-KIT-PARENT","","","","","","","","","","","","","","","","","","","","","","","","Gear Aid Revivex Suede and Fabric Boot Care Kit"
"MCN-GARPC10OZ-10OZ-36299","","","","Adult","","","","","","","","","","","","","","","","","","","","Gear Aid ReviveX Pro Cleaner for Outdoor Equipment and Clothing - 10 oz"
"MCN-GARSOWFP4OZ-4OZ","MET-GEARAIDREVIVEXSPRAY-PARENT","","","","","","","","","","","","","","","","","","","","","","","Gear Aid ReviveX Spray On Waterproofing Footware Protection Outdoor Rec - 4 oz"
"MCN-GARVXDCDWEMRP-BNDL-AMZ","","","","","","","","","","","","","","","","","","","","","","","","GEAR AID Revivex Down Care Kit for Jackets and Sleeping Bags, with Down Cleaner, Water Repellent and Repair Patches"
"MCN-GARVXDCMRP-BNDL-AMZ","","","","Adult","","","","","","","","","","","","","","","","","","","","GEAR AID Revivex Down Care Kit for Jackets and Sleeping Bags, with Down Cleaner and Repair Patches"
"MCN-GARVXPCDWEMRP-BNDL-AMZ","","","","Adult","","","","","","","","","","","","","","","","","","","","GEAR AID 3pc Care Kit with Revivex Pro Cleaner, Revivex Durable Water Repellent Spray and Tenacious Tape Mini Patches"
"MCN-GARVXPC-DWP169OZ-BNDL-AMZ","","","","Adult","","","","","","","","","","","","","","","","","","","","GEAR AID 2pk Outerwear Kit with Revivex Pro Cleaner and Revivex Durable Water Repellent Spray, 16.9 fl oz"
"MCN-GARVXPCDWP-BNDL-AMZ","","","","Adult","","","","","","","","","","","","","","","","","","","","GEAR AID Care Kit with Revivex Pro Cleaner and Revivex Durable Water Repellent Spray"
"MCN-GARVXPCWIWBP-BNDL-AMZ","","","","Adult","","","","","","","","","","","","","","","","","","","","GEAR AID Care Kit with Revivex Pro Cleaner, Revivex Wash-In Water Repellent and Tenacious Tape Mini Patches"
"MCN-GASSRASS-2OZ","MCN-SEAMGRIPFC-PARENT","","","","","","","","","","","","","","","","","","","","","","","GEAR AID Seam Grip FC Fast Cure Sealant for Tents, Clear, 2 fl oz"
"MCN-GASSRASS-2OZ-BUN-2PK","MCN-SEAMGRIPFC-PARENT","","","","","","","","","","","","","","","","","","","","","","","GEAR AID Seam Grip FC Fast Cure Sealant for Tents, Clear, 2 fl oz, 2 Pack"
"MCN-GATTMRPBAC-6PC-BLK","","","","Adult","","","","","","","","","","","","","","","","","","","","GEAR AID Tenacious Tape Mini Patches to Repair Jackets, Tents and Rain Gear, Black, 1.5""x2.5"""
"MCN-GATTMCFSTP-2PC-3X5-CLR-PARENT","","","","","","","","","","","","","","","","","","","","","","","","GEAR AID Tenacious Tape Flex Patches for Vinyl and Fabric Repair, Clear"
"MCN-GATTMRPC-6PC-3X5-CLR","","","","Adult","","","","","","","","","","","","","","","","","","","","GEAR AID Tenacious Tape Mini Patches to Repair Jackets, Tents and Rain Gear, Clear, 1.5""x2.5"""
"MCN-IMFRKSDWR-3PC-10X6-BLCK-PARENT","","","","","","","","","","","","","","","","","","","","","","","","GEAR AID Wetsuit Repair Kits with Iron-On Neoprene Patch, Fix Seams and Tears"
"MCN-MEMNORABC-2OZ-CLR-2","","","","Adult","","","","","","","","","","","","","","","","","","","","Gear Aid Revivex Odor Eliminator, for Tents, Footwear and Sports Gear, 2 fl oz"
"MCN-MGAIWS","","","","Adult","","","","","","","","","","","","","","","","","","","","Gear Aid ReviveX Instant Waterproofing Spray for Outdoor Clothing Camping"
"MCN-MGARBDSB-1-BLCK","","","","Adult","","","","","","","","","","","","","","","","","","","","GEAR AID Dual Snap Bar Buckle, 1"""
"MCN-MGARBS-4O-CLR","","","","Adult","","","","","","","","","","","","","","","","","","","","Gear Aid Rubber Boot Saver with UV Protection Outdoor Shoe Care Repair - Clear"
"MCN-MGARWRLGAC-4O","","","","Adult","","","","","","","","","","","","","","","","","","","","Gear Aid ReviveX Water Proofing Conditioning Gel for Leather Outdoor Footwear"
"MCN-MGAUCA25O-SML","","","","Adult","","","","","","","","","","","","","","","","","","","","GEAR AID Aquaseal UV Adhesive for Instant Wader and Drysuit Repair, 0.25 oz"
"MCN-MGAUSS7STRAND-15-MCH","","","","","","","","","","","","","","","","","","","","","","","","Gear Aid Ultra Strong 7-Strand 550 Paracord for Outdoor Camping Hiking Survival"
"MCN-MGAZP-2E-BLCK","","","","Adult","","","","","","","","","","","","","","","","","","","","GEAR AID Zipper Pulls, Set of 2"
"MCN-MMEBLBCC10O-10OZ-3","","","","","","","","","","","","","","","","","","","","","","","","BC Life BCD cleaning and maintenance 10 oz"
"MCN-MMESBDMPT125OZ-2","","","","Adult","","","","","","","","","","","","","","","","","","","","GEAR AID Sea Buff Dive Mask and Slate Cleaner, 1.25 fl oz"
"MCN-MMESC4OZNCB","","","","Adult","","","","","","","","","","","","","","","","","","","","GEAR AID Aquaseal NEO Contact Cement for Neoprene and Wetsuit Repair, 4 fl oz"
"MCN-MMESG14OPMARL","","","","","","","","","","","","","","","","","","","","","","","","Silicone O Ring Valve Protection Grease for Diving Gear - 1/4 oz"
"MCN-MOMUAQDGTNBX-2PC-35X62-NVYBL","MCN-COMPACTTOWEL-PARENT","","","","","","","","","","","","","","","","","","","","","","","Microfiber Ultra Absorbent Quick Dry Gym Towel Outdoor - Navy Blue XL"
"MCN-MRLBCCC-4OZ","","","","Adult","","","","","","","","","","","","","","","","","","","","ReviveX Leather Boot Care Waterproof Cleaner Outdoor Recreation Repair - 4 oz"
"MCN-MTCARTRC-5FT-CLR-PARENT","","","","","","","","","","","","","","","","","","","","","","","","GEAR AID Tenacious Tape Repair and Seam Tape for Tents and Vinyl"
"MCN-MTODLCS25OWCC-2PC-C-CLR","","","","Adult","","","","","","","","","","","","","","","","","","","","GEAR AID Op Drops Anti-Fog and Lens Cleaner for Eyewear and Optics, 0.25 oz"
"MCN-MUTPARMSDGS4OZ-4OZ-CLR-4","","","","Adult","","","","","","","","","","","","","","","","","","","","Gear Aid UV Tech Protectant And Rejuvenator Marine Scuba Diving Gear 4oz"
"MCN-ODORELIMINATOR-GALLON","","","","","","","","","","","","","","","","","","","","","","","","Gear Aid Revivex Odor Eliminator for Tents, Footwear and Sports Gear, 1 Gallon"
"MCN-ODORREMOVER-10OZ-AMZN","MCN-ODORELIMINATOR-PARENT-PZ","","","Adult","","","","","","","","","","","","","","","","","","","","Gear Aid Revivex Odor Eliminator,10oz"
"MCN-PCXHD-1100-BLCK-RFLCT-100FT-BUN","MCN-PCXHD-1100-BLCK-RFLCT-PARENT","","","","","","","","","","","","","","","","","","","","","","","Gear Aid Paracord and Carabiner 5.5 mm Heavy-Duty Cord for Camping - 100 Feet"
"MCN-POSHDFGCMWS-2PC-C-BLCK-AMZN","","","","Adult","","","","","","","","","","","","","","","","","","","","GEAR AID Snap Hooks, Set of 2"
"MCN-PROCLEANER-GALLON","","","","Adult","","","","","","","","","","","","","","","","","","","","Gear Aid Revivex Pro Cleaner for Synthetic Fabrics Outerwear Repair 1 Gallon"
"MCN-REVIVX-SEAMGRIPFC-BUNDLE-HPNR","","","","Adult","","","","","","","","","","","","","","","","","","","","GEAR AID 2pk Tent Waterproofing Spray and Sealer for Nylon Tents, Fast Cure Kit"
"MCN-REVIVX-SEAMGRIPTF-BUNDLE-HPNR","","","","Adult","","","","","","","","","","","","","","","","","","","","GEAR AID 2-Pack Bundle Tent Waterproofing Spray Kits for Nylon Tents"
"MCN-SEAGLD-AMZN-PARENT","","","","Adult","","","","","","","","","","","","","","","","","","","","Sea Gold Antifog Gel Dive Mask Care"
"MCN-SEAMGRIP-REPAIRKIT-PARENT","","","","","","","","","","","","","","","","","","","","","","","","GEAR AID Seam Grip WP Field Repair Kit for Tents and Outdoor Gear"
"MCN-SEAMGRIP-TF-PARENT","","","","","","","","","","","","","","","","","","","","","","","","Gear Aid Seam Grip TF Tent Fabric Sealer for Waterproofing"
"MCN-SEAMGRIPWP-PARENT","","","","","","","","","","","","","","","","","","","","","","","","GEAR AID Seam Grip WP Waterproof Sealant and Adhesive for Tents and Outdoor Fabric, Clear"
"MCN-SEAM-SEALANT-SILNYLON-PATCHES-BUN","","","","Adult","","","","","","","","","","","","","","","","","","","","Seam Grip SIL Silicone Sealant and Silnylon Patches for Silnylon Tents and Tarps"
"MCN-SSTSHDWS15OZ-SML-CLR","","","","Adult","","","","","","manual","","","","","","","","","","","","","","Seam Grip SIL Silicone Sealant for Silnylon Tents and Tarps, Clear, 1.5 oz"
"MCN-STRAP-TENDER-AMZN","","","","Adult","","","","","","","","","","","","","","","","","","","","GEAR AID Strap Tender for 1"" Webbing"
"MCN-TACMICRTERTOWEL-PARENT-HPN-2","","","","","","","","","","","","","","","","","","","","","","","","Gear Aid Tactical Ultra-Compact Microfiber Towel"
"MCN-TENACIOUSTAPE-PARENT-AMZ","","","","Adult","","","","","","","","","","","","","","","","","","","","Gear Aid Tenacious Tape Repair Tape for Fabric and Vinyl, 3"" x 20"""
