"sku","parent.sku","character_ebay","handle_material_ebay","age_group","style_ebay","blade_edge_type_amazon","recommended_age_range","voltage_ebay","dexterity_walmart","power_source","blade_length_ebay","care_instructions_amazon","occasion","capacity","blade_material_ebay","ingredients_amazon","battery_technology_ebay","fill_material_type_amazon","sport_type_amazon","fragrance","fabric_type_amazon","formulation","frame_material","name"
"MCN-TENTAPE-GEARPATCHES-PARENT","","","","","","","","","","","","","","","","","","","","","","","","Gear Aid Tenacious Tape Gear Patches for Jacket, Tent and Outerwear Repair, 3"" x 20"""
"MCN-TTAPEREPAIRPATCHES-AMZ-PARENT","","","","Adult","","","","","","","","","","","","","","","","","","","","GEAR AID Tenacious Tape Mini Patches to Repair Jackets, Tents and Rain Gear, 1.5""x2.5"""
"MCN-TTAPE-SILNYLON-3X5-PARENT","","","","","","","","","","","","","","","","","","","","","","","","GEAR AID Tenacious Tape Silnylon Patches for Silicone Tent and Tarp Repair, 3""x5"""
"MCN-ULCOMMICFIBTOW-PARENT-HPN","","","","","","","","","","","","","","","","","","","","","","","","Ultra-Compact Microfiber Towel - Various Colors"
"MCN-WASH-IN-10-OZ-AMZN","","","","Adult","","","","","","","","","","","","","","","","","","","","Gear Aid Revivex Wash-In Water Repellent 10OZ"
"MCN-WASHINREPELLENT-GALLON","","","","","","","","","","","","","","","","","","","","","","","","Revivex Wash In Water Repellent Waterproof Fluid Non-toxic - 1 Gallon"
"MCN-ZIPPER-LUBE-91120","","","","","","","","","","","","","","","","","","","","","","","","GEAR AID Zipper Lubricant Wax for Tents, Drysuits, Soft Coolers and more, includes 2 sticks"
"MET-AIDREVIVEXWATERPROOFING-COMBOKIT-2","","","","","","","","","","","","","","","","","","","","","","","","Gear Aid Revivex Durable Water Proofing Combo Kit 10oz"
"MET-GEARAIDREVIVEXSPRAY-AMZN","MET-GEARAIDREVIVEXSPRAY-PARENT","","","","","","","","","","","","","","","","","","","","","","","GEAR AID Revivex Suede Protector and Fabric Water Repellent for Shoes and Boots, 4 fl oz, 2-pk"
"MET-WETSUITSHAMPOO-AMZN-HPN","","","","Adult","","","","","","","","","","","","","","","","","","","","GEAR AID Revivex Wetsuit and Drysuit Shampoo, Cleaner and Conditioner, 10 fl oz"
"MET-WETSUITSHAMPOO-ODOR-BUN","","","","Adult","","","","","","","","","","","","","","","","","","","","GEAR AID Wetsuit Cleaner and Conditioner for Neoprene, Odor Kit"
"NPT-8INPOCKETKNIFE-EAG","NPT-8INPOCKETKNIFE-PARENT","","","","","","","","","","","","","","","","","","","","","","","ASR Outdoor Back Lock Folding American Eagle Pocket Knife Collectible Gift, 8 inch"
"NPT-ASRO-9IN1SURVIVALKNIFE-BLK","","","","Adult","","","","","","","","","","","Stainless Steel","","","","","","","","","ASR Outdoor 9 in 1 Multitool Folding Pocket Knife with G10 Handle, Black"
"NPT-ASTKUNAI-6PC","","","","Adult","","","","","","","","","","","","","","","","","","","","ASR Outdoor 6 Piece 6.5 Inch Ninja Kunai Set Assorted Colors With Sheath Set"
"NPT-BEARKNIFE-BLACK","","","","Adult","","","","","","","Over 5in.","","","","Stainless Steel","","","","","","","","","ASR Outdoor Collectible Dagger Bowie Knife Etched Bear Sheath Ergonomic Handle"
"NPT-BLKKNIFE-HWT258RW","","","","Adult","","","","","","","","","","","","","","","","","","","","ASR Tactical Full Tang Clip Point Blade Slim Kydex Sheath Hook Handle - Rainbow"
"NPT-CHRKNIFE-HWT258CH","","","","Adult","","","","","","","","","","","","","","","","","","","","ASR Tactical Full Tang Clip Point Blade Slim Kydex Sheath Hook Handle - Chrome"
"NPT-EMSPOCKETKNIFE-ORG","","","Stainless Steel","Adult","","","","","","","","","","","","","","","","","","","","ASR Outdoor Camping EMS Emblem Pocket Knife Spring Assisted Serrated Tanto Blade Orange"
"NPT-HDCAHWSB-2PC-STD-BLCK","","","","Adult","","","","","","","","","","","","","","","","","","","","ASR Outdoor Heavy Duty Camp Axe Hatchet with Sheath- Survival Prep"
"NPT-OPENRESCUEKNIFE-SILVER","","","Stainless Steel","Adult","","","","","","","","","","","","","","","","","","","","ASR Outdoor 8.25 Inch Rescue Knife with Belt Clip Seat Belt Cutter"
"PARANECK-KNIFE-NEONGREEN","PARANECK-KNIFE-PARENT","","","","","","","","","","","","","","","","","","","","","","","ASR Tactical 6"" Survival Knife with Sheath 550 Paracord Wrapped Handle Full Tang Drop Point Fixed Blade, Green"
"SON-KCIPHAC-275-ASSRTD","SON-IDPILLHOLDER-PARENT","","","","","","","","","","","","","","","","","","","","","","","Mini Waterproof Container ID Pill Holder Vial  Key Chain with O Ring Seal (One Container)"
"SDT-HEAVYDUTYSTEADFASTBATTERIES","SON-HDASB-MED-BL-PARENT","","","","","","","","","","","","","","","","","","","","","","","Heavy Duty AA Steadfast Batteries - 12 Pack"
"SON-HDASB-MED-BL","SON-HDASB-MED-BL-PARENT","","","","","","","","","","","","","","","","","","","","","","","4pk Heavy Duty AA Steadfast Batteries"
"SHM-CERAMICMICROSTRIKER-WHT-STD","","","","Adult","","","","","","","","","","","","","","","","","","","","ASR Outdoor Ceramic Micro Striker Scraper Create Sparks Emergency Fire Starter White"
"SHM-PSHKBZTB-SML-BLCK","SHM-PSHKBZTB-SML-BLCK-PARENT","","","","","","","","","","","","","","","","","","","","","","","Zak Tool ZT14 Handcuff Key Universal Fit Police Pen Style Pocket Clip"
"SHM-KIDFUN-REFLECTIONPAPER","SHM-SPYPAPERPAD-PARENT-2","","","","","","","","","","","","","","","","","","","","","","","32 Sheet Disappearing Notebook Dissolving Message Note Pad - Reflection Paper"
"SON-100PKZIPLOCKBAG-PARENT","","","","Adult","","","","","","","","","","","","","","","","","","","","100pc Self Locking Plastic Bags 2mm Thick All Purpose Storage Baggies"
"SON-11ISCCMTWCC-20PC-SML-SLVR","","","","","","","","","","","","","","","","","","","","","","","","(20 Pack) ASR Outdoor 11 in 1 Multi Function Credit Card Sized Tool"
"SON-12X36IGMMSBM-12X36-GRN-SM-3","","","","","","","","","","","","","","","","","","","","","","","","12x36in Green Miners Moss 10mm Thick Sluice Box Matting Gold Prospecting - Small"
"SON-12X36IGMMSBM-12X36-GRY-SM-4","","","","","","","","","","","","","","","","","","","","","","","","12x36in Grey Miners Moss 10mm Thick Sluice Box Matting Gold Prospecting - Small"
"SON-13IPOCSCHS-3PC-13-SLVR-6PK","","","","","","","","","","","","","","","","","","","","","","","","6 Pack Portable Outdoor Camping Survival Wire Hand Saw With Two 35 cm Blades"
"SON-155BSSMRWZSS-155E-BLCK","","","","Adult","","","","","","","","","","","","","","","","","","","","15.5"" Black Stainless Steel Machete, Recurved Blade with Zigzag Serrated Spine"
"SON-15CPHTFMM-MED-BRWN","","","","","","","","","","","","","","","","","","","","","","","","Hardwood Handled 15"" Goldsmith Crucible Pot Holder With Adjustable Steel Tongs"
"SON-16FTHVMRR-16F-RD","SON-MARKINGRIBBON-PARENT","","","","","","","","","","","","","","","","","","","","","","","ASR Outdoor Hiking Gear 200ft High Visibility Marking Ribbon, Red"
"SON-20ITLWAC-10PC-STD-RD","","","","Adult","","","","","","","","","","","","","","","","","","","","10pc Insulated Test Lead Cable with Alligator Clips Colorful Set - 20 Inch"
"SON-AO8IBGRGTGP-8-GREEN","SON-GOLDMININGPAN-PARENT","","","","","","","","","","","","","","","","","","","","","","","ASR Outdoor 8 inch Gold Pan with Dual Riffles for Gold Prospecting, Green"
"SON-AO14IBGRGTGP-12-BL","SON-GOLDMININGPAN-PARENT","","","","","","","","","","","","","","","","","","","","","","","ASR Outdoor 14 inch Gold Pan with Dual Riffles for Gold Prospecting, Blue"
"SON-COLLAPSBUCKET-10L-OD-CB10L","","","","Adult","","","","","","","","","","","","","","","","","","","","ASR Outdoor Grey and White Silicone Collapsible 10L Water Container Gold Panning Bucket"
"SON-MEBH-10PC-SML-SLVR","","","","Adult","","","","","","","","","","","","","","","","","","","","Universal Tool 10 Pack of .25in Hex Shank Magnetic Bit Extension Holder for Power Tools"
"SON-35STORK-SCISSORS-IR-TT","","","","Adult","","","","","","","","","","","","","","","","","","","","ToolTreaux Straight Blade Stainless Steel Stork Embroidery Scissors - 3.5 Inch"
"SON-3IN1CAMP-UTENSIL-2PK","SON-3IN1CUSKFS-3PC-ONE-SLVR-PARENT","","","","","","","","","","","","","","","","","","","","","","","ASR Outdoor (2-Pack) Camping Utensil Set Army Military MRE Chow Set"
"SON-425SHTTNSB-425","","","","Adult","","","","","","","","","","","","","","","","","","","","Shear Scissors Blades Sharp Heat Treated Thread Nipper 4.25 inches"
"SON-45IPT-45-SLVR-2","","","","Adult","","","","","","","","","","","","","","","","","","","","4.5 Inch 4 Prong Metal Pick-Up Tool Hobby Crafts Jewelry Making with Case"
"SON-500-LUMEN-WORKLIGHT","","","","Adult","","","","","","","","","","","","","","","","","","","","Universal Tool - 500 Lumen 5w COB 12SMD - Multipurpose Emergency Work Light"
"SON-53HSSDB116IS-10PC-5316-SLVR","","","","Adult","","","","","","","","","","","","","","","","","","","","10pc #53 High Speed Steel Drill Bits 1/16 Inch Shank"
"SON-57HSSDB116IS-10PC-5716-SLVR","","","","Adult","","","","","","","","","","","","","","","","","","","","High Speed Steel Drill Bits 1/16 Inch Shank 10pc 57"
"SON-5INFOLDINGKNIFE-BLK","","","Stainless Steel","Adult","","","","","","","","","","","","","","","","","","","","ASR Outdoor Thumb Assisted Folding Knife Belt Clip Seat Belt Cutter Window Punch"
"SON-5INFOLDINGKNIFE-SLV","","","Stainless Steel","Adult","","","","","","","","","","","","","","","","","","","","ASR Outdoor Thumb Assisted Folding Knife Belt Clip Seat Belt Cutter Punch Silver"
"SON-ZAPPER-MP-4BL","","","","","","","","","","","","","","","","","","","","","","","","ASR Outdoor 360 Rechargeable All-Weather Mosquito Trap Bug Zapper Portable LED Lantern"
"SON-AO125IGPSSFGP-LG-ORG","SON-SANDSCOOPER-PARENT","","","","","","","","","","","","","","","","","","","","","","","ASR Outdoor 12.5 Inch Large Sand Scoop Plastic Trowel for Metal Detector Gold Panning, Orange"
"SON-6IBSPSSS-6-SLVR","","","","Adult","","","","","","","","","","","","","","","","","","","","Stainless Steel Scissors Heavy Duty 6 inch Blade Blunt Tip"
"SON-6MMWBHWBACA-BL","","","","Adult","","","","","","","","","","","","","","","","","","","","ASR Outdoor Universal Water Bottle Holder With Blue Aluminum Carabiner Clip Attachment"
"SON-7DCFFS6DG-6PC-7E-RD","","","","Adult","","","","","","","","","","","","","","","","","","","","ToolTreaux 6 Piece Diamond Coated Flat File Set, Steel Files Assorted Grits 6pc"
"SON-7SNFBT-STD-SLVR","","","","Adult","","","12+","","","","","","","","","","","","","","","","","7 Inch Sapphire Nail File Home Manicure Pedicure Tool Beauty and Personal Care"
"SON-82SSSS-BUN-HPN","","","","Adult","","","","","","","","","","","","","","","","","","","","8"" 2 Sided Knife Blade Sharpener Sharpening Stone"
"SON-ABCBFER-SML-SLVR","","","","Adult","","","","","","","","","","","","","","","","","","","","Universal Tool 30 Piece Assorted Button Cell Batteries for Electronic Repairs"
"SON-ACIDBRUSHSET-12PC","","","","Adult","","","","","","","","","","","","","","","","","","","","Universal Tool Acid Brush Set 6 Inch Metal Handle Apply Glues Hard Bristle 12pc"
"SON-ANGULAR-SCISSORS","","","","Adult","","","","","","","","","","","","","","","","","","","","Embroidery Shears Sewing Tailors Sharp Scissors Craft and Hobby Kelly Angular"
"SON-FFKWSAFH6I-2PC-6","","","","Adult","","","","","","","3 - 3.49in.","","","","Stainless Steel","","","","","","","","","ASR Outdoor Fishing Fillet Knife Hard Sheath and Floating Handle, 6 inch Blade"
"SON-AO10IBGRGTGPDR-10-BL","SON-GOLDMININGPAN-PARENT","","","","","","","","","","","","","","","","","","","","","","","ASR Outdoor 10 inch Gold Pan with Dual Riffles for Gold Prospecting, Blue"
"SON-AO125IBPSSFGP-LG-BL","SON-SANDSCOOPER-PARENT","","","","","","","","","","","","","","","","","","","","","","","ASR Outdoor 12.5 Inch Prospecting Large Sand Scoop Plastic Trowel for Metal Detector Gold Panning, Blue"
"SON-AO14IBGRGTGP-12-BLCK","SON-GOLDMININGPAN-PARENT","","","","","","","","","","","","","","","","","","","","","","","ASR Outdoor 14 inch Gold Pan with Dual Riffles for Gold Prospecting, Black"
"SON-AO155IMWSAH-155-BLCK-2","","","","Adult","","","","","","","Over 5in.","","","","Stainless Steel","","","","","","","","","ASR Outdoor Stainless Steel Machete 15.5 Inch Serrated Blade Paracord Handle"
"SON-AO155IMWSAH-155-BLCK-WSH","","","","","","","","","","","","","","","","","","","","","","","","ASR Outdoor Stainless Steel Machete 15.5 Inch Serrated Blade Paracord Handle"
"SON-AO15IPHCT-15-CHRM","","","","Adult","","","","","","","","","","","","","","","","","","","","ASR Outdoor 15 Inch Metalworking Ceramic Crucible Tongs Melt Precious Metals"
"SON-AO6MMSSBBSS-6MM-CHRM","","","","Adult","","","","","","","","","","","","","","","","","","","","ASR Outdoor 6mm Sling Shot Ball Bearings Steel 50 Piece Set"
"SON-AO85IGPSSFGP-LG-GRN-HPNR","","","","","","","","","","","","","","","","","","","","","","","","SE GP3-SS20 Prospector Series Green Sand Scoop for Metal Detecting"
"SON-AO85IGPSSFGP-SCOOP-LG-GRNE","SON-SANDSCOOPER-LARGE-PARENT","","","","","","","","","","","","","","","","","","","","","","","ASR Outdoor Large Sifting Scoop Pay Dirt Hand Trowel for Gold Panning - Green"
"SON-AOBRGFGP-2PC-ONE-BLCK-HPNR","","","","","","","","","","","","","","","","","","","","","","","","SE GP3-RG60 Prospector's Choice Gold Panning Rubber Gloves"
"SON-AOLWSC-55E-OPQ","","","","Adult","","","","","","manual","","","","","","","","","","","","","","ASR Outdoor Large Translucent Waterproof Camping Storage Container - 5.5 Inch"
"SON-AOPAKR-SML-SLVR","","","","Adult","","","","","","","","","","","","","","","","","","","","ASR Outdoor Brass Body Nickel Plated Pull Apart Key Ring Travel Accessory"
"SON-AOPMTSFGP-SML-GRY-HPNR","","","","","","","","","","","","","","","","","","","","","","","","SE JT-GT26 Small Precious Metal Testing Stone"
"SON-AOSBFS-10-BLCK","","","","","","","","","","","","","","","","","","","","","","","","ASR Outdoor Single Band Folding Slingshot Molded Grip Leather Pouch"
"SON-AOSPRB100F-100F-BLCK","SON-550PARACORDROPE-PARENT","","","Adult","","","","","","","","","","","","","","","","","","","","Survival Multi-Purpose Paracord Rope Black - 100 ft"
"SON-AOSPROG100F-100F-ODGRN","SON-550PARACORDROPE-PARENT","","","Adult","","","","","","","","","","","","","","","","","","","","Survival Multi-Purpose Paracord Rope OD Green- 100 ft"
"SON-AOSPRORT100FT-100FT-RFLCTVORNG","","","","","","","","","","","","","","","","","","","","","","","","Survival Multi-Purpose Paracord Rope Reflective Tracer Orange - 100ft"
"SON-AOTFSSMFOU23I-23-BLCK","","","","","","","","","","","","","","","","","","","","","","","","ASR Outdoor Tri Fold Steel Shovel Multi Functional Outdoor Use 23 Inch"
"SON-AOUFDSVHVLG-ONE-GRN","","","","","","","","","","","","","","","","","","","","","","","","Safety Disposable Vest High Visibility One Size Fits Most Lime Green"
"SON-FOLDINGSLUICEBOX-SLV","","","","Adult","","","","","","","","","","","","","","","","","","","","ASR Outdoor 50"" Gold Sluice Box Folding Aluminum Gold Prospecting Equipment"
"SON-IFESFS-STD-BLCK","","","","Adult","","","","","","","","","","","","","","","","","","","","ASR Outdoor Emergency Pocket Instant Lighter Fire Stick Starter Survival Tool with Keychain and Compass"
"SON-BEADCRIMPPLIER-BLUE","","","","Adult","","","","","","","","","","","","","","","","","","","","Universal Hobby Mini Bead Crimping Pliers Carbon Steel Jewelry Making Tool"
"SON-BFTOUMT-MED-BLCK","","","","Adult","","","","","","","","","","","","","","","","","","","","ASR Outdoor Barbecue Fork Extendable Metal Dual Prong Fire Cooking Utensil"
"SON-BLACKSTRETCHBALLS-100PK-8IN","","","","Adult","","","","","","","","","","","","","","","","","","","","Universal Tool 100 Pack Black Stretch Cord with Black Ball 8 Inch Length"
"SON-BLE-BBQMATS-BLK-2PC","","","","Adult","","","","","","","","","Father's Day, Christmas, Gifts for Dad","","","","","","","","","","","Beille Black BBQ Grill Accessories Reusable Non Stick Grilling Mats 13 x 15 Inch, 2pk"
"SON-CABLE-TIES-CT4B","","","","Adult","","","","","","","","","","","","","","","","","","","","Universal Home 100 Count 4"" Cable Wire Hose Zip Ties"
"SON-CENTERPUNCH-BRS","","","","Adult","","","","","","","","","","","","","","","","","","","","Utopia's Automatic Center Punch Gold"
"SON-CHASHING-HAMMER-8331JH","","","","Adult","","","","","","","","","","","","","","","","","","","","Universal Tool Chasing and Goldsmith Hammer 1 and 5/8 inch Diameter DIY Crafting"
"SON-CINEMA-LIGHTBOX-20BX","","","","Adult","","","","","","","","","","","","","","","","","","","","Universal Hanging Cinema String Light Boxes With 90 Characters - 20 Light Boxes"
"SON-COBHEADLAMP-100LUM","","","","Adult","","","","","","","","","","","","","","","","","","","","ASR Outdoor Slim 3-Stage Headlamp Ultrabright 150 Lumen COB Flood Light"
"SON-COMPANIONWHISTLES-ORG","","","","Adult","","","","","","","","","","","","","","","","","","","","ASR Outdoor Hiking Companion Whistles Emergency Survival Tools 105 dB Rating"
"SON-CUTBRD12X15-VARZ-4PK","SON-CUTBRD12X15-VARRZ-PARENT-2IH","","","Adult","","","","","","","","","","","","","","","","","","","","(4 Pack) Thin Clear Flexible Cutting Board Mat 12 x 15 inch"
"SON-DAMAGEDSCREWEXTRACTOR-4PC","","","","Adult","","","","","","","","","","","","","","","","","","","","Universal Tool Damaged Screw Extractor Set - 4 Pieces Assorted Sizes"
"SON-DBSRT-12PC-SML-SLVR-IR-TT","","","","Adult","","","","","","","","","","","","","","","","","","","","ToolTreaux Diamond Coated Cutting Burrs Set Assorted Rotary Tools 12pc 150 Grit"
"SON-DBSRT40G-50PC-STD-YLLW","SON-DIAMONDBURRBITSET-PARENT","","","","","","","","","","","","","","","","","","","","","","","50pc Diamond Burr Set for Rotary Tool, 40 Grit"
"SON-DIAMONDHOLESAW-80GRT","","","","Adult","","","","","","","","","","","","","","","","","","","","10pc Diamond Coated Hole Saw Set for Glass and Stone, 80 Grit"
"SON-DKBSBS-3PC-SML-ASSRTD","","","","Adult","","","","","","","","","","","","","","","","","","","","3 Piece Universal Diamond Knife and Blade Sharpening Block Set"
"SON-DOUBLEENDEDSTEELSPATULA","","","","Adult","","","","","","","","","","","","","","","","","","","","Universal Tool Double Ended Stainless Steel Spatula"
"SON-DTCBAU-12PC-SML-WHT-2","","","","","","","","","","","","","","","","","","","","","","","","(12 Pack) Disposable Towels Compact Compressed Biodegradable and Unscented"
"SON-EIGHT-PC-STENCIL","","","","Adult","","","","","","","","","","","","","","","","","","","","8 Pc Template Stencil Set Drawing Kit in Assorted Shapes"
"SON-EXTEND-FLYSWATTER-ASSRT","","","","Adult","","","","","","manual","","","","","","","","","","","","","","ASR Outdoor Extendable Insect Bug Fly Swatter Durable Telescopic Pole Anti Slip"
"SON-EXTEND-FLYSWATTER-RED","","","","Adult","","","","","","","","","","","","","","","","","","","","ASR Outdoor Extendable Insect Bug Fly Swatter Durable Telescopic Pole Anti Slip"
"SON-FIRSTAIDKIT-100PC","","","","Adult","","","","","","","","","","","","","","","","","","","","ASR Outdoor First Aid Kit in Waterproof Dry Sack Emergency Supplies 100 Pieces"
"SON-FLEXIDUSTER-GRN","SON-FLEXIDUSTER-PARENT","","","","","","","","","","","","","","","","","","","","","","","Extendable Flexible Feather Duster For Home And Office Cleaning - Green"
"SON-OTRSCMP-STD-YLLW","","","","Adult","","","","","","","","","","","","","","","","","","","","ASR Outdoor Thermal Mat Heat Reflective Camping Sleeping Pad Insulated Winter Chill"
"SON-FOLDINGSLUICEBOXBACKPACK-BUN","SON-FOLDINGSLUICEBOX-PARENT","","","","","","","","","","","","","","","","","","","","","","","ASR Outdoor 50"" Aluminum Folding Sluice Box for Gold Prospecting Backpack Kit, Black"
"SON-GOLDKITCOP-7PC-KIT-EBAY-HPN","","","","","","","","","","","","","","","","","","","","","","","","7pc Gold Panning Kit 1/4 Mesh Classifier, 14"" & 10"" Green Gold Pans, 2 vials, Sniffer Bottle, Tweezers With Magnefier"
"SON-GOLDMAT-GP-SB35-MAT","","","","Adult","","","","","","","","","","","","","","","","","","","","ASR Outdoor Rubber Riffled Gold Sluice Box Matting for Gold Recovery, 27x10 inch"
"SON-GOLDMAT-GP-SB35-MAT-AMZ-HPN","","","","","","","","","","","","","","","","","","","","","","","","SE GP-SB35-MAT Prospector's Choice 10"" x 27"" Trimmable Riffled Sluice Box Matting"
"SON-GOLDSANDSCOOP-BLACK-HPNR","","","","Adult","","","","","","","","","","","","","","","","","","","","SE GP3-SS20 Series Prospector's Choice Plastic Sand Scoop For Metal Detecting"
"SON-GOLDSANDSCOOP-ORANGE-HPNR","","","","Adult","","","","","","","","","","","","","","","","","","","","SE GP3-SS20 Series Prospector's Choice Plastic Sand Scoop For Metal Detecting"
"SON-GOLDS-LARGE-SCOOP-BLK","SON-SANDSCOOPER-LARGE-PARENT","","","","","","","","","","","","","","","","","","","","","","","ASR Outdoor Large Sifting Scoop Pay Dirt Hand Trowel for Gold Panning - Black"
"SON-GOLDS-LARGE-SCOOP-ORNG","SON-SANDSCOOPER-LARGE-PARENT","","","","","","","","","","","","","","","","","","","","","","","ASR Outdoor Metal Detector 8.5 inch Heavy Duty Large Plastic Sand Scoop for Metal Detecting, Orange"
"SON-GR6ISPP40HSI-6IN-GRN-HPNR","","","","","","","","","","","","","","","","","","","","","","","","SE GP4-40 5.5"" Mini Stackable Sifting Pan, 40 Holes/Square Inch"
"SON-GRAPHITECRUCIBLES-PARENT","","","","Adult","","","","","","","","","","","","","","","","","","","","Universal Tool Graphite Crucible for Melting Gold and Silver (2 Sizes)"
"SON-GRAYDUCTTAPE-30FT","","","","Adult","","","","","","","","","","","","","","","","","","","","Universal Tool 30ft Roll Gray Duct Tape 2 Inch Wide Adhesive Gear"
"SON-GRCSS20HPSI-6-GRN-HPNR","","","","","","","","","","","","","","","","","","","","","","","","SE GP4-20 5.5"" Mini Stackable Sifting Pan, 20 Holes/Square Inch"
"SON-GRCSS30HPSI-6-GRN-1","","","","","","","","","","","","","","","","","","","","","","","","Gold Rush Sifting Classifier Sieve Mini 6 Inch Prospect Pan 30 Holes per Sq Inch"
"SON-GUNCLEANKIT-24PC","","","","Adult","","","","","","","","","","","","","","","","","","","","24 Piece Set ASR Outdoor Gun Cleaning Kit Brass Punches Brushes and Patches"
"SON-GUNCLMAT-18IN","","","","Adult","","","","","","","","","","","","","","","","","","","","American Flag Non-Slip Gun and Electronics Cleaning Mat Washable 18 Inch"
"SON-HALSAST40I34WB-2PC-40-BLCK","","","","Adult","","","","","","","","","","","","","","","","","","","","Hook and Loop Self Adhesive Sewing Tape 40 Inch 3/4 Wide for Arts Crafts - Black"
"SON-HHMHDSS4XM-5X3X25","","","","","","","","","","","","","","","","","","","","","","","","Helping Hand Magnifier Heavy Duty Soldering Station - 4x Magnification"
"SON-HOOKSNPICKS-6PC","","","","Adult","","","","","","","","","","","","","","","","","","","","ToolTreaux Hook and Pick Precision Automotive Tool Set Puller Removers 6 Pieces"
"SON-HSSSBAM-2PC-SLVR","","","","Adult","","","","","","","","","","","","","","","","","","","","2pc Mini High Speed Steel Saw Blade And Mandrel 1/4 Inch Arbor Size .8mm"
"SON-HTSSS-5PC-SML-GRY","","","","","","","","","","","","","","","","","","","","","","","","Universal 5pc Hobby Tweezer Set Stainless Steel"
"SON-HTSSS-5PC-SML-GRY-2","","","","Adult","","","","","","","","","","","","","","","","","","","","5pc Universal Tweezer Set Stainless Steel, 5"""
"SON-ICE-TEMPERED-SCISSOR-SP102","","","","Adult","","","","","","","","","","","","","","","","","","","","Universal Tool Ice Tempered S Steel Salon Hairdressing Barber Scissor 5.5 inch"
"SON-ICE-TEMPERED-SCISSOR-SP102-4PK","","","","","","","","","","","","","","","","","","","","","","","","4 Pack Universal Tool Tempered Steel Salon Hairdressing Barber Scissor 5.5 inch"
"SON-ICE-TEMPERED-SCISSOR-SP105","","","","Adult","","","","","","","","","","","","","","","","","","","","Universal Tool Ice Tempered S Steel Salon Hairdressing Barber Scissor 7.5 inch"
"SON-J65XCKCWHGB-XL-BL-2","","","","","","","","","","","","","","","","","","","","","","","","Jumbo 6.5"" XL Carabiner Key Chain With Hand Grip - Blue"
"SON-J65XCKCWHGCS-XL-SLVR-3","SON-CARABINERSJUMBO-PARENT","","","","","","","","","","","","","","","","","","","","","","","7-3/4"" Jumbo Aluminum Carabiner - Chrome Silver"
"SON-JAROPENER-BJ094","","","","Adult","","","","","","","","","","","","","","","","","","","","Beille Rubber 4 in 1 Non Slip Multipurpose Adjustable Easy Grip Jar Opener Tool"
"SON-JEWELERSSAWBLADES04-144PK","","","","Adult","","","","","","","","","","","","","","","","","","","","ToolTreaux 144pc Jewelry Saw Blades Set 0/3 Size 5.25"" 50 TPI Steel"
"SON-JEWELLOUPE-10XP-TT","SON-JEWELLOUPE-10X-PARENT-TT","","","Adult","","","","","","","","","","","","","","","","","","","","ToolTreaux 10X Jewelers Loupe 25mm Diameter Glass Lens Magnifier Plastic"
"SON-JUMBOTWEEZER-4PC-IR-TT","","","","Child","","","","","","","","","","","","","","","","","","","","ToolTreaux Stainless Steel Jumbo Tweezer Set Serrated Tips Secure Grip - 3pc"
"SON-LSTTSWC1210A8I-4PC-14X4X25-SLVR","","","","Child","","","","","","","","","","","","","","","","","","","","3pc Large Serrated Tweezer Tong Set with Case 12, 10, and 8 Inch"
"SON-LEDWORKLIGHT-LARGE-BLACKORANGE","","","","Adult","","","","","","","","","","","","","","","","","","","","750 Lumen Durable Portable Work Light Indoor Outdoor Multi Use Black"
"SON-LIGHT-FL8825-12COB","","","","Adult","","","","","","","","","","","","","","","","","","","","ASR Outdoor 3 Stage Super Bright Hanging Puck Light,  240 Lumen COB LED"
"SON-MINERMOSS-12X36BLU-HPNR","","","","","","","","","","","","","","","","","","","","","","","","SE GP-MT415-3BL 12"" x 36"" Blue Miner's Moss (Sluice Box Matting)"
"SON-MINERMOSS-12X36GRN-HPNR","","","","","","","","","","","","","","","","","","","","","","","","SE GP-MT415-2GG 12"" x 36"" Green Miner's Moss (Sluice Box Matting)"
